title,link,date
Exploring options to resolve land and sea use competition,"ec.europa.eu/info/funding-tenders/opportunities/portal/screen/opportunities/topic-details/HORIZON-CL6-2025-03-GOVERNANCE-05?isExactMatch=true&status=31094501,31094502,31094503&order=DESC&pageNumber=6&pageSize=100&sortBy=startDate",2025-09-24
Restoring Ocean and Waters on Islands,"ec.europa.eu/info/funding-tenders/opportunities/portal/screen/opportunities/topic-details/HORIZON-MISS-2025-03-OCEAN-06?isExactMatch=true&status=31094501,31094502,31094503&order=DESC&pageNumber=5&pageSize=100&sortBy=startDate",2025-09-24
RFCS-2025 Coal Pilot and Demonstration Projects,"ec.europa.eu/info/funding-tenders/opportunities/portal/screen/opportunities/topic-details/RFCS-2025-01-PDP?isExactMatch=true&status=31094501,31094502,31094503&order=DESC&pageNumber=2&pageSize=100&sortBy=startDate",2025-09-24
Upscaling innovative payments to support farmers in the delivery of agri-environment-climate public goods,"ec.europa.eu/info/funding-tenders/opportunities/portal/screen/opportunities/topic-details/HORIZON-CL6-2025-03-GOVERNANCE-02?isExactMatch=true&status=31094501,31094502,31094503&order=DESC&pageNumber=6&pageSize=100&sortBy=startDate",2025-09-24
RFCS-2025 Coal Accompanying Measures,"ec.europa.eu/info/funding-tenders/opportunities/portal/screen/opportunities/topic-details/RFCS-2025-01-AM?isExactMatch=true&status=31094501,31094502,31094503&order=DESC&pageNumber=2&pageSize=100&sortBy=startDate",2025-09-24
RFCS-2025 Steel Research Projects,"ec.europa.eu/info/funding-tenders/opportunities/portal/screen/opportunities/topic-details/RFCS-2025-02-RPJ?isExactMatch=true&status=31094501,31094502,31094503&order=DESC&pageNumber=2&pageSize=100&sortBy=startDate",2025-09-24
Boosting the attractiveness of agriculture and the connection between the farming community and society,"ec.europa.eu/info/funding-tenders/opportunities/portal/screen/opportunities/topic-details/HORIZON-CL6-2025-03-GOVERNANCE-03?isExactMatch=true&status=31094501,31094502,31094503&order=DESC&pageNumber=6&pageSize=100&sortBy=startDate",2025-09-24
#BeActive-EU-SPORT-AWARDS-Volunteering,"ec.europa.eu/info/funding-tenders/opportunities/portal/screen/opportunities/topic-details/ERASMUS-SPORT-2025-EU-AWARDS-VOLUNTEERING?isExactMatch=true&status=31094501,31094502,31094503&order=DESC&pageNumber=3&pageSize=100&sortBy=startDate",2025-09-24
#BeActive-EU-SPORT-AWARDS - Across generations,"ec.europa.eu/info/funding-tenders/opportunities/portal/screen/opportunities/topic-details/ERASMUS-SPORT-2025-EU-AWARDS-GENERATIONS?isExactMatch=true&status=31094501,31094502,31094503&order=DESC&pageNumber=3&pageSize=100&sortBy=startDate",2025-09-24
RFCS-2025 Coal Research Projects,"ec.europa.eu/info/funding-tenders/opportunities/portal/screen/opportunities/topic-details/RFCS-2025-01-RPJ?isExactMatch=true&status=31094501,31094502,31094503&order=DESC&pageNumber=2&pageSize=100&sortBy=startDate",2025-09-24
#BeActive-EU-SPORT-AWARDS – Inclusion,"ec.europa.eu/info/funding-tenders/opportunities/portal/screen/opportunities/topic-details/ERASMUS-SPORT-2025-EU-AWARDS-INCLUSION?isExactMatch=true&status=31094501,31094502,31094503&order=DESC&pageNumber=3&pageSize=100&sortBy=startDate",2025-09-24
RFCS-2025 Steel Pilot and Demonstration Projects,"ec.europa.eu/info/funding-tenders/opportunities/portal/screen/opportunities/topic-details/RFCS-2025-02-PDP?isExactMatch=true&status=31094501,31094502,31094503&order=DESC&pageNumber=2&pageSize=100&sortBy=startDate",2025-09-24
#BeActive-EU-SPORT-AWARDS-Peace,"ec.europa.eu/info/funding-tenders/opportunities/portal/screen/opportunities/topic-details/ERASMUS-SPORT-2025-EU-AWARDS-PEACE?isExactMatch=true&status=31094501,31094502,31094503&order=DESC&pageNumber=3&pageSize=100&sortBy=startDate",2025-09-24
#BeActive-EU-SPORT-AWARDS – Physical activity,"ec.europa.eu/info/funding-tenders/opportunities/portal/screen/opportunities/topic-details/ERASMUS-SPORT-2025-EU-AWARDS-PHYSICAL-ACTIVITY?isExactMatch=true&status=31094501,31094502,31094503&order=DESC&pageNumber=3&pageSize=100&sortBy=startDate",2025-09-24
Women Leadership Category,"ec.europa.eu/info/funding-tenders/opportunities/portal/screen/opportunities/topic-details/HORIZON-EIT-2025-PRIZE-WIP-LEADERSHIP?isExactMatch=true&status=31094501,31094502,31094503&order=DESC&pageNumber=2&pageSize=100&sortBy=startDate",2025-09-25
POLREC AWARDS 2025,"ec.europa.eu/info/funding-tenders/opportunities/portal/screen/opportunities/competitive-calls-cs/11383?isExactMatch=true&status=31094501,31094502,31094503&order=DESC&pageNumber=2&pageSize=100&sortBy=startDate",2025-09-25
Women Innovators category,"ec.europa.eu/info/funding-tenders/opportunities/portal/screen/opportunities/topic-details/HORIZON-EIC-2025-PRIZE-WIP-WomenInnovatorsCategory?isExactMatch=true&status=31094501,31094502,31094503&order=DESC&pageNumber=2&pageSize=100&sortBy=startDate",2025-09-25
BlueLightS - 2nd Call for Blue Challenges in European Schools,"ec.europa.eu/info/funding-tenders/opportunities/portal/screen/opportunities/competitive-calls-cs/11043?isExactMatch=true&status=31094501,31094502,31094503&order=DESC&pageNumber=4&pageSize=100&sortBy=startDate",2025-09-25
Rising Innovators category,"ec.europa.eu/info/funding-tenders/opportunities/portal/screen/opportunities/topic-details/HORIZON-EIC-2025-PRIZE-WIP-RisingInnovators?isExactMatch=true&status=31094501,31094502,31094503&order=DESC&pageNumber=2&pageSize=100&sortBy=startDate",2025-09-25
EU-Japan cooperation on the exploitation of Quantum Space Gravimetry data,"ec.europa.eu/info/funding-tenders/opportunities/portal/screen/opportunities/topic-details/HORIZON-CL4-2025-02-SPACE-81?isExactMatch=true&status=31094501,31094502,31094503&order=DESC&pageNumber=4&pageSize=100&sortBy=startDate",2025-09-25
Space Critical EEE Components for EU non-dependence - Connectors,"ec.europa.eu/info/funding-tenders/opportunities/portal/screen/opportunities/topic-details/HORIZON-CL4-2025-02-SPACE-73?isExactMatch=true&status=31094501,31094502,31094503&order=DESC&pageNumber=4&pageSize=100&sortBy=startDate",2025-09-25
Renforcer le capital humain des femmes et des jeunes pour améliorer leur capacité à défendre leurs droits,"ec.europa.eu/info/funding-tenders/opportunities/portal/screen/opportunities/prospect-details/184013PROSPECTSEN?isExactMatch=true&status=31094501,31094502,31094503&order=DESC&pageNumber=3&pageSize=100&sortBy=startDate",2025-09-25
Programme régional d’appui au développement de l’économie pastorale en Afrique de l’Ouest et au Sahel (PRADEP-AOS) : Mise en œuvre de la composante territoriale Couloir central,"ec.europa.eu/info/funding-tenders/opportunities/portal/screen/opportunities/prospect-details/184910PROSPECTSEN?isExactMatch=true&status=31094501,31094502,31094503&order=DESC&pageNumber=1&pageSize=100&sortBy=startDate",2025-09-25
Innovative Earth observation services in support of maritime litter detection and ship source pollution policies,"ec.europa.eu/info/funding-tenders/opportunities/portal/screen/opportunities/topic-details/HORIZON-CL4-2025-02-SPACE-46?isExactMatch=true&status=31094501,31094502,31094503&order=DESC&pageNumber=4&pageSize=100&sortBy=startDate",2025-09-25
Space Critical EEE Components for EU non-dependence – RISC-V Microprocessor on 7nm,"ec.europa.eu/info/funding-tenders/opportunities/portal/screen/opportunities/topic-details/HORIZON-CL4-2025-02-SPACE-71?isExactMatch=true&status=31094501,31094502,31094503&order=DESC&pageNumber=4&pageSize=100&sortBy=startDate",2025-09-25
"Digital solutions for autonomy for space transportation systems, design and simulation tools – targeting demonstration","ec.europa.eu/info/funding-tenders/opportunities/portal/screen/opportunities/topic-details/HORIZON-CL4-2025-02-SPACE-13?isExactMatch=true&status=31094501,31094502,31094503&order=DESC&pageNumber=4&pageSize=100&sortBy=startDate",2025-09-25
ISOS Pilot Mission Detailed Design – HOST component,"ec.europa.eu/info/funding-tenders/opportunities/portal/screen/opportunities/topic-details/HORIZON-CL4-2025-02-SPACE-22?isExactMatch=true&status=31094501,31094502,31094503&order=DESC&pageNumber=4&pageSize=100&sortBy=startDate",2025-09-25
Supporting the AI/ML digital transition of Copernicus Services,"ec.europa.eu/info/funding-tenders/opportunities/portal/screen/opportunities/topic-details/HORIZON-CL4-2025-02-SPACE-45?isExactMatch=true&status=31094501,31094502,31094503&order=DESC&pageNumber=4&pageSize=100&sortBy=startDate",2025-09-25
ISOS Pilot Mission Detailed Design – satAPPs component,"ec.europa.eu/info/funding-tenders/opportunities/portal/screen/opportunities/topic-details/HORIZON-CL4-2025-02-SPACE-24?isExactMatch=true&status=31094501,31094502,31094503&order=DESC&pageNumber=4&pageSize=100&sortBy=startDate",2025-09-25
ISOS Pilot Mission Detailed Design – Logistics component,"ec.europa.eu/info/funding-tenders/opportunities/portal/screen/opportunities/topic-details/HORIZON-CL4-2025-02-SPACE-23?isExactMatch=true&status=31094501,31094502,31094503&order=DESC&pageNumber=4&pageSize=100&sortBy=startDate",2025-09-25
ISOS Pilot Mission Detailed Design – Servicing component,"ec.europa.eu/info/funding-tenders/opportunities/portal/screen/opportunities/topic-details/HORIZON-CL4-2025-02-SPACE-21?isExactMatch=true&status=31094501,31094502,31094503&order=DESC&pageNumber=4&pageSize=100&sortBy=startDate",2025-09-25
Digital enablers and building blocks for Earth Observation and Satellite telecommunication for Space solutions,"ec.europa.eu/info/funding-tenders/opportunities/portal/screen/opportunities/topic-details/HORIZON-CL4-2025-02-SPACE-31?isExactMatch=true&status=31094501,31094502,31094503&order=DESC&pageNumber=4&pageSize=100&sortBy=startDate",2025-09-25
CSA on access to European spaceports,"ec.europa.eu/info/funding-tenders/opportunities/portal/screen/opportunities/topic-details/HORIZON-CL4-2025-02-SPACE-11?isExactMatch=true&status=31094501,31094502,31094503&order=DESC&pageNumber=4&pageSize=100&sortBy=startDate",2025-09-25
Space Critical EEE Components for EU non-dependence – Advanced Packages and Memories,"ec.europa.eu/info/funding-tenders/opportunities/portal/screen/opportunities/topic-details/HORIZON-CL4-2025-02-SPACE-74?isExactMatch=true&status=31094501,31094502,31094503&order=DESC&pageNumber=4&pageSize=100&sortBy=startDate",2025-09-25
Copernicus Climate Change Service (C3S) evolution: new and innovative processing and methods for future Sentinels and other satellites for reanalyses,"ec.europa.eu/info/funding-tenders/opportunities/portal/screen/opportunities/topic-details/HORIZON-CL4-2025-02-SPACE-41?isExactMatch=true&status=31094501,31094502,31094503&order=DESC&pageNumber=4&pageSize=100&sortBy=startDate",2025-09-25
Space Critical Equipment and Related Technologies for EU non-dependence – Chip Scale Atomic Clocks and Solar Cells,"ec.europa.eu/info/funding-tenders/opportunities/portal/screen/opportunities/topic-details/HORIZON-CL4-2025-02-SPACE-72?isExactMatch=true&status=31094501,31094502,31094503&order=DESC&pageNumber=4&pageSize=100&sortBy=startDate",2025-09-25
Copernicus Anthropogenic CO₂ Emissions Monitoring & Verification Support (CO2MVS) capacity: new and innovative methods to estimate the impact of fires on vegetation and related carbon fluxes,"ec.europa.eu/info/funding-tenders/opportunities/portal/screen/opportunities/topic-details/HORIZON-CL4-2025-02-SPACE-43?isExactMatch=true&status=31094501,31094502,31094503&order=DESC&pageNumber=4&pageSize=100&sortBy=startDate",2025-09-25
Copernicus Atmosphere Monitoring Service (CAMS) evolution: improved soil-vegetation-atmosphere modelling and data assimilation of atmospheric constituents,"ec.europa.eu/info/funding-tenders/opportunities/portal/screen/opportunities/topic-details/HORIZON-CL4-2025-02-SPACE-42?isExactMatch=true&status=31094501,31094502,31094503&order=DESC&pageNumber=4&pageSize=100&sortBy=startDate",2025-09-25
Preparing demonstration missions for collaborative Earth Observation and Satellite telecommunication for Space solutions,"ec.europa.eu/info/funding-tenders/opportunities/portal/screen/opportunities/topic-details/HORIZON-CL4-2025-02-SPACE-32?isExactMatch=true&status=31094501,31094502,31094503&order=DESC&pageNumber=4&pageSize=100&sortBy=startDate",2025-09-25
"Digital solutions for autonomy for space transportation systems, design and simulation tools - Digital enablers and building blocks","ec.europa.eu/info/funding-tenders/opportunities/portal/screen/opportunities/topic-details/HORIZON-CL4-2025-02-SPACE-12?isExactMatch=true&status=31094501,31094502,31094503&order=DESC&pageNumber=4&pageSize=100&sortBy=startDate",2025-09-25
Copernicus Marine Environment Monitoring Service (CMEMS) evolution: new and innovative ocean data assimilation techniques,"ec.europa.eu/info/funding-tenders/opportunities/portal/screen/opportunities/topic-details/HORIZON-CL4-2025-02-SPACE-44?isExactMatch=true&status=31094501,31094502,31094503&order=DESC&pageNumber=4&pageSize=100&sortBy=startDate",2025-09-25
Support to Green and Digital Transformation in Botswana,"ec.europa.eu/info/funding-tenders/opportunities/portal/screen/opportunities/prospect-details/183551PROSPECTSEN?isExactMatch=true&status=31094501,31094502,31094503&order=DESC&pageNumber=2&pageSize=100&sortBy=startDate",2025-09-26
Networking Support Call (NSC2025) - Translational aspects of Personalised Medicine,"ec.europa.eu/info/funding-tenders/opportunities/portal/screen/opportunities/competitive-calls-cs/10801?isExactMatch=true&status=31094501,31094502,31094503&order=DESC&pageNumber=4&pageSize=100&sortBy=startDate",2025-09-29
RTU MERIT Project Mobility Scholarship,"ec.europa.eu/info/funding-tenders/opportunities/portal/screen/opportunities/competitive-calls-cs/11387?isExactMatch=true&status=31094501,31094502,31094503&order=DESC&pageNumber=2&pageSize=100&sortBy=startDate",2025-09-29
"2nd Call for applications for a grant to support the education and training of developers of cyber security solutions, within the framework of financial support to third parties","ec.europa.eu/info/funding-tenders/opportunities/portal/screen/opportunities/competitive-calls-cs/11270?isExactMatch=true&status=31094501,31094502,31094503&order=DESC&pageNumber=2&pageSize=100&sortBy=startDate",2025-09-30
TALTECH MERIT Project Excellence Scholarship Award,"ec.europa.eu/info/funding-tenders/opportunities/portal/screen/opportunities/competitive-calls-cs/10821?isExactMatch=true&status=31094501,31094502,31094503&order=DESC&pageNumber=1&pageSize=100&sortBy=startDate",2025-09-30
The promotion of handicraft products and support of craftsmen ,"ec.europa.eu/info/funding-tenders/opportunities/portal/screen/opportunities/topic-details/PPPA-MOVE-2025-P032404?isExactMatch=true&status=31094501,31094502,31094503&order=DESC&pageNumber=1&pageSize=100&sortBy=startDate",2025-09-30
Network on carbon farming and emissions reductions for agricultural and forest lands,"ec.europa.eu/info/funding-tenders/opportunities/portal/screen/opportunities/topic-details/HORIZON-MISS-2025-05-SOIL-10?isExactMatch=true&status=31094501,31094502,31094503&order=DESC&pageNumber=6&pageSize=100&sortBy=startDate",2025-09-30
OFFERR Call,"ec.europa.eu/info/funding-tenders/opportunities/portal/screen/opportunities/competitive-calls-cs/3876?isExactMatch=true&status=31094501,31094502,31094503&order=DESC&pageNumber=26&pageSize=100&sortBy=startDate",2025-09-30
Living Labs for soil remediation and green redevelopment of brownfields,"ec.europa.eu/info/funding-tenders/opportunities/portal/screen/opportunities/topic-details/HORIZON-MISS-2025-05-SOIL-01?isExactMatch=true&status=31094501,31094502,31094503&order=DESC&pageNumber=6&pageSize=100&sortBy=startDate",2025-09-30
Connecting Spheres,"ec.europa.eu/info/funding-tenders/opportunities/portal/screen/opportunities/competitive-calls-cs/9064?isExactMatch=true&status=31094501,31094502,31094503&order=DESC&pageNumber=13&pageSize=100&sortBy=startDate",2025-09-30
"Soil Salinity in Europe: Drivers, indicators, current levels and temporal changes","ec.europa.eu/info/funding-tenders/opportunities/portal/screen/opportunities/topic-details/HORIZON-MISS-2025-05-SOIL-11?isExactMatch=true&status=31094501,31094502,31094503&order=DESC&pageNumber=6&pageSize=100&sortBy=startDate",2025-09-30
Call for applications for a grant to support the acquisition of accreditation for the EUCC certification scheme in the framework of financial support to third parties,"ec.europa.eu/info/funding-tenders/opportunities/portal/screen/opportunities/competitive-calls-cs/11382?isExactMatch=true&status=31094501,31094502,31094503&order=DESC&pageNumber=2&pageSize=100&sortBy=startDate",2025-09-30
AI Research Groups Lower Saxony,https://zukunft.niedersachsen.de/foerderangebot/ki-forschungsgruppen-niedersachsen/,2025-09-30
EU global footprint on soils,"ec.europa.eu/info/funding-tenders/opportunities/portal/screen/opportunities/topic-details/HORIZON-MISS-2025-05-SOIL-05?isExactMatch=true&status=31094501,31094502,31094503&order=DESC&pageNumber=6&pageSize=100&sortBy=startDate",2025-09-30
Support to the operation and further development of soil-health science-policy interfaces and national soil-health hubs,"ec.europa.eu/info/funding-tenders/opportunities/portal/screen/opportunities/topic-details/HORIZON-MISS-2025-05-SOIL-08?isExactMatch=true&status=31094501,31094502,31094503&order=DESC&pageNumber=6&pageSize=100&sortBy=startDate",2025-09-30
TALTECH MERIT Project Mobility Grant,"ec.europa.eu/info/funding-tenders/opportunities/portal/screen/opportunities/competitive-calls-cs/10822?isExactMatch=true&status=31094501,31094502,31094503&order=DESC&pageNumber=1&pageSize=100&sortBy=startDate",2025-09-30
Improved land suitability for soil health and sustainable biomass production,"ec.europa.eu/info/funding-tenders/opportunities/portal/screen/opportunities/topic-details/HORIZON-MISS-2025-05-SOIL-07?isExactMatch=true&status=31094501,31094502,31094503&order=DESC&pageNumber=6&pageSize=100&sortBy=startDate",2025-09-30
AI Research Groups Lower Saxony,https://zukunft.niedersachsen.de/foerderangebot/ki-forschungsgruppen-niedersachsen/,2025-09-30
Quantifying the impact of farming practices on soil health in arable lands,"ec.europa.eu/info/funding-tenders/opportunities/portal/screen/opportunities/topic-details/HORIZON-MISS-2025-05-SOIL-06?isExactMatch=true&status=31094501,31094502,31094503&order=DESC&pageNumber=6&pageSize=100&sortBy=startDate",2025-09-30
Increasing environmental resilience through a better knowledge and management of the soil-water nexus,"ec.europa.eu/info/funding-tenders/opportunities/portal/screen/opportunities/topic-details/HORIZON-MISS-2025-05-SOIL-03?isExactMatch=true&status=31094501,31094502,31094503&order=DESC&pageNumber=6&pageSize=100&sortBy=startDate",2025-09-30
AGRARIAN - Open Call # 2 (IMPLEMENT),"ec.europa.eu/info/funding-tenders/opportunities/portal/screen/opportunities/competitive-calls-cs/3983?isExactMatch=true&status=31094501,31094502,31094503&order=DESC&pageNumber=1&pageSize=100&sortBy=startDate",2025-09-30
"Improving human capital and implementation of the institutional Policy of the National Vaccine Institute, Ghana","ec.europa.eu/info/funding-tenders/opportunities/portal/screen/opportunities/prospect-details/184869PROSPECTSEN?isExactMatch=true&status=31094501,31094502,31094503&order=DESC&pageNumber=2&pageSize=100&sortBy=startDate",2025-09-30
"Social, economic and cultural drivers, and costs of land degradation","ec.europa.eu/info/funding-tenders/opportunities/portal/screen/opportunities/topic-details/HORIZON-MISS-2025-05-SOIL-02?isExactMatch=true&status=31094501,31094502,31094503&order=DESC&pageNumber=5&pageSize=100&sortBy=startDate",2025-09-30
AI Research Groups Lower Saxony,https://zukunft.niedersachsen.de/foerderangebot/ki-forschungsgruppen-niedersachsen/,2025-09-30
AI Research Groups Lower Saxony,https://zukunft.niedersachsen.de/foerderangebot/ki-forschungsgruppen-niedersachsen/,2025-09-30
"Support to Civil Society Organisations in Albania in the field of Digital rights and civic space, and Transitional justice and democratic culture","ec.europa.eu/info/funding-tenders/opportunities/portal/screen/opportunities/prospect-details/184906PROSPECTSEN?isExactMatch=true&status=31094501,31094502,31094503&order=DESC&pageNumber=1&pageSize=100&sortBy=startDate",2025-09-30
CyberSecDome Open Call - Round 2,"ec.europa.eu/info/funding-tenders/opportunities/portal/screen/opportunities/competitive-calls-cs/11445?isExactMatch=true&status=31094501,31094502,31094503&order=DESC&pageNumber=1&pageSize=100&sortBy=startDate",2025-09-30
AI Research Groups Lower Saxony,https://zukunft.niedersachsen.de/foerderangebot/ki-forschungsgruppen-niedersachsen/,2025-09-30
Developing transfer functions for the Soil Monitoring Law,"ec.europa.eu/info/funding-tenders/opportunities/portal/screen/opportunities/topic-details/HORIZON-MISS-2025-05-SOIL-04?isExactMatch=true&status=31094501,31094502,31094503&order=DESC&pageNumber=5&pageSize=100&sortBy=startDate",2025-09-30
Call for Master’s & PhD Modules 2025,"ec.europa.eu/info/funding-tenders/opportunities/portal/screen/opportunities/competitive-calls-cs/11273?isExactMatch=true&status=31094501,31094502,31094503&order=DESC&pageNumber=2&pageSize=100&sortBy=startDate",2025-09-30
Citizen engagement for sustainable land management through local and regional authorities,"ec.europa.eu/info/funding-tenders/opportunities/portal/screen/opportunities/topic-details/HORIZON-MISS-2025-05-SOIL-09?isExactMatch=true&status=31094501,31094502,31094503&order=DESC&pageNumber=6&pageSize=100&sortBy=startDate",2025-09-30
Urban Mobility Explained (UMX) Open Call (Multi-cut-off),"ec.europa.eu/info/funding-tenders/opportunities/portal/screen/opportunities/competitive-calls-cs/11264?isExactMatch=true&status=31094501,31094502,31094503&order=DESC&pageNumber=2&pageSize=100&sortBy=startDate",2025-09-30
SOILSCAPE Open Call ,"ec.europa.eu/info/funding-tenders/opportunities/portal/screen/opportunities/competitive-calls-cs/11065?isExactMatch=true&status=31094501,31094502,31094503&order=DESC&pageNumber=3&pageSize=100&sortBy=startDate",2025-09-30
FS4Africa Open Call 1 (OC1) addressed to research and technology stakeholders,"ec.europa.eu/info/funding-tenders/opportunities/portal/screen/opportunities/competitive-calls-cs/10926?isExactMatch=true&status=31094501,31094502,31094503&order=DESC&pageNumber=3&pageSize=100&sortBy=startDate",2025-09-30
"CEDAR CIVIL SOCIETY-CAPACITY ENHANCEMENT, DIALOGUE AND RECOVERY CALL FOR PROPOSALS","ec.europa.eu/info/funding-tenders/opportunities/portal/screen/opportunities/prospect-details/184434PROSPECTSEN?isExactMatch=true&status=31094501,31094502,31094503&order=DESC&pageNumber=2&pageSize=100&sortBy=startDate",2025-09-30
Appui pour cadre normatif régissant l’agriculture biologique et la labellisation,"ec.europa.eu/info/funding-tenders/opportunities/portal/screen/opportunities/prospect-details/184670PROSPECTSEN?isExactMatch=true&status=31094501,31094502,31094503&order=DESC&pageNumber=2&pageSize=100&sortBy=startDate",2025-09-30
NGI Zero Commons Fund (2025-10Z),"ec.europa.eu/info/funding-tenders/opportunities/portal/screen/opportunities/competitive-calls-cs/11089?isExactMatch=true&status=31094501,31094502,31094503&order=DESC&pageNumber=1&pageSize=100&sortBy=startDate",2025-10-01
VILNIUS TECH MERIT Project 2nd Targeted Scholarship Call,"ec.europa.eu/info/funding-tenders/opportunities/portal/screen/opportunities/competitive-calls-cs/11261?isExactMatch=true&status=31094501,31094502,31094503&order=DESC&pageNumber=1&pageSize=100&sortBy=startDate",2025-10-01
Strengthening the remembrance of the Holocaust against Jewish people,"ec.europa.eu/info/funding-tenders/opportunities/portal/screen/opportunities/topic-details/CERV-2025-CITIZENS-REM-HOLOCAUSTJEW?isExactMatch=true&status=31094501,31094502,31094503&order=DESC&pageNumber=2&pageSize=100&sortBy=startDate",2025-10-01
"Strengthening the remembrance of the Holocaust, genocides, war crimes and crimes against humanity to reinforce democracy in the EU","ec.europa.eu/info/funding-tenders/opportunities/portal/screen/opportunities/topic-details/CERV-2025-CITIZENS-REM-GENCRIME?isExactMatch=true&status=31094501,31094502,31094503&order=DESC&pageNumber=2&pageSize=100&sortBy=startDate",2025-10-01
"Migration, de-colonisation, slavery and multicultural European societies","ec.europa.eu/info/funding-tenders/opportunities/portal/screen/opportunities/topic-details/CERV-2025-CITIZENS-REM-HISTMIGRATION?isExactMatch=true&status=31094501,31094502,31094503&order=DESC&pageNumber=2&pageSize=100&sortBy=startDate",2025-10-01
"Democratic transition, (re-)building and strengthening society based on the rule of law, democracy and fundamental rights","ec.europa.eu/info/funding-tenders/opportunities/portal/screen/opportunities/topic-details/CERV-2025-CITIZENS-REM-TRANSITION?isExactMatch=true&status=31094501,31094502,31094503&order=DESC&pageNumber=2&pageSize=100&sortBy=startDate",2025-10-01
NGI Fediversity open call (2025-10F),"ec.europa.eu/info/funding-tenders/opportunities/portal/screen/opportunities/competitive-calls-cs/11086?isExactMatch=true&status=31094501,31094502,31094503&order=DESC&pageNumber=1&pageSize=100&sortBy=startDate",2025-10-01
NGI TALER open call (2025-10T),"ec.europa.eu/info/funding-tenders/opportunities/portal/screen/opportunities/competitive-calls-cs/11088?isExactMatch=true&status=31094501,31094502,31094503&order=DESC&pageNumber=1&pageSize=100&sortBy=startDate",2025-10-01
"Call for proposals for action grants to support transnational projects in the fields of e-Justice, victims’ rights and procedural rights","ec.europa.eu/info/funding-tenders/opportunities/portal/screen/opportunities/topic-details/JUST-2025-JACC-EJUSTICE?isExactMatch=true&status=31094501,31094502,31094503&order=DESC&pageNumber=7&pageSize=100&sortBy=startDate",2025-10-01
