title,link,date
Open topic for role of the human factor for the resilience of critical infrastructures,"ec.europa.eu/info/funding-tenders/opportunities/portal/screen/opportunities/topic-details/HORIZON-CL3-2025-01-INFRA-02?isExactMatch=true&status=31094501,31094502,31094503&order=DESC&pageNumber=4&pageSize=100&sortBy=startDate",2025-11-12
EIT Food Impact Funding Framework,"ec.europa.eu/info/funding-tenders/opportunities/portal/screen/opportunities/competitive-calls-cs/7641?isExactMatch=true&status=31094501,31094502,31094503&order=DESC&pageNumber=16&pageSize=100&sortBy=startDate",2025-11-13
Interregional Innovation Investments Strand 2a,"ec.europa.eu/info/funding-tenders/opportunities/portal/screen/opportunities/topic-details/I3-2025-INV2a?isExactMatch=true&status=31094501,31094502,31094503&order=DESC&pageNumber=5&pageSize=100&sortBy=startDate",2025-11-13
Water4All 2025 Joint Transnational Call “Water and health”,"ec.europa.eu/info/funding-tenders/opportunities/portal/screen/opportunities/competitive-calls-cs/11683?isExactMatch=true&status=31094501,31094502,31094503&order=DESC&pageNumber=2&pageSize=100&sortBy=startDate",2025-11-13
Setting up of Cross-Border Coordination Points,"ec.europa.eu/info/funding-tenders/opportunities/portal/screen/opportunities/topic-details/PPPA-2025-BRIDGEFOREU?isExactMatch=true&status=31094501,31094502,31094503&order=DESC&pageNumber=2&pageSize=100&sortBy=startDate",2025-11-13
Interregional Innovation Investments Strand 1,"ec.europa.eu/info/funding-tenders/opportunities/portal/screen/opportunities/topic-details/I3-2025-INV1?isExactMatch=true&status=31094501,31094502,31094503&order=DESC&pageNumber=5&pageSize=100&sortBy=startDate",2025-11-13
Funding for SMEs and start-ups investing in innovation in the biofertilizers and biostimulants sector - CALL FOR APPLICATIONS,"ec.europa.eu/info/funding-tenders/opportunities/portal/screen/opportunities/competitive-calls-cs/11670?isExactMatch=true&status=31094501,31094502,31094503&order=DESC&pageNumber=2&pageSize=100&sortBy=startDate",2025-11-14
TIDAL ArtS Residency Call,"ec.europa.eu/info/funding-tenders/opportunities/portal/screen/opportunities/competitive-calls-cs/12046?isExactMatch=true&status=31094501,31094502,31094503&order=DESC&pageNumber=1&pageSize=100&sortBy=startDate",2025-11-15
THE HUBS,"ec.europa.eu/info/funding-tenders/opportunities/portal/screen/opportunities/competitive-calls-cs/11167?isExactMatch=true&status=31094501,31094502,31094503&order=DESC&pageNumber=3&pageSize=100&sortBy=startDate",2025-11-15
"Digitalisation and Innovation for Resilient Marine Ecosystems Businesses, and Communities to Strengthen the EU Blue Economy’s Competitiveness","ec.europa.eu/info/funding-tenders/opportunities/portal/screen/opportunities/competitive-calls-cs/11668?isExactMatch=true&status=31094501,31094502,31094503&order=DESC&pageNumber=2&pageSize=100&sortBy=startDate",2025-11-17
Driving Urban Transitions (DUT) Call 2025,"ec.europa.eu/info/funding-tenders/opportunities/portal/screen/opportunities/competitive-calls-cs/11402?isExactMatch=true&status=31094501,31094502,31094503&order=DESC&pageNumber=2&pageSize=100&sortBy=startDate",2025-11-17
"Open Call 3ter ""Targeted Re-opening for the Selection of New Group Leaders and Local Node Seal of excellence (SoE) support EIC Accelerator laureates""","ec.europa.eu/info/funding-tenders/opportunities/portal/screen/opportunities/competitive-calls-cs/11761?isExactMatch=true&status=31094501,31094502,31094503&order=DESC&pageNumber=2&pageSize=100&sortBy=startDate",2025-11-17
Financial Support for Third Parties: iNNO SED Open Call for Associated Regions,"ec.europa.eu/info/funding-tenders/opportunities/portal/screen/opportunities/competitive-calls-cs/11703?isExactMatch=true&status=31094501,31094502,31094503&order=DESC&pageNumber=2&pageSize=100&sortBy=startDate",2025-11-17
Call No. 2 for proposals for NGOs to participate in capacity building and receive financial support,"ec.europa.eu/info/funding-tenders/opportunities/portal/screen/opportunities/competitive-calls-cs/11822?isExactMatch=true&status=31094501,31094502,31094503&order=DESC&pageNumber=2&pageSize=100&sortBy=startDate",2025-11-18
"Enhancing Cybersecurity for Small and Medium Enterprises in the 
Republic of Cyprus 2025 - Τourism","ec.europa.eu/info/funding-tenders/opportunities/portal/screen/opportunities/competitive-calls-cs/12044?isExactMatch=true&status=31094501,31094502,31094503&order=DESC&pageNumber=2&pageSize=100&sortBy=startDate",2025-11-18
"Enhancing Cybersecurity for Small and Medium Enterprises in the 
Republic of Cyprus 2025
","ec.europa.eu/info/funding-tenders/opportunities/portal/screen/opportunities/competitive-calls-cs/12043?isExactMatch=true&status=31094501,31094502,31094503&order=DESC&pageNumber=2&pageSize=100&sortBy=startDate",2025-11-18
EIC pre-accelerator - Widening,"ec.europa.eu/info/funding-tenders/opportunities/portal/screen/opportunities/topic-details/HORIZON-WIDERA-2025-02-ACCESS-01?isExactMatch=true&status=31094501,31094502,31094503&order=DESC&pageNumber=4&pageSize=100&sortBy=startDate",2025-11-18
Cyber Resilience Boost: Supporting capacity building for cyber resilience of products,"ec.europa.eu/info/funding-tenders/opportunities/portal/screen/opportunities/competitive-calls-cs/11722?isExactMatch=true&status=31094501,31094502,31094503&order=DESC&pageNumber=2&pageSize=100&sortBy=startDate",2025-11-18
Improvement of system mechanisms for monitoring the prescription and consumption of medicines in the health system of Montenegro,"ec.europa.eu/info/funding-tenders/opportunities/portal/screen/opportunities/prospect-details/185059PROSPECTSEN?isExactMatch=true&status=31094501,31094502,31094503&order=DESC&pageNumber=2&pageSize=100&sortBy=startDate",2025-11-19
European Excellence Initiative (EEI),"ec.europa.eu/info/funding-tenders/opportunities/portal/screen/opportunities/topic-details/HORIZON-WIDERA-2025-01-ACCESS-01?isExactMatch=true&status=31094501,31094502,31094503&order=DESC&pageNumber=6&pageSize=100&sortBy=startDate",2025-11-20
DIGITAL-JU-CHIPS-2025-SG-SSOI,"ec.europa.eu/info/funding-tenders/opportunities/portal/screen/opportunities/topic-details/DIGITAL-JU-CHIPS-2025-SG-SSOI?isExactMatch=true&status=31094501,31094502,31094503&order=DESC&pageNumber=3&pageSize=100&sortBy=startDate",2025-11-20
O-CEI 1st OPEN CALL FOR UPSCALING PROJECTS,"ec.europa.eu/info/funding-tenders/opportunities/portal/screen/opportunities/competitive-calls-cs/11405?isExactMatch=true&status=31094501,31094502,31094503&order=DESC&pageNumber=2&pageSize=100&sortBy=startDate",2025-11-20
"Strengthening Cybersecurity of micro, small and medium-sized enterprises","ec.europa.eu/info/funding-tenders/opportunities/portal/screen/opportunities/competitive-calls-cs/11581?isExactMatch=true&status=31094501,31094502,31094503&order=DESC&pageNumber=2&pageSize=100&sortBy=startDate",2025-11-21
MSCA Doctoral Networks 2025,"ec.europa.eu/info/funding-tenders/opportunities/portal/screen/opportunities/topic-details/HORIZON-MSCA-2025-DN-01-01?isExactMatch=true&status=31094501,31094502,31094503&order=DESC&pageNumber=4&pageSize=100&sortBy=startDate",2025-11-25
Welfare monitoring: data driven risk assessment in fast and slower growing broilers (BROWARD),"ec.europa.eu/info/funding-tenders/opportunities/portal/screen/opportunities/topic-details/EUBA-EFSA-2025-BIOHAW-01?isExactMatch=true&status=31094501,31094502,31094503&order=DESC&pageNumber=3&pageSize=100&sortBy=startDate",2025-11-26
Support for the Ukrainian tech SMEs and startups,"ec.europa.eu/info/funding-tenders/opportunities/portal/screen/opportunities/topic-details/HORIZON-EIC-2025-UKRAINIANTECH-01?isExactMatch=true&status=31094501,31094502,31094503&order=DESC&pageNumber=2&pageSize=100&sortBy=startDate",2025-11-26
2nd Call for Proposals CBC BiH MNE,"ec.europa.eu/info/funding-tenders/opportunities/portal/screen/opportunities/prospect-details/184762PROSPECTSEN?isExactMatch=true&status=31094501,31094502,31094503&order=DESC&pageNumber=1&pageSize=100&sortBy=startDate",2025-11-28
EIT RawMaterials KAVA call 13 - RIS Innovation and Capacity Building,"ec.europa.eu/info/funding-tenders/opportunities/portal/screen/opportunities/competitive-calls-cs/9162?isExactMatch=true&status=31094501,31094502,31094503&order=DESC&pageNumber=13&pageSize=100&sortBy=startDate",2025-11-28
EIT RawMaterials KAVA CALL 13 - UPSCALING,"ec.europa.eu/info/funding-tenders/opportunities/portal/screen/opportunities/competitive-calls-cs/9141?isExactMatch=true&status=31094501,31094502,31094503&order=DESC&pageNumber=14&pageSize=100&sortBy=startDate",2025-11-28
Small Grants for Grassroots Coding Projects in Ireland as part of EU Code Week,"ec.europa.eu/info/funding-tenders/opportunities/portal/screen/opportunities/competitive-calls-cs/11881?isExactMatch=true&status=31094501,31094502,31094503&order=DESC&pageNumber=1&pageSize=100&sortBy=startDate",2025-11-30
VR Health Champions Open Call 2026,"ec.europa.eu/info/funding-tenders/opportunities/portal/screen/opportunities/competitive-calls-cs/11825?isExactMatch=true&status=31094501,31094502,31094503&order=DESC&pageNumber=1&pageSize=100&sortBy=startDate",2025-11-30
FERRO Open Call for Associated Regions,"ec.europa.eu/info/funding-tenders/opportunities/portal/screen/opportunities/competitive-calls-cs/11663?isExactMatch=true&status=31094501,31094502,31094503&order=DESC&pageNumber=2&pageSize=100&sortBy=startDate",2025-11-30
zukunft.niedersachsen: Lower Saxony Impulse Professorship,https://zukunft.niedersachsen.de/en/funding-offers/lower-saxony-impulse-professorship/,2025-12-01
zukunft.niedersachsen: Lower Saxony Impulse Professorship,https://zukunft.niedersachsen.de/en/funding-offers/lower-saxony-impulse-professorship/,2025-12-01
NGI Fediversity open call (2025-12F),"ec.europa.eu/info/funding-tenders/opportunities/portal/screen/opportunities/competitive-calls-cs/11901?isExactMatch=true&status=31094501,31094502,31094503&order=DESC&pageNumber=1&pageSize=100&sortBy=startDate",2025-12-01
NGI Zero Commons Fund (2025-12Z),"ec.europa.eu/info/funding-tenders/opportunities/portal/screen/opportunities/competitive-calls-cs/11902?isExactMatch=true&status=31094501,31094502,31094503&order=DESC&pageNumber=1&pageSize=100&sortBy=startDate",2025-12-01
NGI Mobifree open call (2025-12M),"ec.europa.eu/info/funding-tenders/opportunities/portal/screen/opportunities/competitive-calls-cs/11903?isExactMatch=true&status=31094501,31094502,31094503&order=DESC&pageNumber=1&pageSize=100&sortBy=startDate",2025-12-01
Enhance Open Call,"ec.europa.eu/info/funding-tenders/opportunities/portal/screen/opportunities/competitive-calls-cs/11883?isExactMatch=true&status=31094501,31094502,31094503&order=DESC&pageNumber=1&pageSize=100&sortBy=startDate",2025-12-01
SME Market Expansion Open Call 2026,"ec.europa.eu/info/funding-tenders/opportunities/portal/screen/opportunities/competitive-calls-cs/11906?isExactMatch=true&status=31094501,31094502,31094503&order=DESC&pageNumber=1&pageSize=100&sortBy=startDate",2025-12-01
The NCC-IS Cybersecurity Grant (FSTP),"ec.europa.eu/info/funding-tenders/opportunities/portal/screen/opportunities/competitive-calls-cs/11784?isExactMatch=true&status=31094501,31094502,31094503&order=DESC&pageNumber=1&pageSize=100&sortBy=startDate",2025-12-01
NGI TALER open call (2025-12T),"ec.europa.eu/info/funding-tenders/opportunities/portal/screen/opportunities/competitive-calls-cs/11904?isExactMatch=true&status=31094501,31094502,31094503&order=DESC&pageNumber=1&pageSize=100&sortBy=startDate",2025-12-01
MK 24 IPA FA 01 25 TWL Strengthening the capacity of Financial Inspection and Anti-Fraud Coordination Services (AFCOS),"ec.europa.eu/info/funding-tenders/opportunities/portal/screen/opportunities/prospect-details/185299PROSPECTSEN?isExactMatch=true&status=31094501,31094502,31094503&order=DESC&pageNumber=1&pageSize=100&sortBy=startDate",2025-12-01
6th REINFORCING Open Call (Incubators Call) on “Responsible Innovation”,"ec.europa.eu/info/funding-tenders/opportunities/portal/screen/opportunities/competitive-calls-cs/11882?isExactMatch=true&status=31094501,31094502,31094503&order=DESC&pageNumber=1&pageSize=100&sortBy=startDate",2025-12-02
Building a trustworthy social media sphere: countering disinformation on social media  for young Europeans,"ec.europa.eu/info/funding-tenders/opportunities/portal/screen/opportunities/topic-details/PPPA-2025-DISINFORMATION-YOUNG?isExactMatch=true&status=31094501,31094502,31094503&order=DESC&pageNumber=1&pageSize=100&sortBy=startDate",2025-12-02
MSCA Choose Europe for Science 2025,"ec.europa.eu/info/funding-tenders/opportunities/portal/screen/opportunities/topic-details/HORIZON-MSCA-2025-COFUND-02-01?isExactMatch=true&status=31094501,31094502,31094503&order=DESC&pageNumber=1&pageSize=100&sortBy=startDate",2025-12-03
TV and online content Documentary projects,"ec.europa.eu/info/funding-tenders/opportunities/portal/screen/opportunities/topic-details/CREA-MEDIA-2026-TVONLINE-2?isExactMatch=true&status=31094501,31094502,31094503&order=DESC&pageNumber=1&pageSize=100&sortBy=startDate",2025-12-03
European slate development,"ec.europa.eu/info/funding-tenders/opportunities/portal/screen/opportunities/topic-details/CREA-MEDIA-2026-DEVSLATE?isExactMatch=true&status=31094501,31094502,31094503&order=DESC&pageNumber=1&pageSize=100&sortBy=startDate",2025-12-03
TV and online content Animation projects,"ec.europa.eu/info/funding-tenders/opportunities/portal/screen/opportunities/topic-details/CREA-MEDIA-2026-TVONLINE-1?isExactMatch=true&status=31094501,31094502,31094503&order=DESC&pageNumber=1&pageSize=100&sortBy=startDate",2025-12-03
TV and online content Fiction projects,"ec.europa.eu/info/funding-tenders/opportunities/portal/screen/opportunities/topic-details/CREA-MEDIA-2026-TVONLINE-3?isExactMatch=true&status=31094501,31094502,31094503&order=DESC&pageNumber=1&pageSize=100&sortBy=startDate",2025-12-03
"Call for proposals to support the development of innovative medical countermeasures for chemical, biological, radiological and nuclear threats (HERA) - Detection and diagnosis","ec.europa.eu/info/funding-tenders/opportunities/portal/screen/opportunities/topic-details/EU4H-2025-HERA-PJ-1-c?isExactMatch=true&status=31094501,31094502,31094503&order=DESC&pageNumber=2&pageSize=100&sortBy=startDate",2025-12-04
Selection of partners to carry out EUROPE DIRECT activities (2026-2030) in Poland - 2,"ec.europa.eu/info/funding-tenders/opportunities/portal/screen/opportunities/topic-details/ED-2025-POLAND-2-FPA?isExactMatch=true&status=31094501,31094502,31094503&order=DESC&pageNumber=1&pageSize=100&sortBy=startDate",2025-12-04
Call for proposals for the development of new diagnostic tests for vector-borne diseases (HERA),"ec.europa.eu/info/funding-tenders/opportunities/portal/screen/opportunities/topic-details/EU4H-2025-HERA-PJ-2?isExactMatch=true&status=31094501,31094502,31094503&order=DESC&pageNumber=2&pageSize=100&sortBy=startDate",2025-12-04
"Call for proposals to support the development of innovative medical countermeasures for chemical, biological, radiological and nuclear threats (HERA) - Reusable respiratory personal protective equipment (PPE)","ec.europa.eu/info/funding-tenders/opportunities/portal/screen/opportunities/topic-details/EU4H-2025-HERA-PJ-1-b?isExactMatch=true&status=31094501,31094502,31094503&order=DESC&pageNumber=2&pageSize=100&sortBy=startDate",2025-12-04
"Call for proposals to support the development of innovative medical countermeasures for chemical, biological, radiological and nuclear threats (HERA) - Medicinal products","ec.europa.eu/info/funding-tenders/opportunities/portal/screen/opportunities/topic-details/EU4H-2025-HERA-PJ-1-a?isExactMatch=true&status=31094501,31094502,31094503&order=DESC&pageNumber=2&pageSize=100&sortBy=startDate",2025-12-04
"“Strengthening the Capacities of the Higher Institute of Magistracy to Contribute to the Efficiency of the Judicial System”""","ec.europa.eu/info/funding-tenders/opportunities/portal/screen/opportunities/prospect-details/185325PROSPECTSEN?isExactMatch=true&status=31094501,31094502,31094503&order=DESC&pageNumber=1&pageSize=100&sortBy=startDate",2025-12-05
ZMINA:Resilience Seed Funding,"ec.europa.eu/info/funding-tenders/opportunities/portal/screen/opportunities/competitive-calls-cs/11821?isExactMatch=true&status=31094501,31094502,31094503&order=DESC&pageNumber=1&pageSize=100&sortBy=startDate",2025-12-05
QuantERA Call 2025 for Transnational Research Proposals supporting the topics of Quantum Phenomena and Resources and Applied Quantum Science,"ec.europa.eu/info/funding-tenders/opportunities/portal/screen/opportunities/competitive-calls-cs/11501?isExactMatch=true&status=31094501,31094502,31094503&order=DESC&pageNumber=2&pageSize=100&sortBy=startDate",2025-12-05
EU support to strengthen capacities of the Statistical Office of the Republic of Serbia to implement capital stock survey and land estimation,"ec.europa.eu/info/funding-tenders/opportunities/portal/screen/opportunities/prospect-details/185362PROSPECTSEN?isExactMatch=true&status=31094501,31094502,31094503&order=DESC&pageNumber=1&pageSize=100&sortBy=startDate",2025-12-05
"""Funding for Cyber"" - supporting the uptake and dissemination of state-of-the-art cybersecurity solutions by SMEs.","ec.europa.eu/info/funding-tenders/opportunities/portal/screen/opportunities/competitive-calls-cs/9341?isExactMatch=true&status=31094501,31094502,31094503&order=DESC&pageNumber=1&pageSize=100&sortBy=startDate",2025-12-08
Support the roll-out of EU Mobile Driving Licences,"ec.europa.eu/info/funding-tenders/opportunities/portal/screen/opportunities/topic-details/DIGITAL-2025-BESTUSE-TECH-09-MDL?isExactMatch=true&status=31094501,31094502,31094503&order=DESC&pageNumber=1&pageSize=100&sortBy=startDate",2025-12-09
Support to the development and certification of EU Digital Identity Wallets,"ec.europa.eu/info/funding-tenders/opportunities/portal/screen/opportunities/topic-details/DIGITAL-2025-BESTUSE-TECH-09-WALLET?isExactMatch=true&status=31094501,31094502,31094503&order=DESC&pageNumber=1&pageSize=100&sortBy=startDate",2025-12-09
SWITCH-Asia Programme - Scaling up Sustainable Consumption and Production under Global Gateway,"ec.europa.eu/info/funding-tenders/opportunities/portal/screen/opportunities/prospect-details/184950PROSPECTSEN?isExactMatch=true&status=31094501,31094502,31094503&order=DESC&pageNumber=1&pageSize=100&sortBy=startDate",2025-12-10
"European Joint Master’s Programme in Digital Society, Social Innovation and Global Citizenship (DIGISOC) Student Scholarship Programme - Academic Year 2025/2026 - Call for Application","ec.europa.eu/info/funding-tenders/opportunities/portal/screen/opportunities/competitive-calls-cs/11905?isExactMatch=true&status=31094501,31094502,31094503&order=DESC&pageNumber=1&pageSize=100&sortBy=startDate",2025-12-15
Call4Travel Vouchers - Part 2,"ec.europa.eu/info/funding-tenders/opportunities/portal/screen/opportunities/competitive-calls-cs/12042?isExactMatch=true&status=31094501,31094502,31094503&order=DESC&pageNumber=1&pageSize=100&sortBy=startDate",2025-12-15
FuseNet Call for the Organisation of Mini-Workshops in Fusion ,"ec.europa.eu/info/funding-tenders/opportunities/portal/screen/opportunities/competitive-calls-cs/10085?isExactMatch=true&status=31094501,31094502,31094503&order=DESC&pageNumber=11&pageSize=100&sortBy=startDate",2025-12-31
DANUBElifelines Call for Associated Regions,"ec.europa.eu/info/funding-tenders/opportunities/portal/screen/opportunities/competitive-calls-cs/11641?isExactMatch=true&status=31094501,31094502,31094503&order=DESC&pageNumber=2&pageSize=100&sortBy=startDate",2025-12-31
Permanently Open Call for Targeted Innovation Projects,"ec.europa.eu/info/funding-tenders/opportunities/portal/screen/opportunities/competitive-calls-cs/4602?isExactMatch=true&status=31094501,31094502,31094503&order=DESC&pageNumber=22&pageSize=100&sortBy=startDate",2025-12-31
FuseNet Support of Master Students going on an internship abroad,"ec.europa.eu/info/funding-tenders/opportunities/portal/screen/opportunities/competitive-calls-cs/10082?isExactMatch=true&status=31094501,31094502,31094503&order=DESC&pageNumber=11&pageSize=100&sortBy=startDate",2025-12-31
FuseNet Support of Master Students  in attending Educational Events ,"ec.europa.eu/info/funding-tenders/opportunities/portal/screen/opportunities/competitive-calls-cs/10084?isExactMatch=true&status=31094501,31094502,31094503&order=DESC&pageNumber=11&pageSize=100&sortBy=startDate",2025-12-31
METU Internships Offer,"ec.europa.eu/info/funding-tenders/opportunities/portal/screen/opportunities/competitive-calls-cs/11143?isExactMatch=true&status=31094501,31094502,31094503&order=DESC&pageNumber=3&pageSize=100&sortBy=startDate",2026-01-03
Gnomon Internships Offer,"ec.europa.eu/info/funding-tenders/opportunities/portal/screen/opportunities/competitive-calls-cs/11145?isExactMatch=true&status=31094501,31094502,31094503&order=DESC&pageNumber=3&pageSize=100&sortBy=startDate",2026-01-03
Call for proposals to pilot and implement cancer screening programmes for gastric cancer,"ec.europa.eu/info/funding-tenders/opportunities/portal/screen/opportunities/topic-details/EU4H-2026-SANTE-PJ-01?isExactMatch=true&status=31094501,31094502,31094503&order=DESC&pageNumber=2&pageSize=100&sortBy=startDate",2026-01-06
Call for proposals to contribute to the organisation of conferences and events,"ec.europa.eu/info/funding-tenders/opportunities/portal/screen/opportunities/topic-details/EU4H-2026-SANTE-PJ-09?isExactMatch=true&status=31094501,31094502,31094503&order=DESC&pageNumber=2&pageSize=100&sortBy=startDate",2026-01-06
"A European flagship initiative leveraging AI and health data for cardiovascular health and related non-communicable diseases: Advancing Risk Prediction, Prevention, Treatments, Personalised Care and Rehabilitation","ec.europa.eu/info/funding-tenders/opportunities/portal/screen/opportunities/topic-details/EU4H-2026-SANTE-PJ-04?isExactMatch=true&status=31094501,31094502,31094503&order=DESC&pageNumber=2&pageSize=100&sortBy=startDate",2026-01-06
Call for proposals to pilot and implement cancer screening programmes for prostate cancer,"ec.europa.eu/info/funding-tenders/opportunities/portal/screen/opportunities/topic-details/EU4H-2026-SANTE-PJ-03?isExactMatch=true&status=31094501,31094502,31094503&order=DESC&pageNumber=2&pageSize=100&sortBy=startDate",2026-01-06
Call for proposals to pilot and implement cancer screening programmes for lung cancer,"ec.europa.eu/info/funding-tenders/opportunities/portal/screen/opportunities/topic-details/EU4H-2026-SANTE-PJ-02?isExactMatch=true&status=31094501,31094502,31094503&order=DESC&pageNumber=2&pageSize=100&sortBy=startDate",2026-01-06
Call for proposals for health data for biotech innovation leveraging the European Health Data Space,"ec.europa.eu/info/funding-tenders/opportunities/portal/screen/opportunities/topic-details/EU4H-2026-SANTE-PJ-08?isExactMatch=true&status=31094501,31094502,31094503&order=DESC&pageNumber=2&pageSize=100&sortBy=startDate",2026-01-06
"Call for proposals for a programme on orphan medical devices, in particular targeting paediatric patients","ec.europa.eu/info/funding-tenders/opportunities/portal/screen/opportunities/topic-details/EU4H-2026-SANTE-PJ-07?isExactMatch=true&status=31094501,31094502,31094503&order=DESC&pageNumber=2&pageSize=100&sortBy=startDate",2026-01-06
Call for proposals on lifelong prevention for a healthy life with focus on cardiovascular diseases,"ec.europa.eu/info/funding-tenders/opportunities/portal/screen/opportunities/topic-details/EU4H-2026-SANTE-PJ-05?isExactMatch=true&status=31094501,31094502,31094503&order=DESC&pageNumber=2&pageSize=100&sortBy=startDate",2026-01-06
"Call for proposals to support the development of a medicine pricing, reimbursement and access tracker through the EURIPID database","ec.europa.eu/info/funding-tenders/opportunities/portal/screen/opportunities/topic-details/EU4H-2026-SANTE-PJ-06?isExactMatch=true&status=31094501,31094502,31094503&order=DESC&pageNumber=2&pageSize=100&sortBy=startDate",2026-01-06
Quantum Grand Challenge,"ec.europa.eu/info/funding-tenders/opportunities/portal/screen/opportunities/topic-details/HORIZON-JU-EUROHPC-2026-QGC-02-01?isExactMatch=true&status=31094501,31094502,31094503&order=DESC&pageNumber=1&pageSize=100&sortBy=startDate",2026-01-08
ERC CONSOLIDATOR GRANTS,"ec.europa.eu/info/funding-tenders/opportunities/portal/screen/opportunities/topic-details/ERC-2026-COG?isExactMatch=true&status=31094501,31094502,31094503&order=DESC&pageNumber=1&pageSize=100&sortBy=startDate",2026-01-13
Support for information measures relating to the common agricultural policy (IMCAP),"ec.europa.eu/info/funding-tenders/opportunities/portal/screen/opportunities/topic-details/IMCAP-2026-INFOME?isExactMatch=true&status=31094501,31094502,31094503&order=DESC&pageNumber=1&pageSize=100&sortBy=startDate",2026-01-14
Risk Assessments in Northern Eu,"ec.europa.eu/info/funding-tenders/opportunities/portal/screen/opportunities/topic-details/EUBA-EFSA-2025-BIOHAW-04-01-Lot1?isExactMatch=true&status=31094501,31094502,31094503&order=DESC&pageNumber=1&pageSize=100&sortBy=startDate",2026-01-15
Information measures for the EU Cohesion policy for 2025,"ec.europa.eu/info/funding-tenders/opportunities/portal/screen/opportunities/topic-details/IMREG-2025-INFOME?isExactMatch=true&status=31094501,31094502,31094503&order=DESC&pageNumber=1&pageSize=100&sortBy=startDate",2026-01-15
Risk Assessment in Eastern Eu,"ec.europa.eu/info/funding-tenders/opportunities/portal/screen/opportunities/topic-details/EUBA-EFSA-2025-BIOHAW-04-04-Lot4?isExactMatch=true&status=31094501,31094502,31094503&order=DESC&pageNumber=1&pageSize=100&sortBy=startDate",2026-01-15
EUROLakes Replication Call,"ec.europa.eu/info/funding-tenders/opportunities/portal/screen/opportunities/competitive-calls-cs/12061?isExactMatch=true&status=31094501,31094502,31094503&order=DESC&pageNumber=1&pageSize=100&sortBy=startDate",2026-01-15
