title,link,date
"COSMIC 1st Open Call: AI & Data Solutions to Boost the Green Transition
","ec.europa.eu/info/funding-tenders/opportunities/portal/screen/opportunities/competitive-calls-cs/11542?isExactMatch=true&status=31094501,31094502,31094503&order=DESC&pageNumber=2&pageSize=100&sortBy=startDate",2025-10-27
"contribuer à l’amélioration de la santé et du bien-être de la population et à la réduction de la mortalité, notamment des mères, des enfants et des plus vulnérables, y compris un grand nombre de réfugiés et personnes déplacées internes présents sur le territoire congolais, dans la perspective de progresser vers la Couverture Sanitaire Universelle nationale, particulièrement dans les provinces couvertes par le Couloir vert Kivu-Kinshasa»","ec.europa.eu/info/funding-tenders/opportunities/portal/screen/opportunities/prospect-details/184544PROSPECTSEN?isExactMatch=true&status=31094501,31094502,31094503&order=DESC&pageNumber=3&pageSize=100&sortBy=startDate",2025-10-27
HERIFORGE 1st Open Call ,"ec.europa.eu/info/funding-tenders/opportunities/portal/screen/opportunities/competitive-calls-cs/11522?isExactMatch=true&status=31094501,31094502,31094503&order=DESC&pageNumber=2&pageSize=100&sortBy=startDate",2025-10-28
EIC STEP Scale Up,"ec.europa.eu/info/funding-tenders/opportunities/portal/screen/opportunities/topic-details/HORIZON-EIC-2025-EICSTEP-01?isExactMatch=true&status=31094501,31094502,31094503&order=DESC&pageNumber=13&pageSize=100&sortBy=startDate",2025-10-28
EIC Accelerator 2025 - Short application,"ec.europa.eu/info/funding-tenders/opportunities/portal/screen/opportunities/topic-details/HORIZON-EIC-2025-ACCELERATOR-01?isExactMatch=true&status=31094501,31094502,31094503&order=DESC&pageNumber=14&pageSize=100&sortBy=startDate",2025-10-28
Better understanding incentives for private sector financing of adaptation solutions,"ec.europa.eu/info/funding-tenders/opportunities/portal/screen/opportunities/topic-details/HORIZON-MISS-2025-01-CLIMA-05?isExactMatch=true&status=31094501,31094502,31094503&order=DESC&pageNumber=8&pageSize=100&sortBy=startDate",2025-10-29
AI Challenge 2025,"ec.europa.eu/info/funding-tenders/opportunities/portal/screen/opportunities/competitive-calls-cs/11673?isExactMatch=true&status=31094501,31094502,31094503&order=DESC&pageNumber=2&pageSize=100&sortBy=startDate",2025-10-29
Demonstrating solutions to help hotspots in coastal regions to adapt to climate change,"ec.europa.eu/info/funding-tenders/opportunities/portal/screen/opportunities/topic-details/HORIZON-MISS-2025-01-CLIMA-03?isExactMatch=true&status=31094501,31094502,31094503&order=DESC&pageNumber=8&pageSize=100&sortBy=startDate",2025-10-29
Pre-commercial procurement of breakthrough solutions for climate proofing of public buildings,"ec.europa.eu/info/funding-tenders/opportunities/portal/screen/opportunities/topic-details/HORIZON-MISS-2025-01-CLIMA-06?isExactMatch=true&status=31094501,31094502,31094503&order=DESC&pageNumber=8&pageSize=100&sortBy=startDate",2025-10-29
Generative-AI based Agents to Revolutionize Medical Diagnosis and Treatment of Cancer,"ec.europa.eu/info/funding-tenders/opportunities/portal/screen/opportunities/topic-details/HORIZON-EIC-2025-PATHFINDERCHALLENGES-01-02?isExactMatch=true&status=31094501,31094502,31094503&order=DESC&pageNumber=3&pageSize=100&sortBy=startDate",2025-10-29
Networking and coordination of national HPC Competence Centres,"ec.europa.eu/info/funding-tenders/opportunities/portal/screen/opportunities/topic-details/DIGITAL-JU-EUROHPC-2025-NCC-01-02?isExactMatch=true&status=31094501,31094502,31094503&order=DESC&pageNumber=3&pageSize=100&sortBy=startDate",2025-10-29
"Testing and demonstrating innovative solutions to improve resilience to extreme heat, including addressing health impacts","ec.europa.eu/info/funding-tenders/opportunities/portal/screen/opportunities/topic-details/HORIZON-MISS-2025-01-CLIMA-04?isExactMatch=true&status=31094501,31094502,31094503&order=DESC&pageNumber=8&pageSize=100&sortBy=startDate",2025-10-29
"Waste-to-value devices - circular production of renewable fuels, chemicals and materials","ec.europa.eu/info/funding-tenders/opportunities/portal/screen/opportunities/topic-details/HORIZON-EIC-2025-PATHFINDERCHALLENGES-01-04?isExactMatch=true&status=31094501,31094502,31094503&order=DESC&pageNumber=3&pageSize=100&sortBy=startDate",2025-10-29
Supporting regional and local authorities in developing their Action Plans towards climate resilience,"ec.europa.eu/info/funding-tenders/opportunities/portal/screen/opportunities/topic-details/HORIZON-MISS-2025-01-CLIMA-02?isExactMatch=true&status=31094501,31094502,31094503&order=DESC&pageNumber=8&pageSize=100&sortBy=startDate",2025-10-29
National Competence Centres for High Performance Computing,"ec.europa.eu/info/funding-tenders/opportunities/portal/screen/opportunities/topic-details/DIGITAL-JU-EUROHPC-2025-NCC-01-01?isExactMatch=true&status=31094501,31094502,31094503&order=DESC&pageNumber=3&pageSize=100&sortBy=startDate",2025-10-29
Towards autonomous robot collectives delivering collaborative tasks in dynamic unstructured construction environments,"ec.europa.eu/info/funding-tenders/opportunities/portal/screen/opportunities/topic-details/HORIZON-EIC-2025-PATHFINDERCHALLENGES-01-03?isExactMatch=true&status=31094501,31094502,31094503&order=DESC&pageNumber=3&pageSize=100&sortBy=startDate",2025-10-29
Biotech for Climate Resilient Crops and Plant-Based Biomanufacturing,"ec.europa.eu/info/funding-tenders/opportunities/portal/screen/opportunities/topic-details/HORIZON-EIC-2025-PATHFINDERCHALLENGES-01-01?isExactMatch=true&status=31094501,31094502,31094503&order=DESC&pageNumber=3&pageSize=100&sortBy=startDate",2025-10-29
Supporting regions and local authorities in assessing climate risks,"ec.europa.eu/info/funding-tenders/opportunities/portal/screen/opportunities/topic-details/HORIZON-MISS-2025-01-CLIMA-01?isExactMatch=true&status=31094501,31094502,31094503&order=DESC&pageNumber=8&pageSize=100&sortBy=startDate",2025-10-29
Researching Research: Summer Schools & Workshops,www.volkswagenstiftung.de/en/funding/funding-offer/researching-research-summer-schools-workshops,2025-10-30
Researching Research: Summer Schools & Workshops,www.volkswagenstiftung.de/en/funding/funding-offer/researching-research-summer-schools-workshops,2025-10-30
Researching Research: Summer Schools & Workshops,www.volkswagenstiftung.de/en/funding/funding-offer/researching-research-summer-schools-workshops,2025-10-30
Exchange Schemes Open Call (oc4-2025-TES-02),"ec.europa.eu/info/funding-tenders/opportunities/portal/screen/opportunities/competitive-calls-cs/11462?isExactMatch=true&status=31094501,31094502,31094503&order=DESC&pageNumber=2&pageSize=100&sortBy=startDate",2025-10-31
Social Power - Convocatoria 1 ,"ec.europa.eu/info/funding-tenders/opportunities/portal/screen/opportunities/competitive-calls-cs/11664?isExactMatch=true&status=31094501,31094502,31094503&order=DESC&pageNumber=2&pageSize=100&sortBy=startDate",2025-10-31
DIGITWIN4CIUE Reduction-Fees Scholarships,"ec.europa.eu/info/funding-tenders/opportunities/portal/screen/opportunities/competitive-calls-cs/11321?isExactMatch=true&status=31094501,31094502,31094503&order=DESC&pageNumber=3&pageSize=100&sortBy=startDate",2025-10-31
RIZA Call for proposals,"ec.europa.eu/info/funding-tenders/opportunities/portal/screen/opportunities/competitive-calls-cs/11681?isExactMatch=true&status=31094501,31094502,31094503&order=DESC&pageNumber=2&pageSize=100&sortBy=startDate",2025-10-31
Call for applications for a grants to support cyber security audits in the framework of financial support to third parties.,"ec.europa.eu/info/funding-tenders/opportunities/portal/screen/opportunities/competitive-calls-cs/11481?isExactMatch=true&status=31094501,31094502,31094503&order=DESC&pageNumber=2&pageSize=100&sortBy=startDate",2025-10-31
Cross-Border Cooperation Programme Montenegro-Albania for 2021-2027 (Budget lines IPA 2022 and 2025),"ec.europa.eu/info/funding-tenders/opportunities/portal/screen/opportunities/prospect-details/184545PROSPECTSEN?isExactMatch=true&status=31094501,31094502,31094503&order=DESC&pageNumber=2&pageSize=100&sortBy=startDate",2025-10-31
Rapid Response Grants,"ec.europa.eu/info/funding-tenders/opportunities/portal/screen/opportunities/competitive-calls-cs/11782?isExactMatch=true&status=31094501,31094502,31094503&order=DESC&pageNumber=2&pageSize=100&sortBy=startDate",2025-10-31
Experience sharing grants,"ec.europa.eu/info/funding-tenders/opportunities/portal/screen/opportunities/competitive-calls-cs/11781?isExactMatch=true&status=31094501,31094502,31094503&order=DESC&pageNumber=2&pageSize=100&sortBy=startDate",2025-10-31
Financial Support to Third Parties: DANSER Open Call for Associated Regions,"ec.europa.eu/info/funding-tenders/opportunities/portal/screen/opportunities/competitive-calls-cs/11521?isExactMatch=true&status=31094501,31094502,31094503&order=DESC&pageNumber=2&pageSize=100&sortBy=startDate",2025-11-01
EFFEA Call #4,"ec.europa.eu/info/funding-tenders/opportunities/portal/screen/opportunities/competitive-calls-cs/11665?isExactMatch=true&status=31094501,31094502,31094503&order=DESC&pageNumber=2&pageSize=100&sortBy=startDate",2025-11-03
Open Call: Textile and clothing industry organisations in Athens and Rotterdam,"ec.europa.eu/info/funding-tenders/opportunities/portal/screen/opportunities/competitive-calls-cs/11671?isExactMatch=true&status=31094501,31094502,31094503&order=DESC&pageNumber=2&pageSize=100&sortBy=startDate",2025-11-03
Call for Registrations for ManagiDiTH students to attend the ManagiDiTH WInter School 2026 (Workshop on Managing Digital Transformation in the Health Sector),"ec.europa.eu/info/funding-tenders/opportunities/portal/screen/opportunities/competitive-calls-cs/11941?isExactMatch=true&status=31094501,31094502,31094503&order=DESC&pageNumber=1&pageSize=100&sortBy=startDate",2025-11-03
Lago de Yojoa. Mejora de la calidad del agua/Gobernanza hídrica/Concientización comunitaria,"ec.europa.eu/info/funding-tenders/opportunities/portal/screen/opportunities/topic-details/RELEX-NDICI-2025-HONDURAS-YOJOA-01?isExactMatch=true&status=31094501,31094502,31094503&order=DESC&pageNumber=6&pageSize=100&sortBy=startDate",2025-11-04
SMART ERA 1st Open Call for Pilots Add-ons,"ec.europa.eu/info/funding-tenders/opportunities/portal/screen/opportunities/competitive-calls-cs/11281?isExactMatch=true&status=31094501,31094502,31094503&order=DESC&pageNumber=2&pageSize=100&sortBy=startDate",2025-11-04
Zero Waste Grant Programme (ZWGP),"ec.europa.eu/info/funding-tenders/opportunities/portal/screen/opportunities/prospect-details/184356PROSPECTSEN?isExactMatch=true&status=31094501,31094502,31094503&order=DESC&pageNumber=3&pageSize=100&sortBy=startDate",2025-11-04
Lago de Yojoa y represa El Tablón. Restauración de Ecosistemas,"ec.europa.eu/info/funding-tenders/opportunities/portal/screen/opportunities/topic-details/RELEX-NDICI-2025-HONDURAS-YOJOA-TABLON-02?isExactMatch=true&status=31094501,31094502,31094503&order=DESC&pageNumber=6&pageSize=100&sortBy=startDate",2025-11-04
BOOST Call for Proposals,"ec.europa.eu/info/funding-tenders/opportunities/portal/screen/opportunities/competitive-calls-cs/10304?isExactMatch=true&status=31094501,31094502,31094503&order=DESC&pageNumber=10&pageSize=100&sortBy=startDate",2025-11-04
Empowering Truck Drivers – Revolutionizing European Logistics,"ec.europa.eu/info/funding-tenders/opportunities/portal/screen/opportunities/topic-details/PPPA-2025-EMPOWERTD?isExactMatch=true&status=31094501,31094502,31094503&order=DESC&pageNumber=2&pageSize=100&sortBy=startDate",2025-11-04
Resilmesh Open Call 2,"ec.europa.eu/info/funding-tenders/opportunities/portal/screen/opportunities/competitive-calls-cs/11669?isExactMatch=true&status=31094501,31094502,31094503&order=DESC&pageNumber=2&pageSize=100&sortBy=startDate",2025-11-05
ERC SYNERGY GRANTS,"ec.europa.eu/info/funding-tenders/opportunities/portal/screen/opportunities/topic-details/ERC-2026-SyG?isExactMatch=true&status=31094501,31094502,31094503&order=DESC&pageNumber=3&pageSize=100&sortBy=startDate",2025-11-05
Opus Magnum,www.volkswagenstiftung.de/en/funding/funding-offer/opus-magnum,2025-11-05
Opus Magnum,www.volkswagenstiftung.de/en/funding/funding-offer/opus-magnum,2025-11-05
Empowering Civil Society Organizations (CSOs) in Mauritius and Seychelles,"ec.europa.eu/info/funding-tenders/opportunities/portal/screen/opportunities/prospect-details/184705PROSPECTSEN?isExactMatch=true&status=31094501,31094502,31094503&order=DESC&pageNumber=2&pageSize=100&sortBy=startDate",2025-11-06
AMALTEA 1st Open Call - Call for SMEs & Start-ups: Innovative Solutions for Sustainable Construction,"ec.europa.eu/info/funding-tenders/opportunities/portal/screen/opportunities/competitive-calls-cs/11541?isExactMatch=true&status=31094501,31094502,31094503&order=DESC&pageNumber=2&pageSize=100&sortBy=startDate",2025-11-07
"Restoration of ecosystem functioning, integrity and connectivity","ec.europa.eu/info/funding-tenders/opportunities/portal/screen/opportunities/competitive-calls-cs/11666?isExactMatch=true&status=31094501,31094502,31094503&order=DESC&pageNumber=2&pageSize=100&sortBy=startDate",2025-11-07
"Strengthening the capacities of the Court of Auditors of the Kingdom of Morocco in certification of state accounts, evaluation of public programmes and projects and assessment of budget execution","ec.europa.eu/info/funding-tenders/opportunities/portal/screen/opportunities/prospect-details/184895PROSPECTSEN?isExactMatch=true&status=31094501,31094502,31094503&order=DESC&pageNumber=2&pageSize=100&sortBy=startDate",2025-11-10
"Programme d’appui à la mise en oeuvre du Plan d’action national de la résolution 1325 Femmes, paix et sécurité au Tchad","ec.europa.eu/info/funding-tenders/opportunities/portal/screen/opportunities/prospect-details/184496PROSPECTSEN?isExactMatch=true&status=31094501,31094502,31094503&order=DESC&pageNumber=1&pageSize=100&sortBy=startDate",2025-11-11
Security of implementations of Post-Quantum Cryptography algorithms,"ec.europa.eu/info/funding-tenders/opportunities/portal/screen/opportunities/topic-details/HORIZON-CL3-2025-02-CS-ECCC-05?isExactMatch=true&status=31094501,31094502,31094503&order=DESC&pageNumber=3&pageSize=100&sortBy=startDate",2025-11-12
"Twinning ""Capacity Building of the Kingdom's Judicial Agency (AJR)”","ec.europa.eu/info/funding-tenders/opportunities/portal/screen/opportunities/prospect-details/184936PROSPECTSEN?isExactMatch=true&status=31094501,31094502,31094503&order=DESC&pageNumber=2&pageSize=100&sortBy=startDate",2025-11-12
Integration of Post-Quantum Cryptography (PQC) algorithms into high-level protocols,"ec.europa.eu/info/funding-tenders/opportunities/portal/screen/opportunities/topic-details/HORIZON-CL3-2025-02-CS-ECCC-06?isExactMatch=true&status=31094501,31094502,31094503&order=DESC&pageNumber=4&pageSize=100&sortBy=startDate",2025-11-12
New advanced tools and processes for Operational Cybersecurity,"ec.europa.eu/info/funding-tenders/opportunities/portal/screen/opportunities/topic-details/HORIZON-CL3-2025-02-CS-ECCC-02?isExactMatch=true&status=31094501,31094502,31094503&order=DESC&pageNumber=4&pageSize=100&sortBy=startDate",2025-11-12
"Open topic on prevention, detection and deterrence of various forms of crime and terrorism through an enhanced understanding of the related societal issues","ec.europa.eu/info/funding-tenders/opportunities/portal/screen/opportunities/topic-details/HORIZON-CL3-2025-01-FCT-02?isExactMatch=true&status=31094501,31094502,31094503&order=DESC&pageNumber=4&pageSize=100&sortBy=startDate",2025-11-12
Demand-led innovation for civil security through Pre-Commercial Procurement (PCP),"ec.europa.eu/info/funding-tenders/opportunities/portal/screen/opportunities/topic-details/HORIZON-CL3-2025-01-SSRI-06?isExactMatch=true&status=31094501,31094502,31094503&order=DESC&pageNumber=4&pageSize=100&sortBy=startDate",2025-11-12
"National Contact Points (NCPs) in the field of security and cybersecurity fostering the links with National Community building for Safe, Secure and Resilient Societies","ec.europa.eu/info/funding-tenders/opportunities/portal/screen/opportunities/topic-details/HORIZON-CL3-2025-01-SSRI-01?isExactMatch=true&status=31094501,31094502,31094503&order=DESC&pageNumber=4&pageSize=100&sortBy=startDate",2025-11-12
Open topic on modern information and forensic evidence analysis and on frontline policing,"ec.europa.eu/info/funding-tenders/opportunities/portal/screen/opportunities/topic-details/HORIZON-CL3-2025-01-FCT-01?isExactMatch=true&status=31094501,31094502,31094503&order=DESC&pageNumber=4&pageSize=100&sortBy=startDate",2025-11-12
Generative AI for Cybersecurity applications,"ec.europa.eu/info/funding-tenders/opportunities/portal/screen/opportunities/topic-details/HORIZON-CL3-2025-02-CS-ECCC-01?isExactMatch=true&status=31094501,31094502,31094503&order=DESC&pageNumber=4&pageSize=100&sortBy=startDate",2025-11-12
"Open topic on improved intelligence picture and enhanced prevention, detection and deterrence of various forms of organised crime","ec.europa.eu/info/funding-tenders/opportunities/portal/screen/opportunities/topic-details/HORIZON-CL3-2025-01-FCT-03?isExactMatch=true&status=31094501,31094502,31094503&order=DESC&pageNumber=4&pageSize=100&sortBy=startDate",2025-11-12
"Innovative approaches for sustainable, inclusive and beautiful social and affordable housing","ec.europa.eu/info/funding-tenders/opportunities/portal/screen/opportunities/topic-details/HORIZON-NEB-2025-01-REGEN-04?isExactMatch=true&status=31094501,31094502,31094503&order=DESC&pageNumber=7&pageSize=100&sortBy=startDate",2025-11-12
Reverse local construction supply chains for the beautiful re-assembly of reclaimed construction products,"ec.europa.eu/info/funding-tenders/opportunities/portal/screen/opportunities/topic-details/HORIZON-NEB-2025-01-BUSINESS-03?isExactMatch=true&status=31094501,31094502,31094503&order=DESC&pageNumber=7&pageSize=100&sortBy=startDate",2025-11-12
"Advancing autonomous systems and robotics for high-risk disaster response, strengthening disaster resilience in conflict-afflicted crisis zones","ec.europa.eu/info/funding-tenders/opportunities/portal/screen/opportunities/topic-details/HORIZON-CL3-2025-01-DRS-04?isExactMatch=true&status=31094501,31094502,31094503&order=DESC&pageNumber=4&pageSize=100&sortBy=startDate",2025-11-12
Bottom-up social entrepreneurship for the co-creation of neighbourhoods in line with the New European Bauhaus,"ec.europa.eu/info/funding-tenders/opportunities/portal/screen/opportunities/topic-details/HORIZON-NEB-2025-01-BUSINESS-02?isExactMatch=true&status=31094501,31094502,31094503&order=DESC&pageNumber=7&pageSize=100&sortBy=startDate",2025-11-12
Sufficiency measures in the built environment,"ec.europa.eu/info/funding-tenders/opportunities/portal/screen/opportunities/topic-details/HORIZON-NEB-2025-01-REGEN-03?isExactMatch=true&status=31094501,31094502,31094503&order=DESC&pageNumber=7&pageSize=100&sortBy=startDate",2025-11-12
"Beautiful, sustainable and inclusive street furniture for the transformation of neighbourhoods","ec.europa.eu/info/funding-tenders/opportunities/portal/screen/opportunities/topic-details/HORIZON-NEB-2025-01-PARTICIPATION-03?isExactMatch=true&status=31094501,31094502,31094503&order=DESC&pageNumber=7&pageSize=100&sortBy=startDate",2025-11-12
Applying regenerative design to the built environment in neighbourhoods,"ec.europa.eu/info/funding-tenders/opportunities/portal/screen/opportunities/topic-details/HORIZON-NEB-2025-01-REGEN-01?isExactMatch=true&status=31094501,31094502,31094503&order=DESC&pageNumber=7&pageSize=100&sortBy=startDate",2025-11-12
Bio-fabricated materials for sustainable and beautiful construction,"ec.europa.eu/info/funding-tenders/opportunities/portal/screen/opportunities/topic-details/HORIZON-NEB-2025-01-REGEN-02?isExactMatch=true&status=31094501,31094502,31094503&order=DESC&pageNumber=7&pageSize=100&sortBy=startDate",2025-11-12
Network of neighbourhoods for innovative policies on gentrification,"ec.europa.eu/info/funding-tenders/opportunities/portal/screen/opportunities/topic-details/HORIZON-NEB-2025-01-PARTICIPATION-04?isExactMatch=true&status=31094501,31094502,31094503&order=DESC&pageNumber=7&pageSize=100&sortBy=startDate",2025-11-12
The impact of common space on neighbourhood communities,"ec.europa.eu/info/funding-tenders/opportunities/portal/screen/opportunities/topic-details/HORIZON-NEB-2025-01-PARTICIPATION-01?isExactMatch=true&status=31094501,31094502,31094503&order=DESC&pageNumber=7&pageSize=100&sortBy=startDate",2025-11-12
Fostering and maintaining the social fabric for the green transition in neighbourhoods,"ec.europa.eu/info/funding-tenders/opportunities/portal/screen/opportunities/topic-details/HORIZON-NEB-2025-01-PARTICIPATION-02?isExactMatch=true&status=31094501,31094502,31094503&order=DESC&pageNumber=7&pageSize=100&sortBy=startDate",2025-11-12
Renovating the built environment through design for adaptability and disassembly.,"ec.europa.eu/info/funding-tenders/opportunities/portal/screen/opportunities/topic-details/HORIZON-NEB-2025-01-BUSINESS-01?isExactMatch=true&status=31094501,31094502,31094503&order=DESC&pageNumber=7&pageSize=100&sortBy=startDate",2025-11-12
Accelerating uptake through open proposals for advanced SME innovation,"ec.europa.eu/info/funding-tenders/opportunities/portal/screen/opportunities/topic-details/HORIZON-CL3-2025-01-SSRI-04?isExactMatch=true&status=31094501,31094502,31094503&order=DESC&pageNumber=4&pageSize=100&sortBy=startDate",2025-11-12
Open grounds for pre-commercial procurement of innovative security technologies,"ec.europa.eu/info/funding-tenders/opportunities/portal/screen/opportunities/topic-details/HORIZON-CL3-2025-01-SSRI-03?isExactMatch=true&status=31094501,31094502,31094503&order=DESC&pageNumber=4&pageSize=100&sortBy=startDate",2025-11-12
Open topic on efficient border surveillance and maritime security,"ec.europa.eu/info/funding-tenders/opportunities/portal/screen/opportunities/topic-details/HORIZON-CL3-2025-01-BM-01?isExactMatch=true&status=31094501,31094502,31094503&order=DESC&pageNumber=4&pageSize=100&sortBy=startDate",2025-11-12
Security evaluations of Post-Quantum Cryptography (PQC) primitives,"ec.europa.eu/info/funding-tenders/opportunities/portal/screen/opportunities/topic-details/HORIZON-CL3-2025-02-CS-ECCC-04?isExactMatch=true&status=31094501,31094502,31094503&order=DESC&pageNumber=4&pageSize=100&sortBy=startDate",2025-11-12
Data repository for security research and innovation,"ec.europa.eu/info/funding-tenders/opportunities/portal/screen/opportunities/topic-details/HORIZON-CL3-2025-01-SSRI-05?isExactMatch=true&status=31094501,31094502,31094503&order=DESC&pageNumber=4&pageSize=100&sortBy=startDate",2025-11-12
Privacy Enhancing Technologies,"ec.europa.eu/info/funding-tenders/opportunities/portal/screen/opportunities/topic-details/HORIZON-CL3-2025-02-CS-ECCC-03?isExactMatch=true&status=31094501,31094502,31094503&order=DESC&pageNumber=4&pageSize=100&sortBy=startDate",2025-11-12
"Open topic on citizen and regional and/or local authorities' engagement in enhanced disaster risk awareness, including education, and preparedness","ec.europa.eu/info/funding-tenders/opportunities/portal/screen/opportunities/topic-details/HORIZON-CL3-2025-01-DRS-01?isExactMatch=true&status=31094501,31094502,31094503&order=DESC&pageNumber=4&pageSize=100&sortBy=startDate",2025-11-12
"Open topic for improved preparedness for, response to and recovery from large-scale disruptions of critical infrastructures","ec.europa.eu/info/funding-tenders/opportunities/portal/screen/opportunities/topic-details/HORIZON-CL3-2025-01-INFRA-01?isExactMatch=true&status=31094501,31094502,31094503&order=DESC&pageNumber=4&pageSize=100&sortBy=startDate",2025-11-12
Open topic on secured and facilitated crossing of external borders,"ec.europa.eu/info/funding-tenders/opportunities/portal/screen/opportunities/topic-details/HORIZON-CL3-2025-01-BM-02?isExactMatch=true&status=31094501,31094502,31094503&order=DESC&pageNumber=4&pageSize=100&sortBy=startDate",2025-11-12
Humanitarian demining / Unexploded Ordnance Disposal (UXO) of civil areas and unexploded ordnance risk education,"ec.europa.eu/info/funding-tenders/opportunities/portal/screen/opportunities/topic-details/HORIZON-CL3-2025-01-FCT-04?isExactMatch=true&status=31094501,31094502,31094503&order=DESC&pageNumber=4&pageSize=100&sortBy=startDate",2025-11-12
Open topic on better customs and supply chain security,"ec.europa.eu/info/funding-tenders/opportunities/portal/screen/opportunities/topic-details/HORIZON-CL3-2025-01-BM-03?isExactMatch=true&status=31094501,31094502,31094503&order=DESC&pageNumber=4&pageSize=100&sortBy=startDate",2025-11-12
Uptake Acceleration Services,"ec.europa.eu/info/funding-tenders/opportunities/portal/screen/opportunities/topic-details/HORIZON-CL3-2025-01-SSRI-02?isExactMatch=true&status=31094501,31094502,31094503&order=DESC&pageNumber=4&pageSize=100&sortBy=startDate",2025-11-12
"Open topic on testing / validating tools, technologies and data used in cross-border prevention, preparedness and responses to climate extreme and geological events and chemical, biological or radiological emergency threats","ec.europa.eu/info/funding-tenders/opportunities/portal/screen/opportunities/topic-details/HORIZON-CL3-2025-01-DRS-03?isExactMatch=true&status=31094501,31094502,31094503&order=DESC&pageNumber=4&pageSize=100&sortBy=startDate",2025-11-12
Open topic on Improving disaster risk management and governance to ensure self-sufficiency and sustainability of operations in support of enhanced resilience,"ec.europa.eu/info/funding-tenders/opportunities/portal/screen/opportunities/topic-details/HORIZON-CL3-2025-01-DRS-02?isExactMatch=true&status=31094501,31094502,31094503&order=DESC&pageNumber=4&pageSize=100&sortBy=startDate",2025-11-12
