title,link,date
Bioprospecting and optimised production of marine/aquatic natural products in the omics & artificial intelligence era,"ec.europa.eu/info/funding-tenders/opportunities/portal/screen/opportunities/topic-details/HORIZON-CL6-2025-01-CIRCBIO-14?isExactMatch=true&status=31094501,31094502,31094503&order=DESC&pageNumber=5&pageSize=100&sortBy=startDate",2025-09-17
Harmonizing and optimising composting plants performances in Europe,"ec.europa.eu/info/funding-tenders/opportunities/portal/screen/opportunities/topic-details/HORIZON-CL6-2025-01-CIRCBIO-12?isExactMatch=true&status=31094501,31094502,31094503&order=DESC&pageNumber=6&pageSize=100&sortBy=startDate",2025-09-17
"Integrated and coordinated approaches for coral reefs and associated ecosystems (mangroves and seagrass beds) conservation, restoration, and climate mitigation and adaptation","ec.europa.eu/info/funding-tenders/opportunities/portal/screen/opportunities/topic-details/HORIZON-CL6-2025-01-BIODIV-07?isExactMatch=true&status=31094501,31094502,31094503&order=DESC&pageNumber=6&pageSize=100&sortBy=startDate",2025-09-17
European mini-slate development,"ec.europa.eu/info/funding-tenders/opportunities/portal/screen/opportunities/topic-details/CREA-MEDIA-2025-DEVMINISLATE?isExactMatch=true&status=31094501,31094502,31094503&order=DESC&pageNumber=8&pageSize=100&sortBy=startDate",2025-09-17
Open Call for Grant for Circular Food MSMEs in AfriFOODlinks Hub Cities,"ec.europa.eu/info/funding-tenders/opportunities/portal/screen/opportunities/competitive-calls-cs/11381?isExactMatch=true&status=31094501,31094502,31094503&order=DESC&pageNumber=2&pageSize=100&sortBy=startDate",2025-09-17
Call Town Twinning 2025,"ec.europa.eu/info/funding-tenders/opportunities/portal/screen/opportunities/topic-details/CERV-2025-CITIZENS-TOWN-TT?isExactMatch=true&status=31094501,31094502,31094503&order=DESC&pageNumber=8&pageSize=100&sortBy=startDate",2025-09-17
EIC Transition Open,"ec.europa.eu/info/funding-tenders/opportunities/portal/screen/opportunities/topic-details/HORIZON-EIC-2025-TRANSITIONOPEN?isExactMatch=true&status=31094501,31094502,31094503&order=DESC&pageNumber=8&pageSize=100&sortBy=startDate",2025-09-17
Scaling-up nutritional proteins from alternative sources,"ec.europa.eu/info/funding-tenders/opportunities/portal/screen/opportunities/topic-details/HORIZON-JU-CBE-2025-IA-03?isExactMatch=true&status=31094501,31094502,31094503&order=DESC&pageNumber=8&pageSize=100&sortBy=startDate",2025-09-18
Reliable Services Operation,"ec.europa.eu/info/funding-tenders/opportunities/portal/screen/opportunities/topic-details/HORIZON-JU-SNS-2025-01-STREAM-B-04-02?isExactMatch=true&status=31094501,31094502,31094503&order=DESC&pageNumber=4&pageSize=100&sortBy=startDate",2025-09-18
Support to the European Strategy Forum on Research Infrastructures,"ec.europa.eu/info/funding-tenders/opportunities/portal/screen/opportunities/topic-details/HORIZON-INFRA-2025-01-DEV-04?isExactMatch=true&status=31094501,31094502,31094503&order=DESC&pageNumber=6&pageSize=100&sortBy=startDate",2025-09-18
Early phase implementation of ESFRI Projects that entered the ESFRI Roadmap in 2021,"ec.europa.eu/info/funding-tenders/opportunities/portal/screen/opportunities/topic-details/HORIZON-INFRA-2025-01-DEV-02?isExactMatch=true&status=31094501,31094502,31094503&order=DESC&pageNumber=6&pageSize=100&sortBy=startDate",2025-09-18
Research infrastructure services advancing frontier knowledge (bottom-up),"ec.europa.eu/info/funding-tenders/opportunities/portal/screen/opportunities/topic-details/HORIZON-INFRA-2025-01-SERV-04?isExactMatch=true&status=31094501,31094502,31094503&order=DESC&pageNumber=6&pageSize=100&sortBy=startDate",2025-09-18
Research infrastructure services to enable R&I addressing main challenges and EU priorities,"ec.europa.eu/info/funding-tenders/opportunities/portal/screen/opportunities/topic-details/HORIZON-INFRA-2025-01-SERV-02?isExactMatch=true&status=31094501,31094502,31094503&order=DESC&pageNumber=5&pageSize=100&sortBy=startDate",2025-09-18
AI-powered impact simulations in support of the Destination Earth initiative,"ec.europa.eu/info/funding-tenders/opportunities/portal/screen/opportunities/topic-details/HORIZON-INFRA-2025-01-TECH-03?isExactMatch=true&status=31094501,31094502,31094503&order=DESC&pageNumber=5&pageSize=100&sortBy=startDate",2025-09-18
Using Generative AI (GenAI4EU ) for Scientific Research via EOSC,"ec.europa.eu/info/funding-tenders/opportunities/portal/screen/opportunities/topic-details/HORIZON-INFRA-2025-01-EOSC-05?isExactMatch=true&status=31094501,31094502,31094503&order=DESC&pageNumber=5&pageSize=100&sortBy=startDate",2025-09-18
"Data stewards, skills and training for Open Science and FAIR practices","ec.europa.eu/info/funding-tenders/opportunities/portal/screen/opportunities/topic-details/HORIZON-INFRA-2025-01-EOSC-04?isExactMatch=true&status=31094501,31094502,31094503&order=DESC&pageNumber=5&pageSize=100&sortBy=startDate",2025-09-18
Research infrastructure services to enable R&I addressing main challenges and EU priorities related to the health domain,"ec.europa.eu/info/funding-tenders/opportunities/portal/screen/opportunities/topic-details/HORIZON-INFRA-2025-01-SERV-01?isExactMatch=true&status=31094501,31094502,31094503&order=DESC&pageNumber=5&pageSize=100&sortBy=startDate",2025-09-18
AI-generated digital twins for science,"ec.europa.eu/info/funding-tenders/opportunities/portal/screen/opportunities/topic-details/HORIZON-INFRA-2025-01-TECH-04?isExactMatch=true&status=31094501,31094502,31094503&order=DESC&pageNumber=6&pageSize=100&sortBy=startDate",2025-09-18
Higher Speed Optical Access Networks and future end-to-end Packet Optical Network Architecture in 6G,"ec.europa.eu/info/funding-tenders/opportunities/portal/screen/opportunities/topic-details/HORIZON-JU-SNS-2025-01-STREAM-B-03-02?isExactMatch=true&status=31094501,31094502,31094503&order=DESC&pageNumber=4&pageSize=100&sortBy=startDate",2025-09-18
Implementing research infrastructure technology roadmaps,"ec.europa.eu/info/funding-tenders/opportunities/portal/screen/opportunities/topic-details/HORIZON-INFRA-2025-01-TECH-02?isExactMatch=true&status=31094501,31094502,31094503&order=DESC&pageNumber=6&pageSize=100&sortBy=startDate",2025-09-18
"Bio-based drop-ins/smart drop-in platform chemicals, via cost-effective, sustainable and resource-efficient conversion of biomass","ec.europa.eu/info/funding-tenders/opportunities/portal/screen/opportunities/topic-details/HORIZON-JU-CBE-2025-IAFlag-02?isExactMatch=true&status=31094501,31094502,31094503&order=DESC&pageNumber=8&pageSize=100&sortBy=startDate",2025-09-18
New technologies and solutions for reducing the environmental and climate footprint of research infrastructures,"ec.europa.eu/info/funding-tenders/opportunities/portal/screen/opportunities/topic-details/HORIZON-INFRA-2025-01-TECH-01?isExactMatch=true&status=31094501,31094502,31094503&order=DESC&pageNumber=6&pageSize=100&sortBy=startDate",2025-09-18
Bio-based and biodegradable delivery systems for fertilising products to reduce microplastics pollution & promote soil health,"ec.europa.eu/info/funding-tenders/opportunities/portal/screen/opportunities/topic-details/HORIZON-JU-CBE-2025-RIA-02?isExactMatch=true&status=31094501,31094502,31094503&order=DESC&pageNumber=8&pageSize=100&sortBy=startDate",2025-09-18
Valorisation of untapped forest biomass,"ec.europa.eu/info/funding-tenders/opportunities/portal/screen/opportunities/topic-details/HORIZON-JU-CBE-2025-RIA-01?isExactMatch=true&status=31094501,31094502,31094503&order=DESC&pageNumber=8&pageSize=100&sortBy=startDate",2025-09-18
"Sustainable macroalgae systems for innovative, added-value applications: cultivation and optimised production systems","ec.europa.eu/info/funding-tenders/opportunities/portal/screen/opportunities/topic-details/HORIZON-JU-CBE-2025-IA-01?isExactMatch=true&status=31094501,31094502,31094503&order=DESC&pageNumber=8&pageSize=100&sortBy=startDate",2025-09-18
ERC PROOF OF CONCEPT GRANTS,"ec.europa.eu/info/funding-tenders/opportunities/portal/screen/opportunities/topic-details/ERC-2025-POC?isExactMatch=true&status=31094501,31094502,31094503&order=DESC&pageNumber=12&pageSize=100&sortBy=startDate",2025-09-18
Alternative biomanufacturing routes for natural and synthetic rubber,"ec.europa.eu/info/funding-tenders/opportunities/portal/screen/opportunities/topic-details/HORIZON-JU-CBE-2025-RIA-03?isExactMatch=true&status=31094501,31094502,31094503&order=DESC&pageNumber=8&pageSize=100&sortBy=startDate",2025-09-18
Advanced IoT and Device Technologies,"ec.europa.eu/info/funding-tenders/opportunities/portal/screen/opportunities/topic-details/HORIZON-JU-SNS-2025-01-STREAM-B-01-02?isExactMatch=true&status=31094501,31094502,31094503&order=DESC&pageNumber=4&pageSize=100&sortBy=startDate",2025-09-18
Advanced Architectures Systems and Technologies,"ec.europa.eu/info/funding-tenders/opportunities/portal/screen/opportunities/topic-details/HORIZON-JU-SNS-2025-01-STREAM-B-01-01?isExactMatch=true&status=31094501,31094502,31094503&order=DESC&pageNumber=4&pageSize=100&sortBy=startDate",2025-09-18
Wireless Communication Technologies and Signal Processing – Standardisation and Follow-up/PoCs,"ec.europa.eu/info/funding-tenders/opportunities/portal/screen/opportunities/topic-details/HORIZON-JU-SNS-2025-01-STREAM-B-02?isExactMatch=true&status=31094501,31094502,31094503&order=DESC&pageNumber=4&pageSize=100&sortBy=startDate",2025-09-18
Cost-effective and robust continuous biotech bio-based processes,"ec.europa.eu/info/funding-tenders/opportunities/portal/screen/opportunities/topic-details/HORIZON-JU-CBE-2025-IA-04?isExactMatch=true&status=31094501,31094502,31094503&order=DESC&pageNumber=8&pageSize=100&sortBy=startDate",2025-09-18
Research infrastructure services advancing frontier knowledge,"ec.europa.eu/info/funding-tenders/opportunities/portal/screen/opportunities/topic-details/HORIZON-INFRA-2025-01-SERV-03?isExactMatch=true&status=31094501,31094502,31094503&order=DESC&pageNumber=5&pageSize=100&sortBy=startDate",2025-09-18
Urban-industrial symbiosis for bio-waste valorisation,"ec.europa.eu/info/funding-tenders/opportunities/portal/screen/opportunities/topic-details/HORIZON-JU-CBE-2025-IAFlag-01?isExactMatch=true&status=31094501,31094502,31094503&order=DESC&pageNumber=8&pageSize=100&sortBy=startDate",2025-09-18
SSbD bio-based solutions to replace hazardous conventional chemicals for textiles production,"ec.europa.eu/info/funding-tenders/opportunities/portal/screen/opportunities/topic-details/HORIZON-JU-CBE-2025-IA-02?isExactMatch=true&status=31094501,31094502,31094503&order=DESC&pageNumber=8&pageSize=100&sortBy=startDate",2025-09-18
SSbD bio-based polymers/copolymers unlocking new market applications,"ec.europa.eu/info/funding-tenders/opportunities/portal/screen/opportunities/topic-details/HORIZON-JU-CBE-2025-IA-05?isExactMatch=true&status=31094501,31094502,31094503&order=DESC&pageNumber=8&pageSize=100&sortBy=startDate",2025-09-18
Retrofitting of (bio)refineries industrial plants towards higher-value bio-based products,"ec.europa.eu/info/funding-tenders/opportunities/portal/screen/opportunities/topic-details/HORIZON-JU-CBE-2025-IAFlag-04?isExactMatch=true&status=31094501,31094502,31094503&order=DESC&pageNumber=8&pageSize=100&sortBy=startDate",2025-09-18
Circular-by-design fibre-based packaging with improved properties,"ec.europa.eu/info/funding-tenders/opportunities/portal/screen/opportunities/topic-details/HORIZON-JU-CBE-2025-IAFlag-03?isExactMatch=true&status=31094501,31094502,31094503&order=DESC&pageNumber=8&pageSize=100&sortBy=startDate",2025-09-18
Advancing AI-readiness and Machine-Actionability in the EOSC Ecosystem,"ec.europa.eu/info/funding-tenders/opportunities/portal/screen/opportunities/topic-details/HORIZON-INFRA-2025-01-EOSC-03?isExactMatch=true&status=31094501,31094502,31094503&order=DESC&pageNumber=6&pageSize=100&sortBy=startDate",2025-09-18
Strengthening of the European Science for Policy Ecosystem,"ec.europa.eu/info/funding-tenders/opportunities/portal/screen/opportunities/topic-details/HORIZON-WIDERA-2025-06-ERA-06?isExactMatch=true&status=31094501,31094502,31094503&order=DESC&pageNumber=5&pageSize=100&sortBy=startDate",2025-09-18
Programme-level collaboration,"ec.europa.eu/info/funding-tenders/opportunities/portal/screen/opportunities/topic-details/HORIZON-WIDERA-2025-06-ERA-05?isExactMatch=true&status=31094501,31094502,31094503&order=DESC&pageNumber=5&pageSize=100&sortBy=startDate",2025-09-18
Investigating and addressing career barriers faced by underrepresented and marginalised researchers,"ec.europa.eu/info/funding-tenders/opportunities/portal/screen/opportunities/topic-details/HORIZON-WIDERA-2025-06-ERA-04?isExactMatch=true&status=31094501,31094502,31094503&order=DESC&pageNumber=5&pageSize=100&sortBy=startDate",2025-09-18
FAIR Integration for Enhanced Research Data in the EOSC ecosystem and beyond,"ec.europa.eu/info/funding-tenders/opportunities/portal/screen/opportunities/topic-details/HORIZON-INFRA-2025-01-EOSC-02?isExactMatch=true&status=31094501,31094502,31094503&order=DESC&pageNumber=6&pageSize=100&sortBy=startDate",2025-09-18
Training and up-skilling of research infrastructures technical staff,"ec.europa.eu/info/funding-tenders/opportunities/portal/screen/opportunities/topic-details/HORIZON-INFRA-2025-01-DEV-01?isExactMatch=true&status=31094501,31094502,31094503&order=DESC&pageNumber=6&pageSize=100&sortBy=startDate",2025-09-18
EOSC Nodes with federating capabilities for the EOSC Federation,"ec.europa.eu/info/funding-tenders/opportunities/portal/screen/opportunities/topic-details/HORIZON-INFRA-2025-01-EOSC-01?isExactMatch=true&status=31094501,31094502,31094503&order=DESC&pageNumber=6&pageSize=100&sortBy=startDate",2025-09-18
Science comes to town 2027,"ec.europa.eu/info/funding-tenders/opportunities/portal/screen/opportunities/topic-details/HORIZON-WIDERA-2025-06-ERA-07?isExactMatch=true&status=31094501,31094502,31094503&order=DESC&pageNumber=5&pageSize=100&sortBy=startDate",2025-09-18
Rolling out the ERA Policy Agenda results,"ec.europa.eu/info/funding-tenders/opportunities/portal/screen/opportunities/topic-details/HORIZON-WIDERA-2025-06-ERA-01?isExactMatch=true&status=31094501,31094502,31094503&order=DESC&pageNumber=5&pageSize=100&sortBy=startDate",2025-09-18
"Call for proposals to promote civil society organisations’ awareness of, capacity building and implementation of the EU Charter of Fundamental Rights","ec.europa.eu/info/funding-tenders/opportunities/portal/screen/opportunities/topic-details/CERV-2025-CHAR-LITI?isExactMatch=true&status=31094501,31094502,31094503&order=DESC&pageNumber=4&pageSize=100&sortBy=startDate",2025-09-18
"Preparatory actions exploring future frameworks for research infrastructures investment plans and funding streams, for integrated and sustained scheme for access and for joint technology development.","ec.europa.eu/info/funding-tenders/opportunities/portal/screen/opportunities/topic-details/HORIZON-INFRA-2025-01-DEV-05?isExactMatch=true&status=31094501,31094502,31094503&order=DESC&pageNumber=6&pageSize=100&sortBy=startDate",2025-09-18
Research and innovation to provide evidence that support reforms of research assessment,"ec.europa.eu/info/funding-tenders/opportunities/portal/screen/opportunities/topic-details/HORIZON-WIDERA-2025-06-ERA-03?isExactMatch=true&status=31094501,31094502,31094503&order=DESC&pageNumber=5&pageSize=100&sortBy=startDate",2025-09-18
"Consolidation of the Research Infrastructure landscape – Individual support for evolution, long term sustainability and emerging needs of pan-European research infrastructures","ec.europa.eu/info/funding-tenders/opportunities/portal/screen/opportunities/topic-details/HORIZON-INFRA-2025-01-DEV-03?isExactMatch=true&status=31094501,31094502,31094503&order=DESC&pageNumber=6&pageSize=100&sortBy=startDate",2025-09-18
6G Telco Cloud and Service Provision Enablers,"ec.europa.eu/info/funding-tenders/opportunities/portal/screen/opportunities/topic-details/HORIZON-JU-SNS-2025-01-STREAM-C-01?isExactMatch=true&status=31094501,31094502,31094503&order=DESC&pageNumber=4&pageSize=100&sortBy=startDate",2025-09-18
Microelectronic – Front-End Module (FEM),"ec.europa.eu/info/funding-tenders/opportunities/portal/screen/opportunities/topic-details/HORIZON-JU-SNS-2025-01-STREAM-B-05?isExactMatch=true&status=31094501,31094502,31094503&order=DESC&pageNumber=4&pageSize=100&sortBy=startDate",2025-09-18
6G NTN-TN Unification/Integration,"ec.europa.eu/info/funding-tenders/opportunities/portal/screen/opportunities/topic-details/HORIZON-JU-SNS-2025-01-STREAM-B-03-01?isExactMatch=true&status=31094501,31094502,31094503&order=DESC&pageNumber=4&pageSize=100&sortBy=startDate",2025-09-18
Develop and deploy new curricula and knowledge exchange practices relevant to bio-based systems,"ec.europa.eu/info/funding-tenders/opportunities/portal/screen/opportunities/topic-details/HORIZON-JU-CBE-2025-CSA-01?isExactMatch=true&status=31094501,31094502,31094503&order=DESC&pageNumber=8&pageSize=100&sortBy=startDate",2025-09-18
Enable sustained coordination and guidance at the European level on institutional non-profit open access publishing,"ec.europa.eu/info/funding-tenders/opportunities/portal/screen/opportunities/topic-details/HORIZON-WIDERA-2025-06-ERA-02?isExactMatch=true&status=31094501,31094502,31094503&order=DESC&pageNumber=5&pageSize=100&sortBy=startDate",2025-09-18
Smart Security / Security Services,"ec.europa.eu/info/funding-tenders/opportunities/portal/screen/opportunities/topic-details/HORIZON-JU-SNS-2025-01-STREAM-B-04-01?isExactMatch=true&status=31094501,31094502,31094503&order=DESC&pageNumber=4&pageSize=100&sortBy=startDate",2025-09-18
SNS Trials and Pilots (T&Ps) with Verticals,"ec.europa.eu/info/funding-tenders/opportunities/portal/screen/opportunities/topic-details/HORIZON-JU-SNS-2025-02-STREAM-D-01?isExactMatch=true&status=31094501,31094502,31094503&order=DESC&pageNumber=2&pageSize=100&sortBy=startDate",2025-09-18
Appui au Centre National du Registre de Commerce (CNRC),"ec.europa.eu/info/funding-tenders/opportunities/portal/screen/opportunities/prospect-details/184711PROSPECTSEN?isExactMatch=true&status=31094501,31094502,31094503&order=DESC&pageNumber=2&pageSize=100&sortBy=startDate",2025-09-19
EIT Regional Innovation Booster 2025 - Polish edition Call for Stage 1,"ec.europa.eu/info/funding-tenders/opportunities/portal/screen/opportunities/competitive-calls-cs/11241?isExactMatch=true&status=31094501,31094502,31094503&order=DESC&pageNumber=2&pageSize=100&sortBy=startDate",2025-09-21
Pilots of long-term climate impact forest monitoring sites: Providing temporally resolved ecosystem-level information on the effects of climatic drivers on forest structure and function in near real-time,"ec.europa.eu/info/funding-tenders/opportunities/portal/screen/opportunities/competitive-calls-cs/11082?isExactMatch=true&status=31094501,31094502,31094503&order=DESC&pageNumber=2&pageSize=100&sortBy=startDate",2025-09-21
Pilots of long-term climate impact forest monitoring sites: Linking stand-level information and remote sensing ,"ec.europa.eu/info/funding-tenders/opportunities/portal/screen/opportunities/competitive-calls-cs/11081?isExactMatch=true&status=31094501,31094502,31094503&order=DESC&pageNumber=2&pageSize=100&sortBy=startDate",2025-09-21
Quality Label Humanitarian Aid - Full Procedure,"ec.europa.eu/info/funding-tenders/opportunities/portal/screen/opportunities/topic-details/ESC-HUMAID-2021-QUAL-LABEL-FP?isExactMatch=true&status=31094501,31094502,31094503&order=DESC&pageNumber=56&pageSize=100&sortBy=startDate",2025-09-22
Development of safe and sustainable by design alternatives to Perfluoroalkyl and Polyfluoroalkyl Substances (PFAS) (IA),"ec.europa.eu/info/funding-tenders/opportunities/portal/screen/opportunities/topic-details/HORIZON-CL4-2025-05-MATERIALS-51-two-stage?isExactMatch=true&status=31094501,31094502,31094503&order=DESC&pageNumber=4&pageSize=100&sortBy=startDate",2025-09-23
Integrated approaches for remanufacturing (Made in Europe Partnership) (IA),"ec.europa.eu/info/funding-tenders/opportunities/portal/screen/opportunities/topic-details/HORIZON-CL4-INDUSTRY-2025-01-TWIN-TRANSITION-01?isExactMatch=true&status=31094501,31094502,31094503&order=DESC&pageNumber=4&pageSize=100&sortBy=startDate",2025-09-23
Safe and clean processing technologies and products (Processes4Planet partnership) (RIA),"ec.europa.eu/info/funding-tenders/opportunities/portal/screen/opportunities/topic-details/HORIZON-CL4-INDUSTRY-2025-01-TWIN-TRANSITION-36?isExactMatch=true&status=31094501,31094502,31094503&order=DESC&pageNumber=4&pageSize=100&sortBy=startDate",2025-09-23
Technologies for critical raw materials and strategic raw materials from end-of-life products (IA),"ec.europa.eu/info/funding-tenders/opportunities/portal/screen/opportunities/topic-details/HORIZON-CL4-INDUSTRY-2025-01-MATERIALS-61?isExactMatch=true&status=31094501,31094502,31094503&order=DESC&pageNumber=4&pageSize=100&sortBy=startDate",2025-09-23
Demonstrators for clusters of social circular enterprises (IA),"ec.europa.eu/info/funding-tenders/opportunities/portal/screen/opportunities/topic-details/HORIZON-CL4-2025-05-TWIN-TRANSITION-21-two-stage?isExactMatch=true&status=31094501,31094502,31094503&order=DESC&pageNumber=4&pageSize=100&sortBy=startDate",2025-09-23
"Towards human-centric, sustainable and resilient energy-intensive industries (Processes4Planet and Clean Steel partnerships) (CSA)","ec.europa.eu/info/funding-tenders/opportunities/portal/screen/opportunities/topic-details/HORIZON-CL4-INDUSTRY-2025-01-TWIN-TRANSITION-39?isExactMatch=true&status=31094501,31094502,31094503&order=DESC&pageNumber=4&pageSize=100&sortBy=startDate",2025-09-23
Physical and cognitive augmentation in advanced manufacturing (Made in Europe Partnership) (RIA),"ec.europa.eu/info/funding-tenders/opportunities/portal/screen/opportunities/topic-details/HORIZON-CL4-INDUSTRY-2025-01-TWIN-TRANSITION-02?isExactMatch=true&status=31094501,31094502,31094503&order=DESC&pageNumber=4&pageSize=100&sortBy=startDate",2025-09-23
Facilitated cooperation for AI in Science (CSA),"ec.europa.eu/info/funding-tenders/opportunities/portal/screen/opportunities/topic-details/HORIZON-CL4-INDUSTRY-2025-01-DIGITAL-62?isExactMatch=true&status=31094501,31094502,31094503&order=DESC&pageNumber=4&pageSize=100&sortBy=startDate",2025-09-23
Developing and embedding upcycling technologies into viable business (Processes4Planet partnership) (IA),"ec.europa.eu/info/funding-tenders/opportunities/portal/screen/opportunities/topic-details/HORIZON-CL4-2025-05-TWIN-TRANSITION-35-two-stage?isExactMatch=true&status=31094501,31094502,31094503&order=DESC&pageNumber=4&pageSize=100&sortBy=startDate",2025-09-23
Solving issues in carbon-neutral iron and steel making processes with diverse input materials of varying quality (Clean Steel Partnership) (RIA),"ec.europa.eu/info/funding-tenders/opportunities/portal/screen/opportunities/topic-details/HORIZON-CL4-INDUSTRY-2025-01-TWIN-TRANSITION-37?isExactMatch=true&status=31094501,31094502,31094503&order=DESC&pageNumber=4&pageSize=100&sortBy=startDate",2025-09-23
EU Co-funded Partnership on raw materials for the green and digital transition (Co-funded partnership Raw Materials for the Green and Digital Transition),"ec.europa.eu/info/funding-tenders/opportunities/portal/screen/opportunities/topic-details/HORIZON-CL4-INDUSTRY-2025-01-MATERIALS-64?isExactMatch=true&status=31094501,31094502,31094503&order=DESC&pageNumber=4&pageSize=100&sortBy=startDate",2025-09-23
Advanced manufacturing technologies for leadership of EU manufacturers in products for the net-zero industry (Made in Europe Partnership) (IA),"ec.europa.eu/info/funding-tenders/opportunities/portal/screen/opportunities/topic-details/HORIZON-CL4-INDUSTRY-2025-01-TWIN-TRANSITION-05?isExactMatch=true&status=31094501,31094502,31094503&order=DESC&pageNumber=4&pageSize=100&sortBy=startDate",2025-09-23
Strategic Partnerships for Raw Materials: Innovative Approaches for sustainable production of Critical Raw Materials (IA),"ec.europa.eu/info/funding-tenders/opportunities/portal/screen/opportunities/topic-details/HORIZON-CL4-INDUSTRY-2025-01-MATERIALS-62?isExactMatch=true&status=31094501,31094502,31094503&order=DESC&pageNumber=4&pageSize=100&sortBy=startDate",2025-09-23
Enhanced logistics and operations of construction sites (IA),"ec.europa.eu/info/funding-tenders/opportunities/portal/screen/opportunities/topic-details/HORIZON-CL4-2025-05-TWIN-TRANSITION-11-two-stage?isExactMatch=true&status=31094501,31094502,31094503&order=DESC&pageNumber=4&pageSize=100&sortBy=startDate",2025-09-23
Accelerate the uptake of life-cycle assessment (LCA) for Safe and Sustainable by Design (SSbD) chemicals and materials and resulting products (RIA),"ec.europa.eu/info/funding-tenders/opportunities/portal/screen/opportunities/topic-details/HORIZON-CL4-INDUSTRY-2025-01-MATERIALS-52?isExactMatch=true&status=31094501,31094502,31094503&order=DESC&pageNumber=4&pageSize=100&sortBy=startDate",2025-09-23
AI Foundation models in science (GenAI4EU) (RIA),"ec.europa.eu/info/funding-tenders/opportunities/portal/screen/opportunities/topic-details/HORIZON-CL4-INDUSTRY-2025-01-DIGITAL-61?isExactMatch=true&status=31094501,31094502,31094503&order=DESC&pageNumber=4&pageSize=100&sortBy=startDate",2025-09-23
"Innovative Advanced Materials (IAMs) for product monitoring, smart maintenance and repair strategies in the construction sector (RIA) (Innovative Advanced Materials for Europe partnership)","ec.europa.eu/info/funding-tenders/opportunities/portal/screen/opportunities/topic-details/HORIZON-CL4-2025-05-MATERIALS-42-two-stage?isExactMatch=true&status=31094501,31094502,31094503&order=DESC&pageNumber=4&pageSize=100&sortBy=startDate",2025-09-23
