title,link,date
Risk Assessments in Southern Eu,"ec.europa.eu/info/funding-tenders/opportunities/portal/screen/opportunities/topic-details/EUBA-EFSA-2025-BIOHAW-04-02-Lot2?isExactMatch=true&status=31094501,31094502,31094503&order=DESC&pageNumber=1&pageSize=100&sortBy=startDate",2026-01-15
ERC 2026 PERA,"ec.europa.eu/info/funding-tenders/opportunities/portal/screen/opportunities/topic-details/ERC-2026-PERA?isExactMatch=true&status=31094501,31094502,31094503&order=DESC&pageNumber=1&pageSize=100&sortBy=startDate",2026-01-15
UNITE Open Call 1 for Joint Interregional Projects ,"ec.europa.eu/info/funding-tenders/opportunities/portal/screen/opportunities/competitive-calls-cs/12003?isExactMatch=true&status=31094501,31094502,31094503&order=DESC&pageNumber=1&pageSize=100&sortBy=startDate",2026-01-15
Risk Assessment in Western Eu,"ec.europa.eu/info/funding-tenders/opportunities/portal/screen/opportunities/topic-details/EUBA-EFSA-2025-BIOHAW-04-03-Lot3?isExactMatch=true&status=31094501,31094502,31094503&order=DESC&pageNumber=1&pageSize=100&sortBy=startDate",2026-01-15
Innovative tools and business models,"ec.europa.eu/info/funding-tenders/opportunities/portal/screen/opportunities/topic-details/CREA-MEDIA-2026-INNOVBUSMOD?isExactMatch=true&status=31094501,31094502,31094503&order=DESC&pageNumber=1&pageSize=100&sortBy=startDate",2026-01-15
Call for Applications: 2026 Catalyse NEB,"ec.europa.eu/info/funding-tenders/opportunities/portal/screen/opportunities/competitive-calls-cs/11841?isExactMatch=true&status=31094501,31094502,31094503&order=DESC&pageNumber=1&pageSize=100&sortBy=startDate",2026-01-19
"Approaches, verification and training for Edge-AI building blocks for CCAM Systems (CCAM Partnership)","ec.europa.eu/info/funding-tenders/opportunities/portal/screen/opportunities/topic-details/HORIZON-CL5-2026-01-D6-05?isExactMatch=true&status=31094501,31094502,31094503&order=DESC&pageNumber=1&pageSize=100&sortBy=startDate",2026-01-20
Teaming for Excellence,"ec.europa.eu/info/funding-tenders/opportunities/portal/screen/opportunities/topic-details/HORIZON-WIDERA-2025-ACCESS-01-01-two-stage?isExactMatch=true&status=31094501,31094502,31094503&order=DESC&pageNumber=13&pageSize=100&sortBy=startDate",2026-01-20
Predicting and avoiding road crashes based on Artificial Intelligence (AI) and big data,"ec.europa.eu/info/funding-tenders/opportunities/portal/screen/opportunities/topic-details/HORIZON-CL5-2026-01-D6-14?isExactMatch=true&status=31094501,31094502,31094503&order=DESC&pageNumber=1&pageSize=100&sortBy=startDate",2026-01-20
Transversal Centres of Excellence,"ec.europa.eu/info/funding-tenders/opportunities/portal/screen/opportunities/topic-details/HORIZON-JU-EUROHPC-2026-COE-LH-01-02?isExactMatch=true&status=31094501,31094502,31094503&order=DESC&pageNumber=4&pageSize=100&sortBy=startDate",2026-01-20
"Integrating advanced materials, cell design and manufacturing development for high-performance batteries aimed at mobility (Batt4EU Partnership)","ec.europa.eu/info/funding-tenders/opportunities/portal/screen/opportunities/topic-details/HORIZON-CL5-2026-01-D2-04?isExactMatch=true&status=31094501,31094502,31094503&order=DESC&pageNumber=2&pageSize=100&sortBy=startDate",2026-01-20
Integrating inland waterway transport in smart shipping and multimodal logistics chains,"ec.europa.eu/info/funding-tenders/opportunities/portal/screen/opportunities/topic-details/HORIZON-CL5-2026-01-D6-10?isExactMatch=true&status=31094501,31094502,31094503&order=DESC&pageNumber=2&pageSize=100&sortBy=startDate",2026-01-20
Development of sustainable and design-to-cost batteries with (energy-)efficient manufacturing processes and based on advanced and safer materials (Batt4EU Partnership),"ec.europa.eu/info/funding-tenders/opportunities/portal/screen/opportunities/topic-details/HORIZON-CL5-2026-01-D2-01?isExactMatch=true&status=31094501,31094502,31094503&order=DESC&pageNumber=1&pageSize=100&sortBy=startDate",2026-01-20
Community Centres of Excellence,"ec.europa.eu/info/funding-tenders/opportunities/portal/screen/opportunities/topic-details/HORIZON-JU-EUROHPC-2026-COE-LH-01-01?isExactMatch=true&status=31094501,31094502,31094503&order=DESC&pageNumber=4&pageSize=100&sortBy=startDate",2026-01-20
Icing in the context of sustainable aviation,"ec.europa.eu/info/funding-tenders/opportunities/portal/screen/opportunities/topic-details/HORIZON-CL5-2026-01-D6-15?isExactMatch=true&status=31094501,31094502,31094503&order=DESC&pageNumber=1&pageSize=100&sortBy=startDate",2026-01-20
Accelerating freight transport and logistics digital innovation,"ec.europa.eu/info/funding-tenders/opportunities/portal/screen/opportunities/topic-details/HORIZON-CL5-2026-01-D6-08?isExactMatch=true&status=31094501,31094502,31094503&order=DESC&pageNumber=1&pageSize=100&sortBy=startDate",2026-01-20
"Safety of Cyclists, Pedestrians and Users of Micromobility Devices","ec.europa.eu/info/funding-tenders/opportunities/portal/screen/opportunities/topic-details/HORIZON-CL5-2026-01-D6-13?isExactMatch=true&status=31094501,31094502,31094503&order=DESC&pageNumber=1&pageSize=100&sortBy=startDate",2026-01-20
Reliable data and practices to measure and calculate transport emissions in multimodal transport chains,"ec.europa.eu/info/funding-tenders/opportunities/portal/screen/opportunities/topic-details/HORIZON-CL5-2026-01-D6-09?isExactMatch=true&status=31094501,31094502,31094503&order=DESC&pageNumber=1&pageSize=100&sortBy=startDate",2026-01-20
"Accelerated multi-physical and virtual testing for battery aging, reliability, and safety evaluation (Batt4EU Partnership)","ec.europa.eu/info/funding-tenders/opportunities/portal/screen/opportunities/topic-details/HORIZON-CL5-2026-01-D2-05?isExactMatch=true&status=31094501,31094502,31094503&order=DESC&pageNumber=1&pageSize=100&sortBy=startDate",2026-01-20
Federated CCAM data exchange platform (CCAM Partnership),"ec.europa.eu/info/funding-tenders/opportunities/portal/screen/opportunities/topic-details/HORIZON-CL5-2026-01-D6-06?isExactMatch=true&status=31094501,31094502,31094503&order=DESC&pageNumber=1&pageSize=100&sortBy=startDate",2026-01-20
European network of national competence centers for innovation procurement,"ec.europa.eu/info/funding-tenders/opportunities/portal/screen/opportunities/topic-details/HORIZON-EIE-2026-01-CONNECT-01?isExactMatch=true&status=31094501,31094502,31094503&order=DESC&pageNumber=2&pageSize=100&sortBy=startDate",2026-01-20
Expanding Investment Ecosystems,"ec.europa.eu/info/funding-tenders/opportunities/portal/screen/opportunities/topic-details/HORIZON-EIE-2026-01-CONNECT-02?isExactMatch=true&status=31094501,31094502,31094503&order=DESC&pageNumber=2&pageSize=100&sortBy=startDate",2026-01-20
Scaling up deep tech ecosystems,"ec.europa.eu/info/funding-tenders/opportunities/portal/screen/opportunities/topic-details/HORIZON-EIE-2026-01-CONNECT-03?isExactMatch=true&status=31094501,31094502,31094503&order=DESC&pageNumber=2&pageSize=100&sortBy=startDate",2026-01-20
"Innovative construction and maintenance, with the use of new materials and techniques, for resilient and sustainable transport infrastructure","ec.europa.eu/info/funding-tenders/opportunities/portal/screen/opportunities/topic-details/HORIZON-CL5-2026-01-D6-07?isExactMatch=true&status=31094501,31094502,31094503&order=DESC&pageNumber=2&pageSize=100&sortBy=startDate",2026-01-20
Markets and Networking,"ec.europa.eu/info/funding-tenders/opportunities/portal/screen/opportunities/topic-details/CREA-MEDIA-2026-MARKETNET?isExactMatch=true&status=31094501,31094502,31094503&order=DESC&pageNumber=1&pageSize=100&sortBy=startDate",2026-01-20
Lighthouse Codes for HPC Applications,"ec.europa.eu/info/funding-tenders/opportunities/portal/screen/opportunities/topic-details/HORIZON-JU-EUROHPC-2026-COE-LH-01-03?isExactMatch=true&status=31094501,31094502,31094503&order=DESC&pageNumber=4&pageSize=100&sortBy=startDate",2026-01-20
Integration of human driving behaviour in the validation of CCAM systems (CCAM Partnership),"ec.europa.eu/info/funding-tenders/opportunities/portal/screen/opportunities/topic-details/HORIZON-CL5-2026-01-D6-04?isExactMatch=true&status=31094501,31094502,31094503&order=DESC&pageNumber=2&pageSize=100&sortBy=startDate",2026-01-20
"Boosting the transformation towards climate-neutral cities, the net-zero economy and open strategic autonomy through Pre-Commercial Procurement (PCP)","ec.europa.eu/info/funding-tenders/opportunities/portal/screen/opportunities/topic-details/HORIZON-MISS-2026-04-PCP-CIT-01?isExactMatch=true&status=31094501,31094502,31094503&order=DESC&pageNumber=8&pageSize=100&sortBy=startDate",2026-01-20
Real time monitoring of regulated and non-regulated emissions from all types of vessels and other port activities in order to enforce emission limits in waterfront cities,"ec.europa.eu/info/funding-tenders/opportunities/portal/screen/opportunities/topic-details/HORIZON-CL5-2026-01-D5-17?isExactMatch=true&status=31094501,31094502,31094503&order=DESC&pageNumber=2&pageSize=100&sortBy=startDate",2026-01-20
"Next-generation environment perception for real world CCAM operations: Error-free and secure technologies to improve energy-efficiency, cost-effectiveness, and circularity (CCAM Partnership)","ec.europa.eu/info/funding-tenders/opportunities/portal/screen/opportunities/topic-details/HORIZON-CL5-2026-01-D6-03?isExactMatch=true&status=31094501,31094502,31094503&order=DESC&pageNumber=1&pageSize=100&sortBy=startDate",2026-01-20
Monitoring and Evaluation of the Societal Readiness Pilot,"ec.europa.eu/info/funding-tenders/opportunities/portal/screen/opportunities/topic-details/HORIZON-CL5-2026-01-D2-09?isExactMatch=true&status=31094501,31094502,31094503&order=DESC&pageNumber=1&pageSize=100&sortBy=startDate",2026-01-20
Framework Loans,"ec.europa.eu/info/funding-tenders/opportunities/portal/screen/opportunities/topic-details/JTM-2026-PSLF-FRAMEWORK-LOANS?isExactMatch=true&status=31094501,31094502,31094503&order=DESC&pageNumber=1&pageSize=100&sortBy=startDate",2026-01-27
Standalone projects,"ec.europa.eu/info/funding-tenders/opportunities/portal/screen/opportunities/topic-details/JTM-2026-PSLF-STANDALONE-PROJECTS?isExactMatch=true&status=31094501,31094502,31094503&order=DESC&pageNumber=1&pageSize=100&sortBy=startDate",2026-01-27
Erasmus Charter for Higher Education,"ec.europa.eu/info/funding-tenders/opportunities/portal/screen/opportunities/topic-details/ERASMUS-EDU-2022-ECHE-CERT-FP?isExactMatch=true&status=31094501,31094502,31094503&order=DESC&pageNumber=45&pageSize=100&sortBy=startDate",2026-01-27
Circulation of European literary works,"ec.europa.eu/info/funding-tenders/opportunities/portal/screen/opportunities/topic-details/CREA-CULT-2026-LIT?isExactMatch=true&status=31094501,31094502,31094503&order=DESC&pageNumber=1&pageSize=100&sortBy=startDate",2026-01-29
EU-UK Think-Tanks engagement,"ec.europa.eu/info/funding-tenders/opportunities/portal/screen/opportunities/prospect-details/185232PROSPECTSEN?isExactMatch=true&status=31094501,31094502,31094503&order=DESC&pageNumber=1&pageSize=100&sortBy=startDate",2026-01-30
NEWS - JOURNALISM PARTNERSHIPS - PLURALISM,"ec.europa.eu/info/funding-tenders/opportunities/portal/screen/opportunities/topic-details/CREA-CROSS-2026-JOURPART-PLURALISM?isExactMatch=true&status=31094501,31094502,31094503&order=DESC&pageNumber=1&pageSize=100&sortBy=startDate",2026-02-04
NEWS - JOURNALISM PARTNERSHIPS - COLLABORATIONS,"ec.europa.eu/info/funding-tenders/opportunities/portal/screen/opportunities/topic-details/CREA-CROSS-2026-JOURPART-COLLABORATIONS?isExactMatch=true&status=31094501,31094502,31094503&order=DESC&pageNumber=1&pageSize=100&sortBy=startDate",2026-02-04
STUDIES ON INNOVATION IN CLIMATE FINANCE FOR RAIL,"ec.europa.eu/info/funding-tenders/opportunities/portal/screen/opportunities/topic-details/HORIZON-JU-ER-2025-EXPLR-02?isExactMatch=true&status=31094501,31094502,31094503&order=DESC&pageNumber=1&pageSize=100&sortBy=startDate",2026-02-11
EXTENDING THE RAIL NETWORK OF PHDS,"ec.europa.eu/info/funding-tenders/opportunities/portal/screen/opportunities/topic-details/HORIZON-JU-ER-2025-EXPLR-03?isExactMatch=true&status=31094501,31094502,31094503&order=DESC&pageNumber=1&pageSize=100&sortBy=startDate",2026-02-11
Video games and immersive content development,"ec.europa.eu/info/funding-tenders/opportunities/portal/screen/opportunities/topic-details/CREA-MEDIA-2026-DEVVGIM?isExactMatch=true&status=31094501,31094502,31094503&order=DESC&pageNumber=1&pageSize=100&sortBy=startDate",2026-02-11
A SUSTAINABLE AND GREEN RAIL SYSTEM,"ec.europa.eu/info/funding-tenders/opportunities/portal/screen/opportunities/topic-details/HORIZON-JU-ER-2025-FA4-01?isExactMatch=true&status=31094501,31094502,31094503&order=DESC&pageNumber=1&pageSize=100&sortBy=startDate",2026-02-11
NETWORK MANAGEMENT PLANNING AND CONTROL & MOBILITY MANAGEMENT IN A MULTIMODAL ENVIRONMENT AND DIGITAL ENABLERS,"ec.europa.eu/info/funding-tenders/opportunities/portal/screen/opportunities/topic-details/HORIZON-JU-ER-2025-FA1-TT-01?isExactMatch=true&status=31094501,31094502,31094503&order=DESC&pageNumber=1&pageSize=100&sortBy=startDate",2026-02-11
SUSTAINABLE COMPETITIVE DIGITAL GREEN RAIL FREIGHT SERVICES,"ec.europa.eu/info/funding-tenders/opportunities/portal/screen/opportunities/topic-details/HORIZON-JU-ER-2025-FA5-01?isExactMatch=true&status=31094501,31094502,31094503&order=DESC&pageNumber=1&pageSize=100&sortBy=startDate",2026-02-11
DIGITAL & AUTOMATIC UP TO AUTOMATED TRAIN OPERATIONS,"ec.europa.eu/info/funding-tenders/opportunities/portal/screen/opportunities/topic-details/HORIZON-JU-ER-2025-FA2-01?isExactMatch=true&status=31094501,31094502,31094503&order=DESC&pageNumber=1&pageSize=100&sortBy=startDate",2026-02-11
SUPPORT TO THE EUROPEAN FRMCS DEPLOYMENT GROUP,"ec.europa.eu/info/funding-tenders/opportunities/portal/screen/opportunities/topic-details/HORIZON-JU-ER-2025-EXPLR-04?isExactMatch=true&status=31094501,31094502,31094503&order=DESC&pageNumber=1&pageSize=100&sortBy=startDate",2026-02-11
REGIONAL RAIL SERVICES / INNOVATIVE RAIL SERVICES TO REVITALISE CAPILLARY LINES,"ec.europa.eu/info/funding-tenders/opportunities/portal/screen/opportunities/topic-details/HORIZON-JU-ER-2025-FA6-01?isExactMatch=true&status=31094501,31094502,31094503&order=DESC&pageNumber=1&pageSize=100&sortBy=startDate",2026-02-11
STUDIES ON RAIL INDUSTRY 5.0,"ec.europa.eu/info/funding-tenders/opportunities/portal/screen/opportunities/topic-details/HORIZON-JU-ER-2025-EXPLR-01?isExactMatch=true&status=31094501,31094502,31094503&order=DESC&pageNumber=1&pageSize=100&sortBy=startDate",2026-02-11
INTELLIGENT & INTEGRATED ASSET MANAGEMENT,"ec.europa.eu/info/funding-tenders/opportunities/portal/screen/opportunities/topic-details/HORIZON-JU-ER-2025-FA3-01?isExactMatch=true&status=31094501,31094502,31094503&order=DESC&pageNumber=1&pageSize=100&sortBy=startDate",2026-02-11
Strategic Innovation Open call,"ec.europa.eu/info/funding-tenders/opportunities/portal/screen/opportunities/competitive-calls-cs/11164?isExactMatch=true&status=31094501,31094502,31094503&order=DESC&pageNumber=3&pageSize=100&sortBy=startDate",2026-02-12
Urban Mobility Explained (UMX) Open Call (Multi-cut-off),"ec.europa.eu/info/funding-tenders/opportunities/portal/screen/opportunities/competitive-calls-cs/11264?isExactMatch=true&status=31094501,31094502,31094503&order=DESC&pageNumber=3&pageSize=100&sortBy=startDate",2026-02-12
UPC-GREENCHIPS-EDU Scholarship,"ec.europa.eu/info/funding-tenders/opportunities/portal/screen/opportunities/competitive-calls-cs/11265?isExactMatch=true&status=31094501,31094502,31094503&order=DESC&pageNumber=3&pageSize=100&sortBy=startDate",2026-02-15
Innovative pathways for low carbon and climate resilient building stock and built environment (Built4People Partnership),"ec.europa.eu/info/funding-tenders/opportunities/portal/screen/opportunities/topic-details/HORIZON-CL5-2026-02-D4-03?isExactMatch=true&status=31094501,31094502,31094503&order=DESC&pageNumber=2&pageSize=100&sortBy=startDate",2026-02-17
Towards commercialisation of Perovskite PV and development of dedicated manufacturing equipment (EUPI-PV Partnership),"ec.europa.eu/info/funding-tenders/opportunities/portal/screen/opportunities/topic-details/HORIZON-CL5-2026-02-D3-10?isExactMatch=true&status=31094501,31094502,31094503&order=DESC&pageNumber=2&pageSize=100&sortBy=startDate",2026-02-17
New CO2 capture technologies,"ec.europa.eu/info/funding-tenders/opportunities/portal/screen/opportunities/topic-details/HORIZON-CL5-2026-02-D3-24?isExactMatch=true&status=31094501,31094502,31094503&order=DESC&pageNumber=2&pageSize=100&sortBy=startDate",2026-02-17
Underground Thermal Energy Storage in dense urban areas,"ec.europa.eu/info/funding-tenders/opportunities/portal/screen/opportunities/topic-details/HORIZON-CL5-2026-02-D3-22?isExactMatch=true&status=31094501,31094502,31094503&order=DESC&pageNumber=2&pageSize=100&sortBy=startDate",2026-02-17
Phase out fossil fuel in energy intensive industries through the efficient integration of renewable energy sources,"ec.europa.eu/info/funding-tenders/opportunities/portal/screen/opportunities/topic-details/HORIZON-CL5-2026-02-D4-06?isExactMatch=true&status=31094501,31094502,31094503&order=DESC&pageNumber=2&pageSize=100&sortBy=startDate",2026-02-17
Innovative approaches for the deployment of Positive Energy Districts,"ec.europa.eu/info/funding-tenders/opportunities/portal/screen/opportunities/topic-details/HORIZON-CL5-2026-02-D4-04?isExactMatch=true&status=31094501,31094502,31094503&order=DESC&pageNumber=2&pageSize=100&sortBy=startDate",2026-02-17
Innovative solutions for a generative AI-powered digital spine of the EU energy system,"ec.europa.eu/info/funding-tenders/opportunities/portal/screen/opportunities/topic-details/HORIZON-CL5-2026-02-D3-19?isExactMatch=true&status=31094501,31094502,31094503&order=DESC&pageNumber=2&pageSize=100&sortBy=startDate",2026-02-17
Improved reliability and optimised operations and maintenance for wind energy systems,"ec.europa.eu/info/funding-tenders/opportunities/portal/screen/opportunities/topic-details/HORIZON-CL5-2026-02-D3-07?isExactMatch=true&status=31094501,31094502,31094503&order=DESC&pageNumber=2&pageSize=100&sortBy=startDate",2026-02-17
Next generation distribution substation for increasing the system resilience,"ec.europa.eu/info/funding-tenders/opportunities/portal/screen/opportunities/topic-details/HORIZON-CL5-2026-02-D3-18?isExactMatch=true&status=31094501,31094502,31094503&order=DESC&pageNumber=2&pageSize=100&sortBy=startDate",2026-02-17
Development of innovative solutions strengthening the security of renewable energy value chains,"ec.europa.eu/info/funding-tenders/opportunities/portal/screen/opportunities/topic-details/HORIZON-CL5-2026-02-D3-14?isExactMatch=true&status=31094501,31094502,31094503&order=DESC&pageNumber=2&pageSize=100&sortBy=startDate",2026-02-17
Large-scale production of liquid advanced biofuels and renewable fuels of non-biological origin,"ec.europa.eu/info/funding-tenders/opportunities/portal/screen/opportunities/topic-details/HORIZON-CL5-2026-02-D3-01?isExactMatch=true&status=31094501,31094502,31094503&order=DESC&pageNumber=2&pageSize=100&sortBy=startDate",2026-02-17
"Optimal combination of low embodied carbon construction products, technical building systems and circularity principles for climate neutral buildings (Built4People Partnership)","ec.europa.eu/info/funding-tenders/opportunities/portal/screen/opportunities/topic-details/HORIZON-CL5-2026-02-D4-05?isExactMatch=true&status=31094501,31094502,31094503&order=DESC&pageNumber=2&pageSize=100&sortBy=startDate",2026-02-17
Innovative tools and services to manage and empower energy communities,"ec.europa.eu/info/funding-tenders/opportunities/portal/screen/opportunities/topic-details/HORIZON-CL5-2026-02-D3-20?isExactMatch=true&status=31094501,31094502,31094503&order=DESC&pageNumber=2&pageSize=100&sortBy=startDate",2026-02-17
On-site innovative robotic and automated solutions and techniques for more sustainable and less disruptive building renovation and construction,"ec.europa.eu/info/funding-tenders/opportunities/portal/screen/opportunities/topic-details/HORIZON-CL5-2026-02-D4-01?isExactMatch=true&status=31094501,31094502,31094503&order=DESC&pageNumber=2&pageSize=100&sortBy=startDate",2026-02-17
Demonstration of thermal energy storage solutions for solar thermal plants and systems,"ec.europa.eu/info/funding-tenders/opportunities/portal/screen/opportunities/topic-details/HORIZON-CL5-2026-02-D3-05?isExactMatch=true&status=31094501,31094502,31094503&order=DESC&pageNumber=2&pageSize=100&sortBy=startDate",2026-02-17
"Competitiveness, energy security and integration aspects of advanced biofuels and renewable fuels of non-biological origin value chains","ec.europa.eu/info/funding-tenders/opportunities/portal/screen/opportunities/topic-details/HORIZON-CL5-2026-02-D3-02?isExactMatch=true&status=31094501,31094502,31094503&order=DESC&pageNumber=2&pageSize=100&sortBy=startDate",2026-02-17
De-risking wave energy technology development through transnational pre-commercial procurement of wave energy research and development,"ec.europa.eu/info/funding-tenders/opportunities/portal/screen/opportunities/topic-details/HORIZON-CL5-2026-02-D3-13?isExactMatch=true&status=31094501,31094502,31094503&order=DESC&pageNumber=2&pageSize=100&sortBy=startDate",2026-02-17
Understand and minimise the environmental impacts of offshore wind energy,"ec.europa.eu/info/funding-tenders/opportunities/portal/screen/opportunities/topic-details/HORIZON-CL5-2026-02-D3-08?isExactMatch=true&status=31094501,31094502,31094503&order=DESC&pageNumber=2&pageSize=100&sortBy=startDate",2026-02-17
Smarter buildings as part of the energy system for increased efficiency and flexibility – Societal Readiness Pilot,"ec.europa.eu/info/funding-tenders/opportunities/portal/screen/opportunities/topic-details/HORIZON-CL5-2026-02-D4-02?isExactMatch=true&status=31094501,31094502,31094503&order=DESC&pageNumber=2&pageSize=100&sortBy=startDate",2026-02-17
Extending the lifetime of crystalline silicon PV modules (EUPI-PV Partnership),"ec.europa.eu/info/funding-tenders/opportunities/portal/screen/opportunities/topic-details/HORIZON-CL5-2026-02-D3-12?isExactMatch=true&status=31094501,31094502,31094503&order=DESC&pageNumber=2&pageSize=100&sortBy=startDate",2026-02-17
Open Topic: Innovative solutions for the sustainable and circular transformation of SMEs,"ec.europa.eu/info/funding-tenders/opportunities/portal/screen/opportunities/topic-details/HORIZON-CL6-2025-01-CIRCBIO-01-two-stage?isExactMatch=true&status=31094501,31094502,31094503&order=DESC&pageNumber=7&pageSize=100&sortBy=startDate",2026-02-18
Breeding for resilience: enhancing multi-stress tolerance in crops,"ec.europa.eu/info/funding-tenders/opportunities/portal/screen/opportunities/topic-details/HORIZON-CL6-2025-01-BIODIV-02-two-stage?isExactMatch=true&status=31094501,31094502,31094503&order=DESC&pageNumber=7&pageSize=100&sortBy=startDate",2026-02-18
Living labs co-creating innovative solutions for forests and freshwater ecosystems restoration,"ec.europa.eu/info/funding-tenders/opportunities/portal/screen/opportunities/topic-details/HORIZON-CL6-2025-01-BIODIV-01-two-stage?isExactMatch=true&status=31094501,31094502,31094503&order=DESC&pageNumber=7&pageSize=100&sortBy=startDate",2026-02-18
Broadening the living labs approach for soil health in Africa and Latin America and the Caribbean (LAC),"ec.europa.eu/info/funding-tenders/opportunities/portal/screen/opportunities/topic-details/HORIZON-MISS-2025-05-SOIL-02-two-stage?isExactMatch=true&status=31094501,31094502,31094503&order=DESC&pageNumber=7&pageSize=100&sortBy=startDate",2026-02-18
Substances of concern and emerging pollutants from bio-based industries and products: mapping and replacement,"ec.europa.eu/info/funding-tenders/opportunities/portal/screen/opportunities/topic-details/HORIZON-CL6-2025-01-ZEROPOLLUTION-01-two-stage?isExactMatch=true&status=31094501,31094502,31094503&order=DESC&pageNumber=7&pageSize=100&sortBy=startDate",2026-02-18
Strengthening the resilience of water systems and water sector to climate and global socio-economic change impacts,"ec.europa.eu/info/funding-tenders/opportunities/portal/screen/opportunities/topic-details/HORIZON-CL6-2025-02-CLIMATE-01-two-stage?isExactMatch=true&status=31094501,31094502,31094503&order=DESC&pageNumber=7&pageSize=100&sortBy=startDate",2026-02-18
Emerging and future risks to plant health,"ec.europa.eu/info/funding-tenders/opportunities/portal/screen/opportunities/topic-details/HORIZON-CL6-2025-02-FARM2FORK-01-two-stage?isExactMatch=true&status=31094501,31094502,31094503&order=DESC&pageNumber=7&pageSize=100&sortBy=startDate",2026-02-18
Making food systems more resilient to food safety risks through the deployment of technological solutions,"ec.europa.eu/info/funding-tenders/opportunities/portal/screen/opportunities/topic-details/HORIZON-CL6-2025-02-FARM2FORK-03-two-stage?isExactMatch=true&status=31094501,31094502,31094503&order=DESC&pageNumber=7&pageSize=100&sortBy=startDate",2026-02-18
Developing agroecology living labs and lighthouses for climate action under the Food and Nutrition Security and Sustainable Agriculture (FNSSA) partnership,"ec.europa.eu/info/funding-tenders/opportunities/portal/screen/opportunities/topic-details/HORIZON-CL6-2025-02-FARM2FORK-05-two-stage?isExactMatch=true&status=31094501,31094502,31094503&order=DESC&pageNumber=7&pageSize=100&sortBy=startDate",2026-02-18
"Research and innovation for food waste prevention and reduction at household level through measurement, monitoring and new technologies","ec.europa.eu/info/funding-tenders/opportunities/portal/screen/opportunities/topic-details/HORIZON-CL6-2025-02-FARM2FORK-04-two-stage?isExactMatch=true&status=31094501,31094502,31094503&order=DESC&pageNumber=7&pageSize=100&sortBy=startDate",2026-02-18
