title,link,date
PSLF-PROJECTS,"ec.europa.eu/info/funding-tenders/opportunities/portal/screen/opportunities/topic-details/JTM-2022-2025-PSLF-STANDALONE-PROJECTS?isExactMatch=true&status=31094501,31094502,31094503&order=DESC&pageNumber=39&pageSize=100&sortBy=startDate",2025-09-11
PSLF-LOAN SCHEMES,"ec.europa.eu/info/funding-tenders/opportunities/portal/screen/opportunities/topic-details/JTM-2022-2025-PSLF-LOAN-SCHEMES?isExactMatch=true&status=31094501,31094502,31094503&order=DESC&pageNumber=39&pageSize=100&sortBy=startDate",2025-09-11
Europe-Africa Research and Innovation call on Sustainable Energy 2025,"ec.europa.eu/info/funding-tenders/opportunities/portal/screen/opportunities/competitive-calls-cs/9827?isExactMatch=true&status=31094501,31094502,31094503&order=DESC&pageNumber=11&pageSize=100&sortBy=startDate",2025-09-11
AID4SME Open Call 1,"ec.europa.eu/info/funding-tenders/opportunities/portal/screen/opportunities/competitive-calls-cs/11222?isExactMatch=true&status=31094501,31094502,31094503&order=DESC&pageNumber=2&pageSize=100&sortBy=startDate",2025-09-11
Support to the Youth Advisory Board,"ec.europa.eu/info/funding-tenders/opportunities/portal/screen/opportunities/prospect-details/183809PROSPECTSEN?isExactMatch=true&status=31094501,31094502,31094503&order=DESC&pageNumber=3&pageSize=100&sortBy=startDate",2025-09-12
Bridges,"ec.europa.eu/info/funding-tenders/opportunities/portal/screen/opportunities/competitive-calls-cs/11168?isExactMatch=true&status=31094501,31094502,31094503&order=DESC&pageNumber=2&pageSize=100&sortBy=startDate",2025-09-12
#2 OPEN CALL | LAUDS REPLICATION (OC-2024-LAUDSREP-01),"ec.europa.eu/info/funding-tenders/opportunities/portal/screen/opportunities/competitive-calls-cs/11078?isExactMatch=true&status=31094501,31094502,31094503&order=DESC&pageNumber=3&pageSize=100&sortBy=startDate",2025-09-15
Inkjet-bioAM Open Call,"ec.europa.eu/info/funding-tenders/opportunities/portal/screen/opportunities/competitive-calls-cs/11004?isExactMatch=true&status=31094501,31094502,31094503&order=DESC&pageNumber=2&pageSize=100&sortBy=startDate",2025-09-15
MANTRA First Open Call for Manufacturing SMEs,"ec.europa.eu/info/funding-tenders/opportunities/portal/screen/opportunities/competitive-calls-cs/11341?isExactMatch=true&status=31094501,31094502,31094503&order=DESC&pageNumber=2&pageSize=100&sortBy=startDate",2025-09-15
Cultural Strategies for Peace: culture and creativity as catalysts for conflict prevention and post-conflict reconciliation,"ec.europa.eu/info/funding-tenders/opportunities/portal/screen/opportunities/topic-details/HORIZON-CL2-2025-01-HERITAGE-07?isExactMatch=true&status=31094501,31094502,31094503&order=DESC&pageNumber=5&pageSize=100&sortBy=startDate",2025-09-16
"The autocratic appeal: nature, drivers and strategies","ec.europa.eu/info/funding-tenders/opportunities/portal/screen/opportunities/topic-details/HORIZON-CL2-2025-01-DEMOCRACY-07?isExactMatch=true&status=31094501,31094502,31094503&order=DESC&pageNumber=5&pageSize=100&sortBy=startDate",2025-09-16
Calling2Scale Gunma - Gateway to Japan,"ec.europa.eu/info/funding-tenders/opportunities/portal/screen/opportunities/competitive-calls-cs/11362?isExactMatch=true&status=31094501,31094502,31094503&order=DESC&pageNumber=2&pageSize=100&sortBy=startDate",2025-09-16
Impacts of culture and the arts on health and well-being,"ec.europa.eu/info/funding-tenders/opportunities/portal/screen/opportunities/topic-details/HORIZON-CL2-2025-01-HERITAGE-09?isExactMatch=true&status=31094501,31094502,31094503&order=DESC&pageNumber=5&pageSize=100&sortBy=startDate",2025-09-16
"Open strategic autonomy, economic and research security in EU foreign policy","ec.europa.eu/info/funding-tenders/opportunities/portal/screen/opportunities/topic-details/HORIZON-CL2-2025-01-DEMOCRACY-04?isExactMatch=true&status=31094501,31094502,31094503&order=DESC&pageNumber=5&pageSize=100&sortBy=startDate",2025-09-16
Intergenerational fairness in the context of demographic change in the EU,"ec.europa.eu/info/funding-tenders/opportunities/portal/screen/opportunities/topic-details/HORIZON-CL2-2025-01-TRANSFO-10?isExactMatch=true&status=31094501,31094502,31094503&order=DESC&pageNumber=5&pageSize=100&sortBy=startDate",2025-09-16
Preparing the EU for future enlargement: challenges and opportunities,"ec.europa.eu/info/funding-tenders/opportunities/portal/screen/opportunities/topic-details/HORIZON-CL2-2025-01-DEMOCRACY-03?isExactMatch=true&status=31094501,31094502,31094503&order=DESC&pageNumber=5&pageSize=100&sortBy=startDate",2025-09-16
Leveraging artificial intelligence for creativity-driven innovation,"ec.europa.eu/info/funding-tenders/opportunities/portal/screen/opportunities/topic-details/HORIZON-CL2-2025-01-HERITAGE-04?isExactMatch=true&status=31094501,31094502,31094503&order=DESC&pageNumber=5&pageSize=100&sortBy=startDate",2025-09-16
Historical and regional analyses of industrial transitions and their lessons for ensuring a fair green transition,"ec.europa.eu/info/funding-tenders/opportunities/portal/screen/opportunities/topic-details/HORIZON-CL2-2025-01-TRANSFO-02?isExactMatch=true&status=31094501,31094502,31094503&order=DESC&pageNumber=5&pageSize=100&sortBy=startDate",2025-09-16
Independence of the judiciary as an aspect of rule of law compliance,"ec.europa.eu/info/funding-tenders/opportunities/portal/screen/opportunities/topic-details/HORIZON-CL2-2025-01-DEMOCRACY-11?isExactMatch=true&status=31094501,31094502,31094503&order=DESC&pageNumber=5&pageSize=100&sortBy=startDate",2025-09-16
"Countering and preventing radicalisation, extremism, hate speech and polarisation","ec.europa.eu/info/funding-tenders/opportunities/portal/screen/opportunities/topic-details/HORIZON-CL2-2025-01-DEMOCRACY-05?isExactMatch=true&status=31094501,31094502,31094503&order=DESC&pageNumber=5&pageSize=100&sortBy=startDate",2025-09-16
Impact of the learning environment and the use of digital tools in everyday life on key skills and competence development,"ec.europa.eu/info/funding-tenders/opportunities/portal/screen/opportunities/topic-details/HORIZON-CL2-2025-01-TRANSFO-07?isExactMatch=true&status=31094501,31094502,31094503&order=DESC&pageNumber=5&pageSize=100&sortBy=startDate",2025-09-16
Tackling gender-based violence in different social and economic spheres,"ec.europa.eu/info/funding-tenders/opportunities/portal/screen/opportunities/topic-details/HORIZON-CL2-2025-01-TRANSFO-01?isExactMatch=true&status=31094501,31094502,31094503&order=DESC&pageNumber=5&pageSize=100&sortBy=startDate",2025-09-16
Towards a European research hub on contemporary antisemitism and Jewish life and culture,"ec.europa.eu/info/funding-tenders/opportunities/portal/screen/opportunities/topic-details/HORIZON-CL2-2025-01-DEMOCRACY-06?isExactMatch=true&status=31094501,31094502,31094503&order=DESC&pageNumber=5&pageSize=100&sortBy=startDate",2025-09-16
Innovative surgery as the cornerstone of affordable multi-modal therapeutic interventions benefitting cancer patients with locally advanced or metastatic disease,"ec.europa.eu/info/funding-tenders/opportunities/portal/screen/opportunities/topic-details/HORIZON-MISS-2025-02-CANCER-03?isExactMatch=true&status=31094501,31094502,31094503&order=DESC&pageNumber=5&pageSize=100&sortBy=startDate",2025-09-16
Improving fairness in the economy through a better understanding of undeclared and underdeclared work,"ec.europa.eu/info/funding-tenders/opportunities/portal/screen/opportunities/topic-details/HORIZON-CL2-2025-01-TRANSFO-05?isExactMatch=true&status=31094501,31094502,31094503&order=DESC&pageNumber=5&pageSize=100&sortBy=startDate",2025-09-16
The ocean-climate-biodiversity nexus and marine carbon dioxide removal (mCDR),"ec.europa.eu/info/funding-tenders/opportunities/portal/screen/opportunities/topic-details/HORIZON-CL6-2025-02-CLIMATE-01?isExactMatch=true&status=31094501,31094502,31094503&order=DESC&pageNumber=7&pageSize=100&sortBy=startDate",2025-09-16
Nutrition and Mental Health,"ec.europa.eu/info/funding-tenders/opportunities/portal/screen/opportunities/topic-details/HORIZON-CL6-2025-02-FARM2FORK-12?isExactMatch=true&status=31094501,31094502,31094503&order=DESC&pageNumber=7&pageSize=100&sortBy=startDate",2025-09-16
"Additional activities of the European partnership on sustainable food systems for people, planet and climate","ec.europa.eu/info/funding-tenders/opportunities/portal/screen/opportunities/topic-details/HORIZON-CL6-2025-02-FARM2FORK-15?isExactMatch=true&status=31094501,31094502,31094503&order=DESC&pageNumber=7&pageSize=100&sortBy=startDate",2025-09-16
"Fostering animal breeding and genetics for climate change adaptation and mitigation, improved robustness and resilience","ec.europa.eu/info/funding-tenders/opportunities/portal/screen/opportunities/topic-details/HORIZON-CL6-2025-02-FARM2FORK-07?isExactMatch=true&status=31094501,31094502,31094503&order=DESC&pageNumber=7&pageSize=100&sortBy=startDate",2025-09-16
Creating urban co-creation spaces for driving sustainable food system transformation,"ec.europa.eu/info/funding-tenders/opportunities/portal/screen/opportunities/topic-details/HORIZON-CL6-2025-02-COMMUNITIES-04?isExactMatch=true&status=31094501,31094502,31094503&order=DESC&pageNumber=7&pageSize=100&sortBy=startDate",2025-09-16
Developing innovative phytosanitary measures for plant health - focus on systems approach for pest risk management,"ec.europa.eu/info/funding-tenders/opportunities/portal/screen/opportunities/topic-details/HORIZON-CL6-2025-02-FARM2FORK-05?isExactMatch=true&status=31094501,31094502,31094503&order=DESC&pageNumber=7&pageSize=100&sortBy=startDate",2025-09-16
Community of democracy practitioners and researchers,"ec.europa.eu/info/funding-tenders/opportunities/portal/screen/opportunities/topic-details/HORIZON-CL2-2025-01-DEMOCRACY-12?isExactMatch=true&status=31094501,31094502,31094503&order=DESC&pageNumber=5&pageSize=100&sortBy=startDate",2025-09-16
Exploring the potential of controlled environment agriculture (CEA),"ec.europa.eu/info/funding-tenders/opportunities/portal/screen/opportunities/topic-details/HORIZON-CL6-2025-02-FARM2FORK-08?isExactMatch=true&status=31094501,31094502,31094503&order=DESC&pageNumber=7&pageSize=100&sortBy=startDate",2025-09-16
Investigator-initiated multinational early-stage innovative clinical trials for paediatric cancer,"ec.europa.eu/info/funding-tenders/opportunities/portal/screen/opportunities/topic-details/HORIZON-MISS-2025-02-CANCER-04?isExactMatch=true&status=31094501,31094502,31094503&order=DESC&pageNumber=6&pageSize=100&sortBy=startDate",2025-09-16
Sustained collaboration of national and regional cancer funders to support the Cancer Mission through translational research,"ec.europa.eu/info/funding-tenders/opportunities/portal/screen/opportunities/topic-details/HORIZON-MISS-2025-02-CANCER-01?isExactMatch=true&status=31094501,31094502,31094503&order=DESC&pageNumber=6&pageSize=100&sortBy=startDate",2025-09-16
Support to the network of National Cancer Mission Hubs (NCMHs),"ec.europa.eu/info/funding-tenders/opportunities/portal/screen/opportunities/topic-details/HORIZON-MISS-2025-02-CANCER-06?isExactMatch=true&status=31094501,31094502,31094503&order=DESC&pageNumber=5&pageSize=100&sortBy=startDate",2025-09-16
"Understanding the effects of environmental exposure on the risk of paediatric, adolescent and young adult cancers","ec.europa.eu/info/funding-tenders/opportunities/portal/screen/opportunities/topic-details/HORIZON-MISS-2025-02-CANCER-02?isExactMatch=true&status=31094501,31094502,31094503&order=DESC&pageNumber=5&pageSize=100&sortBy=startDate",2025-09-16
Pragmatic clinical trials to enhance the quality of life of older cancer patients (65 years and older) through nutrition,"ec.europa.eu/info/funding-tenders/opportunities/portal/screen/opportunities/topic-details/HORIZON-MISS-2025-02-CANCER-05?isExactMatch=true&status=31094501,31094502,31094503&order=DESC&pageNumber=5&pageSize=100&sortBy=startDate",2025-09-16
Migration and climate change: building resilience and enhancing sustainability,"ec.europa.eu/info/funding-tenders/opportunities/portal/screen/opportunities/topic-details/HORIZON-CL2-2025-01-TRANSFO-11?isExactMatch=true&status=31094501,31094502,31094503&order=DESC&pageNumber=5&pageSize=100&sortBy=startDate",2025-09-16
Support for R&I policy making in the EU enlargement countries,"ec.europa.eu/info/funding-tenders/opportunities/portal/screen/opportunities/topic-details/HORIZON-WIDERA-2025-04-ACCESS-01?isExactMatch=true&status=31094501,31094502,31094503&order=DESC&pageNumber=6&pageSize=100&sortBy=startDate",2025-09-16
"Working time reduction: barriers, challenges, benefits and policy implications","ec.europa.eu/info/funding-tenders/opportunities/portal/screen/opportunities/topic-details/HORIZON-CL2-2025-01-TRANSFO-03?isExactMatch=true&status=31094501,31094502,31094503&order=DESC&pageNumber=5&pageSize=100&sortBy=startDate",2025-09-16
Evaluation and use of evidence in education policy and practice,"ec.europa.eu/info/funding-tenders/opportunities/portal/screen/opportunities/topic-details/HORIZON-CL2-2025-01-TRANSFO-06?isExactMatch=true&status=31094501,31094502,31094503&order=DESC&pageNumber=5&pageSize=100&sortBy=startDate",2025-09-16
Advisory support and network to counter disinformation and foreign information manipulation and interference (FIMI),"ec.europa.eu/info/funding-tenders/opportunities/portal/screen/opportunities/topic-details/HORIZON-CL2-2025-01-DEMOCRACY-01?isExactMatch=true&status=31094501,31094502,31094503&order=DESC&pageNumber=5&pageSize=100&sortBy=startDate",2025-09-16
The impact of pollution on the development and progression of brain diseases and disorders,"ec.europa.eu/info/funding-tenders/opportunities/portal/screen/opportunities/topic-details/HORIZON-HLTH-2025-03-ENVHLTH-01-two-stage?isExactMatch=true&status=31094501,31094502,31094503&order=DESC&pageNumber=4&pageSize=100&sortBy=startDate",2025-09-16
Development of antibodies and antibody-derived proteins for the prevention and treatment of infectious diseases with epidemic potential,"ec.europa.eu/info/funding-tenders/opportunities/portal/screen/opportunities/topic-details/HORIZON-HLTH-2025-01-DISEASE-03?isExactMatch=true&status=31094501,31094502,31094503&order=DESC&pageNumber=4&pageSize=100&sortBy=startDate",2025-09-16
Improving the quality of life of persons with intellectual disabilities and their families,"ec.europa.eu/info/funding-tenders/opportunities/portal/screen/opportunities/topic-details/HORIZON-HLTH-2025-03-STAYHLTH-01-two-stage?isExactMatch=true&status=31094501,31094502,31094503&order=DESC&pageNumber=4&pageSize=100&sortBy=startDate",2025-09-16
Digitalisation of conformity assessment procedures of medical devices and in vitro diagnostic medical devices,"ec.europa.eu/info/funding-tenders/opportunities/portal/screen/opportunities/topic-details/HORIZON-HLTH-2025-01-IND-02?isExactMatch=true&status=31094501,31094502,31094503&order=DESC&pageNumber=4&pageSize=100&sortBy=startDate",2025-09-16
Advancing knowledge on the impacts of micro- and nanoplastics on human health,"ec.europa.eu/info/funding-tenders/opportunities/portal/screen/opportunities/topic-details/HORIZON-HLTH-2025-03-ENVHLTH-02-two-stage?isExactMatch=true&status=31094501,31094502,31094503&order=DESC&pageNumber=4&pageSize=100&sortBy=startDate",2025-09-16
Leveraging artificial intelligence for pandemic preparedness and response,"ec.europa.eu/info/funding-tenders/opportunities/portal/screen/opportunities/topic-details/HORIZON-HLTH-2025-01-DISEASE-04?isExactMatch=true&status=31094501,31094502,31094503&order=DESC&pageNumber=4&pageSize=100&sortBy=startDate",2025-09-16
Enhancing cell therapies with genomic techniques,"ec.europa.eu/info/funding-tenders/opportunities/portal/screen/opportunities/topic-details/HORIZON-HLTH-2025-01-TOOL-01?isExactMatch=true&status=31094501,31094502,31094503&order=DESC&pageNumber=4&pageSize=100&sortBy=startDate",2025-09-16
Tackling high-burden for patients and under-researched medical conditions,"ec.europa.eu/info/funding-tenders/opportunities/portal/screen/opportunities/topic-details/HORIZON-HLTH-2025-01-DISEASE-07?isExactMatch=true&status=31094501,31094502,31094503&order=DESC&pageNumber=4&pageSize=100&sortBy=startDate",2025-09-16
Advancing cell secretome-based therapies,"ec.europa.eu/info/funding-tenders/opportunities/portal/screen/opportunities/topic-details/HORIZON-HLTH-2025-01-TOOL-02?isExactMatch=true&status=31094501,31094502,31094503&order=DESC&pageNumber=4&pageSize=100&sortBy=startDate",2025-09-16
Optimising the manufacturing of Advanced Therapy Medicinal Products (ATMPs),"ec.europa.eu/info/funding-tenders/opportunities/portal/screen/opportunities/topic-details/HORIZON-HLTH-2025-01-IND-01?isExactMatch=true&status=31094501,31094502,31094503&order=DESC&pageNumber=4&pageSize=100&sortBy=startDate",2025-09-16
End user-driven application of Generative Artificial Intelligence models in healthcare (GenAI4EU),"ec.europa.eu/info/funding-tenders/opportunities/portal/screen/opportunities/topic-details/HORIZON-HLTH-2025-01-CARE-01?isExactMatch=true&status=31094501,31094502,31094503&order=DESC&pageNumber=4&pageSize=100&sortBy=startDate",2025-09-16
Support for the functioning of the Global Research Collaboration for Infectious Disease Preparedness (GloPID-R),"ec.europa.eu/info/funding-tenders/opportunities/portal/screen/opportunities/topic-details/HORIZON-HLTH-2025-01-DISEASE-05?isExactMatch=true&status=31094501,31094502,31094503&order=DESC&pageNumber=4&pageSize=100&sortBy=startDate",2025-09-16
Implementation research addressing strategies to strengthen health systems for equitable high-quality care and health outcomes in the context of non-communicable diseases (GACD),"ec.europa.eu/info/funding-tenders/opportunities/portal/screen/opportunities/topic-details/HORIZON-HLTH-2025-01-DISEASE-06?isExactMatch=true&status=31094501,31094502,31094503&order=DESC&pageNumber=4&pageSize=100&sortBy=startDate",2025-09-16
Facilitating the conduct of multinational clinical studies of orphan devices and/or of highly innovative (“breakthrough”) devices,"ec.europa.eu/info/funding-tenders/opportunities/portal/screen/opportunities/topic-details/HORIZON-HLTH-2025-03-IND-03-two-stage?isExactMatch=true&status=31094501,31094502,31094503&order=DESC&pageNumber=4&pageSize=100&sortBy=startDate",2025-09-16
Testing safety and efficacy of phage therapy for the treatment of antibiotic-resistant bacterial infections,"ec.europa.eu/info/funding-tenders/opportunities/portal/screen/opportunities/topic-details/HORIZON-HLTH-2025-01-DISEASE-01?isExactMatch=true&status=31094501,31094502,31094503&order=DESC&pageNumber=4&pageSize=100&sortBy=startDate",2025-09-16
"Advancing innovative interventions for mental, behavioural and neurodevelopmental disorders","ec.europa.eu/info/funding-tenders/opportunities/portal/screen/opportunities/topic-details/HORIZON-HLTH-2025-03-DISEASE-02-two-stage?isExactMatch=true&status=31094501,31094502,31094503&order=DESC&pageNumber=4&pageSize=100&sortBy=startDate",2025-09-16
Leveraging multimodal data to advance Generative Artificial Intelligence applicability in biomedical research (GenAI4EU),"ec.europa.eu/info/funding-tenders/opportunities/portal/screen/opportunities/topic-details/HORIZON-HLTH-2025-01-TOOL-03?isExactMatch=true&status=31094501,31094502,31094503&order=DESC&pageNumber=4&pageSize=100&sortBy=startDate",2025-09-16
Europe as a global powerhouse of design for sustainable competitiveness,"ec.europa.eu/info/funding-tenders/opportunities/portal/screen/opportunities/topic-details/HORIZON-CL2-2025-01-HERITAGE-06?isExactMatch=true&status=31094501,31094502,31094503&order=DESC&pageNumber=5&pageSize=100&sortBy=startDate",2025-09-16
"Bridging historical past and future potential through conservation, preservation, and adaptive use of Europe’s contentious and dissonant heritage","ec.europa.eu/info/funding-tenders/opportunities/portal/screen/opportunities/topic-details/HORIZON-CL2-2025-01-HERITAGE-08?isExactMatch=true&status=31094501,31094502,31094503&order=DESC&pageNumber=5&pageSize=100&sortBy=startDate",2025-09-16
Improving grassland management in European livestock farming systems,"ec.europa.eu/info/funding-tenders/opportunities/portal/screen/opportunities/topic-details/HORIZON-CL6-2025-02-FARM2FORK-06?isExactMatch=true&status=31094501,31094502,31094503&order=DESC&pageNumber=7&pageSize=100&sortBy=startDate",2025-09-16
Evolution of culture in a virtualising world,"ec.europa.eu/info/funding-tenders/opportunities/portal/screen/opportunities/topic-details/HORIZON-CL2-2025-01-HERITAGE-05?isExactMatch=true&status=31094501,31094502,31094503&order=DESC&pageNumber=5&pageSize=100&sortBy=startDate",2025-09-16
"Improving mental health outcomes for people in education, training and work","ec.europa.eu/info/funding-tenders/opportunities/portal/screen/opportunities/topic-details/HORIZON-CL2-2025-01-TRANSFO-08?isExactMatch=true&status=31094501,31094502,31094503&order=DESC&pageNumber=5&pageSize=100&sortBy=startDate",2025-09-16
The role of civic and citizenship education for strengthening civic and democratic participation and support for common European values,"ec.europa.eu/info/funding-tenders/opportunities/portal/screen/opportunities/topic-details/HORIZON-CL2-2025-01-DEMOCRACY-10?isExactMatch=true&status=31094501,31094502,31094503&order=DESC&pageNumber=5&pageSize=100&sortBy=startDate",2025-09-16
"Good practices for increased autonomy of persons with disabilities, including physical, mental, intellectual and sensory disabilities","ec.europa.eu/info/funding-tenders/opportunities/portal/screen/opportunities/topic-details/HORIZON-CL2-2025-01-TRANSFO-09?isExactMatch=true&status=31094501,31094502,31094503&order=DESC&pageNumber=5&pageSize=100&sortBy=startDate",2025-09-16
Economic inequalities and their impact on democracy,"ec.europa.eu/info/funding-tenders/opportunities/portal/screen/opportunities/topic-details/HORIZON-CL2-2025-01-DEMOCRACY-08?isExactMatch=true&status=31094501,31094502,31094503&order=DESC&pageNumber=5&pageSize=100&sortBy=startDate",2025-09-16
A European Collaborative Cloud for Cultural Heritage – Innovative use cases,"ec.europa.eu/info/funding-tenders/opportunities/portal/screen/opportunities/topic-details/HORIZON-CL2-2025-01-HERITAGE-03?isExactMatch=true&status=31094501,31094502,31094503&order=DESC&pageNumber=5&pageSize=100&sortBy=startDate",2025-09-16
Fostering the consolidation of European science diplomacy,"ec.europa.eu/info/funding-tenders/opportunities/portal/screen/opportunities/topic-details/HORIZON-CL2-2025-01-DEMOCRACY-02?isExactMatch=true&status=31094501,31094502,31094503&order=DESC&pageNumber=5&pageSize=100&sortBy=startDate",2025-09-16
Gender differences in career trajectories of parents and their implications for gender equality and family well-being,"ec.europa.eu/info/funding-tenders/opportunities/portal/screen/opportunities/topic-details/HORIZON-CL2-2025-02-TRANSFO-04-two-stage?isExactMatch=true&status=31094501,31094502,31094503&order=DESC&pageNumber=5&pageSize=100&sortBy=startDate",2025-09-16
MSCA4Ukraine Fellowships 2025,"ec.europa.eu/info/funding-tenders/opportunities/portal/screen/opportunities/topic-details/HORIZON-MSCA-2025-MSCA4UA-01-01?isExactMatch=true&status=31094501,31094502,31094503&order=DESC&pageNumber=5&pageSize=100&sortBy=startDate",2025-09-16
Innovative approaches to intangible cultural heritage for societal resilience,"ec.europa.eu/info/funding-tenders/opportunities/portal/screen/opportunities/topic-details/HORIZON-CL2-2025-02-HERITAGE-02-two-stage?isExactMatch=true&status=31094501,31094502,31094503&order=DESC&pageNumber=5&pageSize=100&sortBy=startDate",2025-09-16
Boosting the translation of biotech research into innovative health therapies,"ec.europa.eu/info/funding-tenders/opportunities/portal/screen/opportunities/topic-details/HORIZON-HLTH-2025-01-TOOL-05?isExactMatch=true&status=31094501,31094502,31094503&order=DESC&pageNumber=4&pageSize=100&sortBy=startDate",2025-09-16
Fighting against disinformation while ensuring the right to freedom of expression,"ec.europa.eu/info/funding-tenders/opportunities/portal/screen/opportunities/topic-details/HORIZON-CL2-2025-01-DEMOCRACY-09?isExactMatch=true&status=31094501,31094502,31094503&order=DESC&pageNumber=5&pageSize=100&sortBy=startDate",2025-09-16
Exploring and improving access to housing in rural areas and developing the houses and villages of the future,"ec.europa.eu/info/funding-tenders/opportunities/portal/screen/opportunities/topic-details/HORIZON-CL6-2025-02-COMMUNITIES-02?isExactMatch=true&status=31094501,31094502,31094503&order=DESC&pageNumber=7&pageSize=100&sortBy=startDate",2025-09-16
Scoping Workshops,www.volkswagenstiftung.de/en/funding/funding-offer/scoping-workshops,2025-09-16
Innovative solutions for resilient and climate-adapted coastal communities in the Atlantic,"ec.europa.eu/info/funding-tenders/opportunities/portal/screen/opportunities/topic-details/HORIZON-CL6-2025-02-COMMUNITIES-03?isExactMatch=true&status=31094501,31094502,31094503&order=DESC&pageNumber=7&pageSize=100&sortBy=startDate",2025-09-16
Fast-track Extending U-space eco-system,"ec.europa.eu/info/funding-tenders/opportunities/portal/screen/opportunities/topic-details/HORIZON-SESAR-2025-DES-IR-02-WA6-2?isExactMatch=true&status=31094501,31094502,31094503&order=DESC&pageNumber=9&pageSize=100&sortBy=startDate",2025-09-16
Increased automation assistance for the pilot for ATM tasks,"ec.europa.eu/info/funding-tenders/opportunities/portal/screen/opportunities/topic-details/HORIZON-SESAR-2025-DES-IR-02-WA5-1?isExactMatch=true&status=31094501,31094502,31094503&order=DESC&pageNumber=9&pageSize=100&sortBy=startDate",2025-09-16
Highly automated ATM for all airspace users,"ec.europa.eu/info/funding-tenders/opportunities/portal/screen/opportunities/topic-details/HORIZON-SESAR-2025-DES-IR-02-WA5-2?isExactMatch=true&status=31094501,31094502,31094503&order=DESC&pageNumber=9&pageSize=100&sortBy=startDate",2025-09-16
