title,link,date
Networking Support Call (NSC2025) - Translational aspects of Personalised Medicine,"ec.europa.eu/info/funding-tenders/opportunities/portal/screen/opportunities/competitive-calls-cs/10801?isExactMatch=true&status=31094501,31094502,31094503&order=DESC&pageNumber=5&pageSize=100&sortBy=startDate",2025-09-29
RTU MERIT Project Mobility Scholarship,"ec.europa.eu/info/funding-tenders/opportunities/portal/screen/opportunities/competitive-calls-cs/11387?isExactMatch=true&status=31094501,31094502,31094503&order=DESC&pageNumber=2&pageSize=100&sortBy=startDate",2025-09-29
AI Research Groups Lower Saxony,https://zukunft.niedersachsen.de/foerderangebot/ki-forschungsgruppen-niedersachsen/,2025-09-30
Urban Mobility Explained (UMX) Open Call (Multi-cut-off),"ec.europa.eu/info/funding-tenders/opportunities/portal/screen/opportunities/competitive-calls-cs/11264?isExactMatch=true&status=31094501,31094502,31094503&order=DESC&pageNumber=2&pageSize=100&sortBy=startDate",2025-09-30
Developing transfer functions for the Soil Monitoring Law,"ec.europa.eu/info/funding-tenders/opportunities/portal/screen/opportunities/topic-details/HORIZON-MISS-2025-05-SOIL-04?isExactMatch=true&status=31094501,31094502,31094503&order=DESC&pageNumber=6&pageSize=100&sortBy=startDate",2025-09-30
FS4Africa Open Call 1 (OC1) addressed to research and technology stakeholders,"ec.europa.eu/info/funding-tenders/opportunities/portal/screen/opportunities/competitive-calls-cs/10926?isExactMatch=true&status=31094501,31094502,31094503&order=DESC&pageNumber=4&pageSize=100&sortBy=startDate",2025-09-30
SOILSCAPE Open Call ,"ec.europa.eu/info/funding-tenders/opportunities/portal/screen/opportunities/competitive-calls-cs/11065?isExactMatch=true&status=31094501,31094502,31094503&order=DESC&pageNumber=4&pageSize=100&sortBy=startDate",2025-09-30
"Soil Salinity in Europe: Drivers, indicators, current levels and temporal changes","ec.europa.eu/info/funding-tenders/opportunities/portal/screen/opportunities/topic-details/HORIZON-MISS-2025-05-SOIL-11?isExactMatch=true&status=31094501,31094502,31094503&order=DESC&pageNumber=6&pageSize=100&sortBy=startDate",2025-09-30
EU global footprint on soils,"ec.europa.eu/info/funding-tenders/opportunities/portal/screen/opportunities/topic-details/HORIZON-MISS-2025-05-SOIL-05?isExactMatch=true&status=31094501,31094502,31094503&order=DESC&pageNumber=6&pageSize=100&sortBy=startDate",2025-09-30
AI Research Groups Lower Saxony,https://zukunft.niedersachsen.de/foerderangebot/ki-forschungsgruppen-niedersachsen/,2025-09-30
AI Research Groups Lower Saxony,https://zukunft.niedersachsen.de/foerderangebot/ki-forschungsgruppen-niedersachsen/,2025-09-30
Call for Master’s & PhD Modules 2025,"ec.europa.eu/info/funding-tenders/opportunities/portal/screen/opportunities/competitive-calls-cs/11273?isExactMatch=true&status=31094501,31094502,31094503&order=DESC&pageNumber=2&pageSize=100&sortBy=startDate",2025-09-30
Appui pour cadre normatif régissant l’agriculture biologique et la labellisation,"ec.europa.eu/info/funding-tenders/opportunities/portal/screen/opportunities/prospect-details/184670PROSPECTSEN?isExactMatch=true&status=31094501,31094502,31094503&order=DESC&pageNumber=2&pageSize=100&sortBy=startDate",2025-09-30
"Social, economic and cultural drivers, and costs of land degradation","ec.europa.eu/info/funding-tenders/opportunities/portal/screen/opportunities/topic-details/HORIZON-MISS-2025-05-SOIL-02?isExactMatch=true&status=31094501,31094502,31094503&order=DESC&pageNumber=6&pageSize=100&sortBy=startDate",2025-09-30
AI Research Groups Lower Saxony,https://zukunft.niedersachsen.de/foerderangebot/ki-forschungsgruppen-niedersachsen/,2025-09-30
AI Research Groups Lower Saxony,https://zukunft.niedersachsen.de/foerderangebot/ki-forschungsgruppen-niedersachsen/,2025-09-30
"CEDAR CIVIL SOCIETY-CAPACITY ENHANCEMENT, DIALOGUE AND RECOVERY CALL FOR PROPOSALS","ec.europa.eu/info/funding-tenders/opportunities/portal/screen/opportunities/prospect-details/184434PROSPECTSEN?isExactMatch=true&status=31094501,31094502,31094503&order=DESC&pageNumber=2&pageSize=100&sortBy=startDate",2025-09-30
Pre-commercial procurement of breakthrough solutions for climate proofing of public buildings,"ec.europa.eu/info/funding-tenders/opportunities/portal/screen/opportunities/topic-details/HORIZON-MISS-2025-01-CLIMA-06?isExactMatch=true&status=31094501,31094502,31094503&order=DESC&pageNumber=8&pageSize=100&sortBy=startDate",2025-09-30
Better understanding incentives for private sector financing of adaptation solutions,"ec.europa.eu/info/funding-tenders/opportunities/portal/screen/opportunities/topic-details/HORIZON-MISS-2025-01-CLIMA-05?isExactMatch=true&status=31094501,31094502,31094503&order=DESC&pageNumber=8&pageSize=100&sortBy=startDate",2025-09-30
Demonstrating solutions to help hotspots in coastal regions to adapt to climate change,"ec.europa.eu/info/funding-tenders/opportunities/portal/screen/opportunities/topic-details/HORIZON-MISS-2025-01-CLIMA-03?isExactMatch=true&status=31094501,31094502,31094503&order=DESC&pageNumber=8&pageSize=100&sortBy=startDate",2025-09-30
"Testing and demonstrating innovative solutions to improve resilience to extreme heat, including addressing health impacts","ec.europa.eu/info/funding-tenders/opportunities/portal/screen/opportunities/topic-details/HORIZON-MISS-2025-01-CLIMA-04?isExactMatch=true&status=31094501,31094502,31094503&order=DESC&pageNumber=8&pageSize=100&sortBy=startDate",2025-09-30
Quantifying the impact of farming practices on soil health in arable lands,"ec.europa.eu/info/funding-tenders/opportunities/portal/screen/opportunities/topic-details/HORIZON-MISS-2025-05-SOIL-06?isExactMatch=true&status=31094501,31094502,31094503&order=DESC&pageNumber=6&pageSize=100&sortBy=startDate",2025-09-30
Living Labs for soil remediation and green redevelopment of brownfields,"ec.europa.eu/info/funding-tenders/opportunities/portal/screen/opportunities/topic-details/HORIZON-MISS-2025-05-SOIL-01?isExactMatch=true&status=31094501,31094502,31094503&order=DESC&pageNumber=6&pageSize=100&sortBy=startDate",2025-09-30
Support to the operation and further development of soil-health science-policy interfaces and national soil-health hubs,"ec.europa.eu/info/funding-tenders/opportunities/portal/screen/opportunities/topic-details/HORIZON-MISS-2025-05-SOIL-08?isExactMatch=true&status=31094501,31094502,31094503&order=DESC&pageNumber=6&pageSize=100&sortBy=startDate",2025-09-30
OFFERR Call,"ec.europa.eu/info/funding-tenders/opportunities/portal/screen/opportunities/competitive-calls-cs/3876?isExactMatch=true&status=31094501,31094502,31094503&order=DESC&pageNumber=27&pageSize=100&sortBy=startDate",2025-09-30
Citizen engagement for sustainable land management through local and regional authorities,"ec.europa.eu/info/funding-tenders/opportunities/portal/screen/opportunities/topic-details/HORIZON-MISS-2025-05-SOIL-09?isExactMatch=true&status=31094501,31094502,31094503&order=DESC&pageNumber=6&pageSize=100&sortBy=startDate",2025-09-30
TALTECH MERIT Project Mobility Grant,"ec.europa.eu/info/funding-tenders/opportunities/portal/screen/opportunities/competitive-calls-cs/10822?isExactMatch=true&status=31094501,31094502,31094503&order=DESC&pageNumber=1&pageSize=100&sortBy=startDate",2025-09-30
TALTECH MERIT Project Excellence Scholarship Award,"ec.europa.eu/info/funding-tenders/opportunities/portal/screen/opportunities/competitive-calls-cs/10821?isExactMatch=true&status=31094501,31094502,31094503&order=DESC&pageNumber=1&pageSize=100&sortBy=startDate",2025-09-30
"2nd Call for applications for a grant to support the education and training of developers of cyber security solutions, within the framework of financial support to third parties","ec.europa.eu/info/funding-tenders/opportunities/portal/screen/opportunities/competitive-calls-cs/11270?isExactMatch=true&status=31094501,31094502,31094503&order=DESC&pageNumber=2&pageSize=100&sortBy=startDate",2025-09-30
CyberSecDome Open Call - Round 2,"ec.europa.eu/info/funding-tenders/opportunities/portal/screen/opportunities/competitive-calls-cs/11445?isExactMatch=true&status=31094501,31094502,31094503&order=DESC&pageNumber=2&pageSize=100&sortBy=startDate",2025-09-30
Connecting Spheres,"ec.europa.eu/info/funding-tenders/opportunities/portal/screen/opportunities/competitive-calls-cs/9064?isExactMatch=true&status=31094501,31094502,31094503&order=DESC&pageNumber=13&pageSize=100&sortBy=startDate",2025-09-30
Network on carbon farming and emissions reductions for agricultural and forest lands,"ec.europa.eu/info/funding-tenders/opportunities/portal/screen/opportunities/topic-details/HORIZON-MISS-2025-05-SOIL-10?isExactMatch=true&status=31094501,31094502,31094503&order=DESC&pageNumber=6&pageSize=100&sortBy=startDate",2025-09-30
Improved land suitability for soil health and sustainable biomass production,"ec.europa.eu/info/funding-tenders/opportunities/portal/screen/opportunities/topic-details/HORIZON-MISS-2025-05-SOIL-07?isExactMatch=true&status=31094501,31094502,31094503&order=DESC&pageNumber=6&pageSize=100&sortBy=startDate",2025-09-30
The promotion of handicraft products and support of craftsmen ,"ec.europa.eu/info/funding-tenders/opportunities/portal/screen/opportunities/topic-details/PPPA-MOVE-2025-P032404?isExactMatch=true&status=31094501,31094502,31094503&order=DESC&pageNumber=1&pageSize=100&sortBy=startDate",2025-09-30
Increasing environmental resilience through a better knowledge and management of the soil-water nexus,"ec.europa.eu/info/funding-tenders/opportunities/portal/screen/opportunities/topic-details/HORIZON-MISS-2025-05-SOIL-03?isExactMatch=true&status=31094501,31094502,31094503&order=DESC&pageNumber=6&pageSize=100&sortBy=startDate",2025-09-30
"Support to Civil Society Organisations in Albania in the field of Digital rights and civic space, and Transitional justice and democratic culture","ec.europa.eu/info/funding-tenders/opportunities/portal/screen/opportunities/prospect-details/184906PROSPECTSEN?isExactMatch=true&status=31094501,31094502,31094503&order=DESC&pageNumber=2&pageSize=100&sortBy=startDate",2025-09-30
AI Research Groups Lower Saxony,https://zukunft.niedersachsen.de/foerderangebot/ki-forschungsgruppen-niedersachsen/,2025-09-30
"Improving human capital and implementation of the institutional Policy of the National Vaccine Institute, Ghana","ec.europa.eu/info/funding-tenders/opportunities/portal/screen/opportunities/prospect-details/184869PROSPECTSEN?isExactMatch=true&status=31094501,31094502,31094503&order=DESC&pageNumber=2&pageSize=100&sortBy=startDate",2025-09-30
Call for applications for a grant to support the acquisition of accreditation for the EUCC certification scheme in the framework of financial support to third parties,"ec.europa.eu/info/funding-tenders/opportunities/portal/screen/opportunities/competitive-calls-cs/11382?isExactMatch=true&status=31094501,31094502,31094503&order=DESC&pageNumber=2&pageSize=100&sortBy=startDate",2025-09-30
AGRARIAN - Open Call # 2 (IMPLEMENT),"ec.europa.eu/info/funding-tenders/opportunities/portal/screen/opportunities/competitive-calls-cs/3983?isExactMatch=true&status=31094501,31094502,31094503&order=DESC&pageNumber=2&pageSize=100&sortBy=startDate",2025-09-30
"Migration, de-colonisation, slavery and multicultural European societies","ec.europa.eu/info/funding-tenders/opportunities/portal/screen/opportunities/topic-details/CERV-2025-CITIZENS-REM-HISTMIGRATION?isExactMatch=true&status=31094501,31094502,31094503&order=DESC&pageNumber=2&pageSize=100&sortBy=startDate",2025-10-01
"Call for proposals for action grants to support transnational projects in the fields of e-Justice, victims’ rights and procedural rights","ec.europa.eu/info/funding-tenders/opportunities/portal/screen/opportunities/topic-details/JUST-2025-JACC-EJUSTICE?isExactMatch=true&status=31094501,31094502,31094503&order=DESC&pageNumber=8&pageSize=100&sortBy=startDate",2025-10-01
NGI Zero Commons Fund (2025-10Z),"ec.europa.eu/info/funding-tenders/opportunities/portal/screen/opportunities/competitive-calls-cs/11089?isExactMatch=true&status=31094501,31094502,31094503&order=DESC&pageNumber=2&pageSize=100&sortBy=startDate",2025-10-01
"Strengthening the remembrance of the Holocaust, genocides, war crimes and crimes against humanity to reinforce democracy in the EU","ec.europa.eu/info/funding-tenders/opportunities/portal/screen/opportunities/topic-details/CERV-2025-CITIZENS-REM-GENCRIME?isExactMatch=true&status=31094501,31094502,31094503&order=DESC&pageNumber=2&pageSize=100&sortBy=startDate",2025-10-01
NGI TALER open call (2025-10T),"ec.europa.eu/info/funding-tenders/opportunities/portal/screen/opportunities/competitive-calls-cs/11088?isExactMatch=true&status=31094501,31094502,31094503&order=DESC&pageNumber=2&pageSize=100&sortBy=startDate",2025-10-01
Strengthening the remembrance of the Holocaust against Jewish people,"ec.europa.eu/info/funding-tenders/opportunities/portal/screen/opportunities/topic-details/CERV-2025-CITIZENS-REM-HOLOCAUSTJEW?isExactMatch=true&status=31094501,31094502,31094503&order=DESC&pageNumber=2&pageSize=100&sortBy=startDate",2025-10-01
NGI Fediversity open call (2025-10F),"ec.europa.eu/info/funding-tenders/opportunities/portal/screen/opportunities/competitive-calls-cs/11086?isExactMatch=true&status=31094501,31094502,31094503&order=DESC&pageNumber=2&pageSize=100&sortBy=startDate",2025-10-01
VILNIUS TECH MERIT Project 2nd Targeted Scholarship Call,"ec.europa.eu/info/funding-tenders/opportunities/portal/screen/opportunities/competitive-calls-cs/11261?isExactMatch=true&status=31094501,31094502,31094503&order=DESC&pageNumber=1&pageSize=100&sortBy=startDate",2025-10-01
"Democratic transition, (re-)building and strengthening society based on the rule of law, democracy and fundamental rights","ec.europa.eu/info/funding-tenders/opportunities/portal/screen/opportunities/topic-details/CERV-2025-CITIZENS-REM-TRANSITION?isExactMatch=true&status=31094501,31094502,31094503&order=DESC&pageNumber=2&pageSize=100&sortBy=startDate",2025-10-01
Support to the International HPC Summer School,"ec.europa.eu/info/funding-tenders/opportunities/portal/screen/opportunities/topic-details/HORIZON-EUROHPC-JU-2025-IHPCSS-02?isExactMatch=true&status=31094501,31094502,31094503&order=DESC&pageNumber=2&pageSize=100&sortBy=startDate",2025-10-02
GenAI4EU: Generative AI for Virtual Worlds:  Advanced technologies for better performance and hyper personalised and immersive experience (IA) (AI/Data/Robotics & Virtual Worlds Partnerships),"ec.europa.eu/info/funding-tenders/opportunities/portal/screen/opportunities/topic-details/HORIZON-CL4-2025-03-HUMAN-15?isExactMatch=true&status=31094501,31094502,31094503&order=DESC&pageNumber=3&pageSize=100&sortBy=startDate",2025-10-02
PartArt4OW Second Call,"ec.europa.eu/info/funding-tenders/opportunities/portal/screen/opportunities/competitive-calls-cs/11446?isExactMatch=true&status=31094501,31094502,31094503&order=DESC&pageNumber=2&pageSize=100&sortBy=startDate",2025-10-02
Financial Support to Third Party Programme in Poland,"ec.europa.eu/info/funding-tenders/opportunities/portal/screen/opportunities/competitive-calls-cs/11461?isExactMatch=true&status=31094501,31094502,31094503&order=DESC&pageNumber=2&pageSize=100&sortBy=startDate",2025-10-02
Core technologies for virtual worlds (RIA) (Virtual Worlds and Photonics Partnerships),"ec.europa.eu/info/funding-tenders/opportunities/portal/screen/opportunities/topic-details/HORIZON-CL4-2025-03-HUMAN-14?isExactMatch=true&status=31094501,31094502,31094503&order=DESC&pageNumber=3&pageSize=100&sortBy=startDate",2025-10-02
Digital solutions for regulatory compliance through data,"ec.europa.eu/info/funding-tenders/opportunities/portal/screen/opportunities/topic-details/DIGITAL-2025-AI-08-COMPLIANCE?isExactMatch=true&status=31094501,31094502,31094503&order=DESC&pageNumber=8&pageSize=100&sortBy=startDate",2025-10-02
Data Spaces Support Centre,"ec.europa.eu/info/funding-tenders/opportunities/portal/screen/opportunities/topic-details/DIGITAL-2025-AI-08-DS-SUPPORT?isExactMatch=true&status=31094501,31094502,31094503&order=DESC&pageNumber=8&pageSize=100&sortBy=startDate",2025-10-02
Robust and trustworthy GenerativeAI for Robotics and industrial automation (RIA) (AI/Data/Robotics & Made in Europe Partnerships),"ec.europa.eu/info/funding-tenders/opportunities/portal/screen/opportunities/topic-details/HORIZON-CL4-2025-03-DIGITAL-EMERGING-07?isExactMatch=true&status=31094501,31094502,31094503&order=DESC&pageNumber=3&pageSize=100&sortBy=startDate",2025-10-02
Strengthening the fabless Start-up and SME ecosystem in Europe (CSA),"ec.europa.eu/info/funding-tenders/opportunities/portal/screen/opportunities/topic-details/HORIZON-CL4-2025-03-DIGITAL-EMERGING-08?isExactMatch=true&status=31094501,31094502,31094503&order=DESC&pageNumber=3&pageSize=100&sortBy=startDate",2025-10-02
Post-exascale HPC (CSA),"ec.europa.eu/info/funding-tenders/opportunities/portal/screen/opportunities/topic-details/HORIZON-CL4-2025-03-DIGITAL-EMERGING-04?isExactMatch=true&status=31094501,31094502,31094503&order=DESC&pageNumber=3&pageSize=100&sortBy=startDate",2025-10-02
Specific support for the Virtual Worlds Partnership and the Web 4.0 initiative (CSA) (Virtual Worlds Partnership),"ec.europa.eu/info/funding-tenders/opportunities/portal/screen/opportunities/topic-details/HORIZON-CL4-2025-03-HUMAN-17?isExactMatch=true&status=31094501,31094502,31094503&order=DESC&pageNumber=3&pageSize=100&sortBy=startDate",2025-10-02
GenAI4EU central Hub (CSA) (AI/Data/Robotics Partnership),"ec.europa.eu/info/funding-tenders/opportunities/portal/screen/opportunities/topic-details/HORIZON-CL4-2025-03-HUMAN-18?isExactMatch=true&status=31094501,31094502,31094503&order=DESC&pageNumber=3&pageSize=100&sortBy=startDate",2025-10-02
Supporting Digital Partnerships in Quantum technologies (RIA),"ec.europa.eu/info/funding-tenders/opportunities/portal/screen/opportunities/topic-details/HORIZON-CL4-2025-03-DIGITAL-EMERGING-03?isExactMatch=true&status=31094501,31094502,31094503&order=DESC&pageNumber=3&pageSize=100&sortBy=startDate",2025-10-02
Drive the evolution of the internet towards open and interoperable Web 4.0 and Virtual Worlds: building blocks in priority areas (RIA) (Virtual Worlds Partnership),"ec.europa.eu/info/funding-tenders/opportunities/portal/screen/opportunities/topic-details/HORIZON-CL4-2025-03-HUMAN-16?isExactMatch=true&status=31094501,31094502,31094503&order=DESC&pageNumber=3&pageSize=100&sortBy=startDate",2025-10-02
"Fostering Innovative and Compliant Data Ecosystems (IA) (AI, Data and Robotics Partnership)","ec.europa.eu/info/funding-tenders/opportunities/portal/screen/opportunities/topic-details/HORIZON-CL4-2025-03-DATA-13?isExactMatch=true&status=31094501,31094502,31094503&order=DESC&pageNumber=3&pageSize=100&sortBy=startDate",2025-10-02
Open Internet Stack: development of technological commons/open-source 3C building blocks (RIA),"ec.europa.eu/info/funding-tenders/opportunities/portal/screen/opportunities/topic-details/HORIZON-CL4-2025-03-DATA-11?isExactMatch=true&status=31094501,31094502,31094503&order=DESC&pageNumber=3&pageSize=100&sortBy=startDate",2025-10-02
Software Engineering for AI and generative AI (RIA) (AI/Data/Robotics Partnership),"ec.europa.eu/info/funding-tenders/opportunities/portal/screen/opportunities/topic-details/HORIZON-CL4-2025-04-DATA-03?isExactMatch=true&status=31094501,31094502,31094503&order=DESC&pageNumber=3&pageSize=100&sortBy=startDate",2025-10-02
GenAI for Africa,"ec.europa.eu/info/funding-tenders/opportunities/portal/screen/opportunities/topic-details/HORIZON-CL4-2025-04-HUMAN-08?isExactMatch=true&status=31094501,31094502,31094503&order=DESC&pageNumber=3&pageSize=100&sortBy=startDate",2025-10-02
Enhanced Learning Strategies for General Purpose AI: Advancing GenAI4EU (RIA) (AI/Data/Robotics Partnership),"ec.europa.eu/info/funding-tenders/opportunities/portal/screen/opportunities/topic-details/HORIZON-CL4-2025-04-DIGITAL-EMERGING-07?isExactMatch=true&status=31094501,31094502,31094503&order=DESC&pageNumber=3&pageSize=100&sortBy=startDate",2025-10-02
Empowering AI/generative AI along the Cognitive Computing continuum (RIA) (AI/Data/Robotics Partnership),"ec.europa.eu/info/funding-tenders/opportunities/portal/screen/opportunities/topic-details/HORIZON-CL4-2025-04-DATA-02?isExactMatch=true&status=31094501,31094502,31094503&order=DESC&pageNumber=3&pageSize=100&sortBy=startDate",2025-10-02
Advanced sensor technologies and multimodal sensor integration for multiple application domains (IA) (Photonics Partnership),"ec.europa.eu/info/funding-tenders/opportunities/portal/screen/opportunities/topic-details/HORIZON-CL4-2025-04-DIGITAL-EMERGING-01?isExactMatch=true&status=31094501,31094502,31094503&order=DESC&pageNumber=3&pageSize=100&sortBy=startDate",2025-10-02
Preparing the Advancement of the state of the art of submarine cable infrastructures (CSA),"ec.europa.eu/info/funding-tenders/opportunities/portal/screen/opportunities/topic-details/HORIZON-CL4-2025-03-DATA-12?isExactMatch=true&status=31094501,31094502,31094503&order=DESC&pageNumber=3&pageSize=100&sortBy=startDate",2025-10-02
Assessment methodologies for General Purpose AI capabilities and risks (RIA) (AI/Data/Robotics Partnership),"ec.europa.eu/info/funding-tenders/opportunities/portal/screen/opportunities/topic-details/HORIZON-CL4-2025-04-DIGITAL-EMERGING-04?isExactMatch=true&status=31094501,31094502,31094503&order=DESC&pageNumber=3&pageSize=100&sortBy=startDate",2025-10-02
Roadmap for next generation computing technologies from IoT device level to edge to cloud to HPC (CSA),"ec.europa.eu/info/funding-tenders/opportunities/portal/screen/opportunities/topic-details/HORIZON-CL4-2025-03-DATA-10?isExactMatch=true&status=31094501,31094502,31094503&order=DESC&pageNumber=3&pageSize=100&sortBy=startDate",2025-10-02
Support to the secretariat for the Alliance on Processors and Semiconductor Technologies,"ec.europa.eu/info/funding-tenders/opportunities/portal/screen/opportunities/topic-details/DIGITAL-2025-AI-08-PROCESSOR?isExactMatch=true&status=31094501,31094502,31094503&order=DESC&pageNumber=8&pageSize=100&sortBy=startDate",2025-10-02
Apply AI: GenAI for the public administrations,"ec.europa.eu/info/funding-tenders/opportunities/portal/screen/opportunities/topic-details/DIGITAL-2025-AI-08-SUPPLY-AI?isExactMatch=true&status=31094501,31094502,31094503&order=DESC&pageNumber=8&pageSize=100&sortBy=startDate",2025-10-02
Multi-Country project in Agri-Food,"ec.europa.eu/info/funding-tenders/opportunities/portal/screen/opportunities/topic-details/DIGITAL-2025-AI-08-AGRIFOOD?isExactMatch=true&status=31094501,31094502,31094503&order=DESC&pageNumber=8&pageSize=100&sortBy=startDate",2025-10-02
Sectoral digital skills academies: Virtual Worlds Skills Academy,"ec.europa.eu/info/funding-tenders/opportunities/portal/screen/opportunities/topic-details/DIGITAL-2025-SKILLS-08-VIRTUAL-WORLDS-ACADEMY-STEP?isExactMatch=true&status=31094501,31094502,31094503&order=DESC&pageNumber=8&pageSize=100&sortBy=startDate",2025-10-02
Sectoral digital skills academies: Digital Skills Academy in GenAI,"ec.europa.eu/info/funding-tenders/opportunities/portal/screen/opportunities/topic-details/DIGITAL-2025-SKILLS-08-GENAI-ACADEMY-STEP?isExactMatch=true&status=31094501,31094502,31094503&order=DESC&pageNumber=8&pageSize=100&sortBy=startDate",2025-10-02
Sectoral digital skills academies: Quantum Skills Digital Academy,"ec.europa.eu/info/funding-tenders/opportunities/portal/screen/opportunities/topic-details/DIGITAL-2025-SKILLS-08-QUANTUM-ACADEMY-STEP?isExactMatch=true&status=31094501,31094502,31094503&order=DESC&pageNumber=8&pageSize=100&sortBy=startDate",2025-10-02
"Innovative Advanced Materials (IAMs) for conformable, flexible or stretchable electronics (RIA) (Innovative Advanced Materials for Europe partnership)","ec.europa.eu/info/funding-tenders/opportunities/portal/screen/opportunities/topic-details/HORIZON-CL4-2025-03-MATERIALS-47?isExactMatch=true&status=31094501,31094502,31094503&order=DESC&pageNumber=3&pageSize=100&sortBy=startDate",2025-10-02
International cooperation in semiconductors (CSA),"ec.europa.eu/info/funding-tenders/opportunities/portal/screen/opportunities/topic-details/HORIZON-CL4-2025-03-HUMAN-19?isExactMatch=true&status=31094501,31094502,31094503&order=DESC&pageNumber=3&pageSize=100&sortBy=startDate",2025-10-02
Challenge-Driven GenAI4EU Booster (RIA) (AI/Data/Robotics Partnership),"ec.europa.eu/info/funding-tenders/opportunities/portal/screen/opportunities/topic-details/HORIZON-CL4-2025-03-DIGITAL-EMERGING-09?isExactMatch=true&status=31094501,31094502,31094503&order=DESC&pageNumber=3&pageSize=100&sortBy=startDate",2025-10-02
Quantum Computing – complementing the quantum computing FPAs with the development of a technology agnostic software stack (RIA),"ec.europa.eu/info/funding-tenders/opportunities/portal/screen/opportunities/topic-details/HORIZON-CL4-2025-03-DIGITAL-EMERGING-02?isExactMatch=true&status=31094501,31094502,31094503&order=DESC&pageNumber=3&pageSize=100&sortBy=startDate",2025-10-02
"Large-scale pilots for supply end-to-end infrastructures integrating device, network computing and communication capabilities for Telco Edge Cloud deployments, as a basis for Connected Collaborative Computing Networks (3C networks) (RIA)","ec.europa.eu/info/funding-tenders/opportunities/portal/screen/opportunities/topic-details/HORIZON-CL4-2025-03-DATA-08?isExactMatch=true&status=31094501,31094502,31094503&order=DESC&pageNumber=3&pageSize=100&sortBy=startDate",2025-10-02
"Innovative Advanced Materials (IAMs) for photonics, enabling low-power and ultra-broadband performance for telecommunication (RIA) (Innovative Advanced Materials for Europe partnership)","ec.europa.eu/info/funding-tenders/opportunities/portal/screen/opportunities/topic-details/HORIZON-CL4-2025-03-MATERIALS-46?isExactMatch=true&status=31094501,31094502,31094503&order=DESC&pageNumber=3&pageSize=100&sortBy=startDate",2025-10-02
