title,link,deadline
European Researchers' Night and Researchers at Schools 2026-2027,"ec.europa.eu/info/funding-tenders/opportunities/portal/screen/opportunities/topic-details/HORIZON-MSCA-2025-CITIZENS-01-01?isExactMatch=true&status=31094501,31094502&order=DESC&pageNumber=1&pageSize=100&sortBy=startDate",22 October 2025
European Film sales agent,"ec.europa.eu/info/funding-tenders/opportunities/portal/screen/opportunities/topic-details/CREA-MEDIA-2025-FILMSALES?isExactMatch=true&status=31094501,31094502&order=DESC&pageNumber=1&pageSize=100&sortBy=startDate",19 June 2025
European mini-slate development,"ec.europa.eu/info/funding-tenders/opportunities/portal/screen/opportunities/topic-details/CREA-MEDIA-2025-DEVMINISLATE?isExactMatch=true&status=31094501,31094502&order=DESC&pageNumber=1&pageSize=100&sortBy=startDate",17 September 2025
Networks of European Cinemas,"ec.europa.eu/info/funding-tenders/opportunities/portal/screen/opportunities/topic-details/CREA-MEDIA-2025-CINNET?isExactMatch=true&status=31094501,31094502&order=DESC&pageNumber=1&pageSize=100&sortBy=startDate",16 July 2025
Second Call on Competence Centers,"ec.europa.eu/info/funding-tenders/opportunities/portal/screen/opportunities/topic-details/DIGITAL-JU-CHIPS-2024-SG-CCC-3?isExactMatch=true&status=31094501,31094502&order=DESC&pageNumber=1&pageSize=100&sortBy=startDate",04 March 2025
MSCA COFUND 2025,"ec.europa.eu/info/funding-tenders/opportunities/portal/screen/opportunities/topic-details/HORIZON-MSCA-2025-COFUND-01-01?isExactMatch=true&status=31094501,31094502&order=DESC&pageNumber=1&pageSize=100&sortBy=startDate",24 June 2025
Rights of the child and children’s participation,"ec.europa.eu/info/funding-tenders/opportunities/portal/screen/opportunities/topic-details/CERV-2025-CHILD?isExactMatch=true&status=31094501,31094502&order=DESC&pageNumber=1&pageSize=100&sortBy=startDate",29 April 2025
Citizens’ engagement and participation,"ec.europa.eu/info/funding-tenders/opportunities/portal/screen/opportunities/topic-details/CERV-2025-CITIZENS-CIV?isExactMatch=true&status=31094501,31094502&order=DESC&pageNumber=1&pageSize=100&sortBy=startDate",29 April 2025
Open Call for Financial Support to Third Parties as a mechanism to increase the number of Rural-Urban Enablers available to end-users,"ec.europa.eu/info/funding-tenders/opportunities/portal/screen/opportunities/competitive-calls-cs/9467?isExactMatch=true&status=31094501,31094502&order=DESC&pageNumber=1&pageSize=100&sortBy=startDate",31 March 2025
European Partnership on Innovative SMEs/Eurostars: joint transnational call for proposals (CALL 8 of Eurostars-3),"ec.europa.eu/info/funding-tenders/opportunities/portal/screen/opportunities/competitive-calls-cs/9685?isExactMatch=true&status=31094501,31094502&order=DESC&pageNumber=1&pageSize=100&sortBy=startDate",13 March 2025
dAIEDGE 2nd Open Call. Collaborative Projects.,"ec.europa.eu/info/funding-tenders/opportunities/portal/screen/opportunities/competitive-calls-cs/9562?isExactMatch=true&status=31094501,31094502&order=DESC&pageNumber=1&pageSize=100&sortBy=startDate",13 March 2025
Support to Green Upskilling & Training and Advisory Services to WISEs and SEEs -last places available ,"ec.europa.eu/info/funding-tenders/opportunities/portal/screen/opportunities/competitive-calls-cs/9722?isExactMatch=true&status=31094501,31094502&order=DESC&pageNumber=1&pageSize=100&sortBy=startDate",30 January 2025
EU-Ghana Youth Empowerment Programme,"ec.europa.eu/info/funding-tenders/opportunities/portal/screen/opportunities/prospect-details/182739PROSPECTSEN?isExactMatch=true&status=31094501,31094502&order=DESC&pageNumber=1&pageSize=100&sortBy=startDate",18 February 2025
Call for marine biodiversity (monitoring) data,"ec.europa.eu/info/funding-tenders/opportunities/portal/screen/opportunities/competitive-calls-cs/9642?isExactMatch=true&status=31094501,31094502&order=DESC&pageNumber=1&pageSize=100&sortBy=startDate",01 March 2025
Topic 1: School Education: Enhancing basic skills,"ec.europa.eu/info/funding-tenders/opportunities/portal/screen/opportunities/topic-details/ERASMUS-EDU-2025-PI-FORWARD-SCHOOL-BS?isExactMatch=true&status=31094501,31094502&order=DESC&pageNumber=1&pageSize=100&sortBy=startDate",27 May 2025
Topic 7: Digital education: Ethical and effective use of generative Artificial Intelligence  systems in education and training’,"ec.europa.eu/info/funding-tenders/opportunities/portal/screen/opportunities/topic-details/ERASMUS-EDU-2025-PI-FORWARD-DIGITAL-AI?isExactMatch=true&status=31094501,31094502&order=DESC&pageNumber=1&pageSize=100&sortBy=startDate",27 May 2025
"Topic 8: Digital education: Innovative data collection and exchange approaches in  primary, secondary education (including vocational education and training) for data-informed decision-making","ec.europa.eu/info/funding-tenders/opportunities/portal/screen/opportunities/topic-details/ERASMUS-EDU-2025-PI-FORWARD-DIGITAL-DM?isExactMatch=true&status=31094501,31094502&order=DESC&pageNumber=1&pageSize=100&sortBy=startDate",27 May 2025
Topic 2: Vocational Education and Training: Promote an enabling and supportive  environment for vocational excellence at national and/or regional level,"ec.europa.eu/info/funding-tenders/opportunities/portal/screen/opportunities/topic-details/ERASMUS-EDU-2025-PI-FORWARD-VET-VE?isExactMatch=true&status=31094501,31094502&order=DESC&pageNumber=1&pageSize=100&sortBy=startDate",27 May 2025
Topic 6: Digital education: Assessment of digital skills and competences,"ec.europa.eu/info/funding-tenders/opportunities/portal/screen/opportunities/topic-details/ERASMUS-EDU-2025-PI-FORWARD-DIGITAL-SC?isExactMatch=true&status=31094501,31094502&order=DESC&pageNumber=1&pageSize=100&sortBy=startDate",27 May 2025
Topic 4: Adult Learning: Support to the Pact for Skills,"ec.europa.eu/info/funding-tenders/opportunities/portal/screen/opportunities/topic-details/ERASMUS-EDU-2025-PI-FORWARD-ADULT-PS?isExactMatch=true&status=31094501,31094502&order=DESC&pageNumber=1&pageSize=100&sortBy=startDate",27 May 2025
Topic 5: Adult learning: Improving career guidance to support adults’ participation in training,"ec.europa.eu/info/funding-tenders/opportunities/portal/screen/opportunities/topic-details/ERASMUS-EDU-2025-PI-FORWARD-ADULT-CG?isExactMatch=true&status=31094501,31094502&order=DESC&pageNumber=1&pageSize=100&sortBy=startDate",27 May 2025
Topic 3: Vocational Education and Training: Development of joint VET qualifications  and modules,"ec.europa.eu/info/funding-tenders/opportunities/portal/screen/opportunities/topic-details/ERASMUS-EDU-2025-PI-FORWARD-VET-QM?isExactMatch=true&status=31094501,31094502&order=DESC&pageNumber=1&pageSize=100&sortBy=startDate",27 May 2025
XR2Industry 2nd Open Call for software integration,"ec.europa.eu/info/funding-tenders/opportunities/portal/screen/opportunities/competitive-calls-cs/9448?isExactMatch=true&status=31094501,31094502&order=DESC&pageNumber=1&pageSize=100&sortBy=startDate",18 February 2025
Networks of Towns,"ec.europa.eu/info/funding-tenders/opportunities/portal/screen/opportunities/topic-details/CERV-2025-CITIZENS-TOWN-NT?isExactMatch=true&status=31094501,31094502&order=DESC&pageNumber=1&pageSize=100&sortBy=startDate",27 March 2025
Pharmacogenomic strategies for personalised medicine approaches (PGxPM2025),"ec.europa.eu/info/funding-tenders/opportunities/portal/screen/opportunities/competitive-calls-cs/9543?isExactMatch=true&status=31094501,31094502&order=DESC&pageNumber=1&pageSize=100&sortBy=startDate",18 February 2025
Blockchain solutions for monitoring the multifunctionality of European forests,"ec.europa.eu/info/funding-tenders/opportunities/portal/screen/opportunities/competitive-calls-cs/9661?isExactMatch=true&status=31094501,31094502&order=DESC&pageNumber=1&pageSize=100&sortBy=startDate",17 March 2025
Capacity Building for the coordination of the Government policy to support MSMEs and the operationalisation of the National Network of Incubators (NNI),"ec.europa.eu/info/funding-tenders/opportunities/portal/screen/opportunities/prospect-details/183261PROSPECTSEN?isExactMatch=true&status=31094501,31094502&order=DESC&pageNumber=1&pageSize=100&sortBy=startDate",27 February 2025
SOUTIEN A L’ENGAGEMENT DE LA SOCIETE CIVILE POUR LA JEUNESSE SENEGALAISE : ENTREPRENEURIAT DES JEUNES PARTICIPATION PUBLIQUE ET CITOYENNE,"ec.europa.eu/info/funding-tenders/opportunities/portal/screen/opportunities/prospect-details/183021PROSPECTSEN?isExactMatch=true&status=31094501,31094502&order=DESC&pageNumber=1&pageSize=100&sortBy=startDate",04 February 2025
"Call for proposals for action grants to support transnational projects on judicial training covering civil law, criminal law or fundamental rights","ec.europa.eu/info/funding-tenders/opportunities/portal/screen/opportunities/topic-details/JUST-2025-JTRA?isExactMatch=true&status=31094501,31094502&order=DESC&pageNumber=1&pageSize=100&sortBy=startDate",26 March 2025
Call for proposals for action grants to promote judicial cooperation in civil and criminal matters,"ec.europa.eu/info/funding-tenders/opportunities/portal/screen/opportunities/topic-details/JUST-2025-JCOO?isExactMatch=true&status=31094501,31094502&order=DESC&pageNumber=1&pageSize=100&sortBy=startDate",23 April 2025
"Human Rights & Democracy thematic programme, Country Based Support Scheme for Kosovo allocation 2024-  Human Rights in the Digital Age","ec.europa.eu/info/funding-tenders/opportunities/portal/screen/opportunities/prospect-details/182019PROSPECTSEN?isExactMatch=true&status=31094501,31094502&order=DESC&pageNumber=1&pageSize=100&sortBy=startDate",03 February 2025
"ERDERA Joint Transnational Call 2025 ""Pre-clinical therapy studies for rare diseases using small molecules
and biologicals – development and validation""","ec.europa.eu/info/funding-tenders/opportunities/portal/screen/opportunities/competitive-calls-cs/9515?isExactMatch=true&status=31094501,31094502&order=DESC&pageNumber=1&pageSize=100&sortBy=startDate",13 February 2025
EP PerMed Fast Track,"ec.europa.eu/info/funding-tenders/opportunities/portal/screen/opportunities/competitive-calls-cs/9563?isExactMatch=true&status=31094501,31094502&order=DESC&pageNumber=1&pageSize=100&sortBy=startDate",13 March 2025
European co-development,"ec.europa.eu/info/funding-tenders/opportunities/portal/screen/opportunities/topic-details/CREA-MEDIA-2025-CODEV?isExactMatch=true&status=31094501,31094502&order=DESC&pageNumber=1&pageSize=100&sortBy=startDate",26 February 2025
Capacity Building in the Field of Sport,"ec.europa.eu/info/funding-tenders/opportunities/portal/screen/opportunities/topic-details/ERASMUS-SPORT-2025-CB?isExactMatch=true&status=31094501,31094502&order=DESC&pageNumber=1&pageSize=100&sortBy=startDate",05 March 2025
European Cooperation Projects Small Scale,"ec.europa.eu/info/funding-tenders/opportunities/portal/screen/opportunities/topic-details/CREA-CULT-2025-COOP-1?isExactMatch=true&status=31094501,31094502&order=DESC&pageNumber=1&pageSize=100&sortBy=startDate",13 May 2025
European Cooperation Projects Large Scale,"ec.europa.eu/info/funding-tenders/opportunities/portal/screen/opportunities/topic-details/CREA-CULT-2025-COOP-3?isExactMatch=true&status=31094501,31094502&order=DESC&pageNumber=1&pageSize=100&sortBy=startDate",13 May 2025
European Cooperation Projects Medium Scale,"ec.europa.eu/info/funding-tenders/opportunities/portal/screen/opportunities/topic-details/CREA-CULT-2025-COOP-2?isExactMatch=true&status=31094501,31094502&order=DESC&pageNumber=1&pageSize=100&sortBy=startDate",13 May 2025
Not-for-profit European sport events,"ec.europa.eu/info/funding-tenders/opportunities/portal/screen/opportunities/topic-details/ERASMUS-SPORT-2025-SNCESE?isExactMatch=true&status=31094501,31094502&order=DESC&pageNumber=1&pageSize=100&sortBy=startDate",05 March 2025
Small-scale Partnerships,"ec.europa.eu/info/funding-tenders/opportunities/portal/screen/opportunities/topic-details/ERASMUS-SPORT-2025-SSCP?isExactMatch=true&status=31094501,31094502&order=DESC&pageNumber=1&pageSize=100&sortBy=startDate",05 March 2025
Cooperation Partnerships,"ec.europa.eu/info/funding-tenders/opportunities/portal/screen/opportunities/topic-details/ERASMUS-SPORT-2025-SCP?isExactMatch=true&status=31094501,31094502&order=DESC&pageNumber=1&pageSize=100&sortBy=startDate",05 March 2025
Enhancing the role of Civil Society as Governance and Development Actors in Zambia (EGDAZ),"ec.europa.eu/info/funding-tenders/opportunities/portal/screen/opportunities/prospect-details/183222PROSPECTSEN?isExactMatch=true&status=31094501,31094502&order=DESC&pageNumber=1&pageSize=100&sortBy=startDate",10 February 2025
"Non-state actors and environmental, social and governance (ESG) practises","ec.europa.eu/info/funding-tenders/opportunities/portal/screen/opportunities/prospect-details/183017PROSPECTSEN?isExactMatch=true&status=31094501,31094502&order=DESC&pageNumber=1&pageSize=100&sortBy=startDate",06 February 2025
GOBEYOND Innovation,"ec.europa.eu/info/funding-tenders/opportunities/portal/screen/opportunities/competitive-calls-cs/9542?isExactMatch=true&status=31094501,31094502&order=DESC&pageNumber=1&pageSize=100&sortBy=startDate",31 January 2025
Zero Tolerance to Corruption,"ec.europa.eu/info/funding-tenders/opportunities/portal/screen/opportunities/prospect-details/183031PROSPECTSEN?isExactMatch=true&status=31094501,31094502&order=DESC&pageNumber=1&pageSize=100&sortBy=startDate",05 February 2025
Enhancement of natural resources management and reduction of vulnerabilities of local communities in Zimbabwe,"ec.europa.eu/info/funding-tenders/opportunities/portal/screen/opportunities/prospect-details/183200PROSPECTSEN?isExactMatch=true&status=31094501,31094502&order=DESC&pageNumber=1&pageSize=100&sortBy=startDate",17 February 2025
Support to Timor-Leste CSOs as actors of good governance and development,"ec.europa.eu/info/funding-tenders/opportunities/portal/screen/opportunities/prospect-details/183137PROSPECTSEN?isExactMatch=true&status=31094501,31094502&order=DESC&pageNumber=1&pageSize=100&sortBy=startDate",05 February 2025
Greener Futures: Promoting Sustainable Agribusiness and Climate-Smart Agriculture in Zimbabwe,"ec.europa.eu/info/funding-tenders/opportunities/portal/screen/opportunities/prospect-details/183211PROSPECTSEN?isExactMatch=true&status=31094501,31094502&order=DESC&pageNumber=1&pageSize=100&sortBy=startDate",17 February 2025
RURACTIVE Open Call for Innovators,"ec.europa.eu/info/funding-tenders/opportunities/portal/screen/opportunities/competitive-calls-cs/9383?isExactMatch=true&status=31094501,31094502&order=DESC&pageNumber=1&pageSize=100&sortBy=startDate",05 February 2025
BEFuture Acceleration Programme: Call for the selection of innovative projects to be awarded financial support under the BEFuture Project —101121580 — SMP-COSME-2022-TOURSME-01 on the topic of Sustainable growth and building resilience in tourism – empowering SMEs to carry out the twin transition.,"ec.europa.eu/info/funding-tenders/opportunities/portal/screen/opportunities/competitive-calls-cs/9509?isExactMatch=true&status=31094501,31094502&order=DESC&pageNumber=1&pageSize=100&sortBy=startDate",05 February 2025
Open Call: Textile and clothing industry facilitators in Athens and Rotterdam,"ec.europa.eu/info/funding-tenders/opportunities/portal/screen/opportunities/competitive-calls-cs/9561?isExactMatch=true&status=31094501,31094502&order=DESC&pageNumber=1&pageSize=100&sortBy=startDate",04 February 2025
European Festivals,"ec.europa.eu/info/funding-tenders/opportunities/portal/screen/opportunities/topic-details/CREA-MEDIA-2025-FEST?isExactMatch=true&status=31094501,31094502&order=DESC&pageNumber=1&pageSize=100&sortBy=startDate",11 March 2025
Capacity building in VET in South Mediterranean Countries,"ec.europa.eu/info/funding-tenders/opportunities/portal/screen/opportunities/topic-details/ERASMUS-EDU-2025-CB-VET-SMC?isExactMatch=true&status=31094501,31094502&order=DESC&pageNumber=1&pageSize=100&sortBy=startDate",27 February 2025
Erasmus+ Virtual Exchanges in South Mediterranean Countries,"ec.europa.eu/info/funding-tenders/opportunities/portal/screen/opportunities/topic-details/ERASMUS-EDU-2025-VIRT-EXCH-SMC?isExactMatch=true&status=31094501,31094502&order=DESC&pageNumber=1&pageSize=100&sortBy=startDate",29 April 2025
Erasmus+ Virtual Exchanges in Neighbourhood East,"ec.europa.eu/info/funding-tenders/opportunities/portal/screen/opportunities/topic-details/ERASMUS-EDU-2025-VIRT-EXCH-NE?isExactMatch=true&status=31094501,31094502&order=DESC&pageNumber=1&pageSize=100&sortBy=startDate",29 April 2025
Erasmus+ Virtual Exchanges in Sub-Saharan Africa,"ec.europa.eu/info/funding-tenders/opportunities/portal/screen/opportunities/topic-details/ERASMUS-EDU-2025-VIRT-EXCH-SSA?isExactMatch=true&status=31094501,31094502&order=DESC&pageNumber=1&pageSize=100&sortBy=startDate",29 April 2025
Erasmus+ Virtual Exchanges in Western Balkans,"ec.europa.eu/info/funding-tenders/opportunities/portal/screen/opportunities/topic-details/ERASMUS-EDU-2025-VIRT-EXCH-WB?isExactMatch=true&status=31094501,31094502&order=DESC&pageNumber=1&pageSize=100&sortBy=startDate",29 April 2025
Alliances for Sectoral Cooperation on Skills (implementing the ‘Blueprint'),"ec.europa.eu/info/funding-tenders/opportunities/portal/screen/opportunities/topic-details/ERASMUS-EDU-2025-PI-ALL-INNO-BLUEPRINT?isExactMatch=true&status=31094501,31094502&order=DESC&pageNumber=1&pageSize=100&sortBy=startDate",06 March 2025
Capacity building in VET in Latin America,"ec.europa.eu/info/funding-tenders/opportunities/portal/screen/opportunities/topic-details/ERASMUS-EDU-2025-CB-VET-LA?isExactMatch=true&status=31094501,31094502&order=DESC&pageNumber=1&pageSize=100&sortBy=startDate",27 February 2025
Erasmus+ Teacher Academies,"ec.europa.eu/info/funding-tenders/opportunities/portal/screen/opportunities/topic-details/ERASMUS-EDU-2025-PEX-TEACH-ACA?isExactMatch=true&status=31094501,31094502&order=DESC&pageNumber=1&pageSize=100&sortBy=startDate",26 March 2025
Alliances for Education and Enterprises,"ec.europa.eu/info/funding-tenders/opportunities/portal/screen/opportunities/topic-details/ERASMUS-EDU-2025-PI-ALL-INNO-EDU-ENTERP?isExactMatch=true&status=31094501,31094502&order=DESC&pageNumber=1&pageSize=100&sortBy=startDate",06 March 2025
European Youth Together 2025,"ec.europa.eu/info/funding-tenders/opportunities/portal/screen/opportunities/topic-details/ERASMUS-YOUTH-2025-YOUTH-TOG?isExactMatch=true&status=31094501,31094502&order=DESC&pageNumber=1&pageSize=100&sortBy=startDate",06 March 2025
Capacity building in VET in Neighbourhood East,"ec.europa.eu/info/funding-tenders/opportunities/portal/screen/opportunities/topic-details/ERASMUS-EDU-2025-CB-VET-NE?isExactMatch=true&status=31094501,31094502&order=DESC&pageNumber=1&pageSize=100&sortBy=startDate",27 February 2025
Capacity building in VET in Sub-Saharan Africa,"ec.europa.eu/info/funding-tenders/opportunities/portal/screen/opportunities/topic-details/ERASMUS-EDU-2025-CB-VET-SSA?isExactMatch=true&status=31094501,31094502&order=DESC&pageNumber=1&pageSize=100&sortBy=startDate",27 February 2025
Capacity Building in the field of Youth in Sub-Saharan Africa,"ec.europa.eu/info/funding-tenders/opportunities/portal/screen/opportunities/topic-details/ERASMUS-YOUTH-2025-CB-SSA?isExactMatch=true&status=31094501,31094502&order=DESC&pageNumber=1&pageSize=100&sortBy=startDate",06 March 2025
Capacity Building in the field of Youth in Western Balkans,"ec.europa.eu/info/funding-tenders/opportunities/portal/screen/opportunities/topic-details/ERASMUS-YOUTH-2025-CB-WB?isExactMatch=true&status=31094501,31094502&order=DESC&pageNumber=1&pageSize=100&sortBy=startDate",06 March 2025
Capacity building in VET in Western Balkans,"ec.europa.eu/info/funding-tenders/opportunities/portal/screen/opportunities/topic-details/ERASMUS-EDU-2025-CB-VET-WB?isExactMatch=true&status=31094501,31094502&order=DESC&pageNumber=1&pageSize=100&sortBy=startDate",27 February 2025
Partnerships for Cooperation - Cooperation Partnerships in the field of education and training submitted by European NGOs,"ec.europa.eu/info/funding-tenders/opportunities/portal/screen/opportunities/topic-details/ERASMUS-EDU-2025-PCOOP-ENGO?isExactMatch=true&status=31094501,31094502&order=DESC&pageNumber=1&pageSize=100&sortBy=startDate",05 March 2025
Capacity building in VET in Caribbean,"ec.europa.eu/info/funding-tenders/opportunities/portal/screen/opportunities/topic-details/ERASMUS-EDU-2025-CB-VET-CA?isExactMatch=true&status=31094501,31094502&order=DESC&pageNumber=1&pageSize=100&sortBy=startDate",27 February 2025
Capacity Building in the field of Youth in Neighborhood East,"ec.europa.eu/info/funding-tenders/opportunities/portal/screen/opportunities/topic-details/ERASMUS-YOUTH-2025-CB-NE?isExactMatch=true&status=31094501,31094502&order=DESC&pageNumber=1&pageSize=100&sortBy=startDate",06 March 2025
Capacity Building in the field of Youth in South Mediterranean Countries,"ec.europa.eu/info/funding-tenders/opportunities/portal/screen/opportunities/topic-details/ERASMUS-YOUTH-2025-CB-SMC?isExactMatch=true&status=31094501,31094502&order=DESC&pageNumber=1&pageSize=100&sortBy=startDate",06 March 2025
Cooperation Partnerships in the field of Youth,"ec.europa.eu/info/funding-tenders/opportunities/portal/screen/opportunities/topic-details/ERASMUS-YOUTH-2025-PCOOP-ENGO?isExactMatch=true&status=31094501,31094502&order=DESC&pageNumber=1&pageSize=100&sortBy=startDate",05 March 2025
Centres of Vocational Excellence,"ec.europa.eu/info/funding-tenders/opportunities/portal/screen/opportunities/topic-details/ERASMUS-EDU-2025-PEX-COVE?isExactMatch=true&status=31094501,31094502&order=DESC&pageNumber=1&pageSize=100&sortBy=startDate",11 June 2025
European Film Distribution,"ec.europa.eu/info/funding-tenders/opportunities/portal/screen/opportunities/topic-details/CREA-MEDIA-2025-FILMDIST?isExactMatch=true&status=31094501,31094502&order=DESC&pageNumber=1&pageSize=100&sortBy=startDate",24 April 2025
Convocatoria de Propuestas México - 2024,"ec.europa.eu/info/funding-tenders/opportunities/portal/screen/opportunities/prospect-details/180938PROSPECTSEN?isExactMatch=true&status=31094501,31094502&order=DESC&pageNumber=1&pageSize=100&sortBy=startDate",31 January 2025
Support to Ukraine and Moldova border regions,"ec.europa.eu/info/funding-tenders/opportunities/portal/screen/opportunities/topic-details/ERDFTA-2024-SUPPORTUMBR?isExactMatch=true&status=31094501,31094502&order=DESC&pageNumber=1&pageSize=100&sortBy=startDate",04 February 2025
Teaming for Excellence,"ec.europa.eu/info/funding-tenders/opportunities/portal/screen/opportunities/topic-details/HORIZON-WIDERA-2025-ACCESS-01-01-two-stage?isExactMatch=true&status=31094501,31094502&order=DESC&pageNumber=1&pageSize=100&sortBy=startDate",10 April 2025
Innovation Fund 2024 Net Zero Technologies – General decarbonisation – Medium-Scale Projects,"ec.europa.eu/info/funding-tenders/opportunities/portal/screen/opportunities/topic-details/INNOVFUND-2024-NZT-GENERAL-MSP?isExactMatch=true&status=31094501,31094502&order=DESC&pageNumber=1&pageSize=100&sortBy=startDate",24 April 2025
Innovation Fund 2024 Net Zero Technologies – General decarbonisation – Large-Scale Projects,"ec.europa.eu/info/funding-tenders/opportunities/portal/screen/opportunities/topic-details/INNOVFUND-2024-NZT-GENERAL-LSP?isExactMatch=true&status=31094501,31094502&order=DESC&pageNumber=1&pageSize=100&sortBy=startDate",24 April 2025
Innovation Fund 2024 Net Zero Technologies – Clean-tech manufacturing,"ec.europa.eu/info/funding-tenders/opportunities/portal/screen/opportunities/topic-details/INNOVFUND-2024-NZT-CLEAN-TECH-MANUFACTURING?isExactMatch=true&status=31094501,31094502&order=DESC&pageNumber=1&pageSize=100&sortBy=startDate",24 April 2025
Innovation Fund 2024 - Batteries - Manufacturing of electric vehicles battery cells,"ec.europa.eu/info/funding-tenders/opportunities/portal/screen/opportunities/topic-details/INNOVFUND-2024-BATT-EV-CELLS?isExactMatch=true&status=31094501,31094502&order=DESC&pageNumber=1&pageSize=100&sortBy=startDate",24 April 2025
Innovation Fund 2024 Net Zero Technologies – General decarbonisation – Small-Scale Projects,"ec.europa.eu/info/funding-tenders/opportunities/portal/screen/opportunities/topic-details/INNOVFUND-2024-NZT-GENERAL-SSP?isExactMatch=true&status=31094501,31094502&order=DESC&pageNumber=1&pageSize=100&sortBy=startDate",24 April 2025
Innovation Fund 2024 Net Zero Technologies – Pilot projects,"ec.europa.eu/info/funding-tenders/opportunities/portal/screen/opportunities/topic-details/INNOVFUND-2024-NZT-PILOTS?isExactMatch=true&status=31094501,31094502&order=DESC&pageNumber=1&pageSize=100&sortBy=startDate",24 April 2025
Capacity building in the field of higher education Strand 2,"ec.europa.eu/info/funding-tenders/opportunities/portal/screen/opportunities/topic-details/ERASMUS-EDU-2025-CBHE-STRAND-2?isExactMatch=true&status=31094501,31094502&order=DESC&pageNumber=1&pageSize=100&sortBy=startDate",06 February 2025
Capacity building in the field of higher education Strand 3,"ec.europa.eu/info/funding-tenders/opportunities/portal/screen/opportunities/topic-details/ERASMUS-EDU-2025-CBHE-STRAND-3?isExactMatch=true&status=31094501,31094502&order=DESC&pageNumber=1&pageSize=100&sortBy=startDate",06 February 2025
Volunteering Teams in High Priority Areas (VTHPA),"ec.europa.eu/info/funding-tenders/opportunities/portal/screen/opportunities/topic-details/ESC-SOLID-2025-VTHPA?isExactMatch=true&status=31094501,31094502&order=DESC&pageNumber=1&pageSize=100&sortBy=startDate",11 February 2025
Capacity building in the field of higher education Strand 1,"ec.europa.eu/info/funding-tenders/opportunities/portal/screen/opportunities/topic-details/ERASMUS-EDU-2025-CBHE-STRAND-1?isExactMatch=true&status=31094501,31094502&order=DESC&pageNumber=1&pageSize=100&sortBy=startDate",06 February 2025
